fixed tweet,tweet length,number of words,number of lines,number of short words,upload hour,tweet source code,included media(?),number of user mentions,number of links,number of hashtags,emojis,pcfg rules,negativity score,neutrality score,positivity score,part of speech tagging
"Heartiest congratulations Pvsindhu on becoming the first Indian to win a at the . What a feat to achieve,  you completely smashed it ",133,23,1,14,16,1,0,1,0,1,游녪:2,"{""NP"": {""DT#JJ#JJ"": 1, ""DT#QP"": 1}, ""QP"": {""IN#DT"": 1}, ""VP"": {""VBG#NP#S"": 1, ""VBZ#NP#PP"": 1, ""VB"": 1, ""VBD#NP"": 1}, ""S"": {""SBAR#,#NP#ADVP#VP"": 1}, ""PP"": {""IN#S"": 1}, ""WHNP"": {""WP"": 1}, ""SBAR"": {""WHNP#S"": 1}}",0.0,0.7,0.3,"{""A"": 2, ""N"": 2, ""^"": 2, ""P"": 4, ""V"": 4, ""D"": 4, "","": 2, ""O"": 3, ""R"": 1}"
Been seeing heart-breaking & alarming pictures of the Amazon rainforest which has been on fire since more than 2 weeks!It is responsible for 20% of the worlds oxygen.This affects each one of us...the earth may survive climate change but we wont.  ,247,41,1,22,8,1,0,0,0,2,,"{""NP"": {""NN#CC#NN#NNS"": 1, ""DT#NNP#NN"": 1, ""QP#NN"": 1, ""NP#PP#SBAR"": 1, ""CD#NN"": 1, ""DT#NNS#NNS"": 1, ""NN#NN"": 1}, ""WHNP"": {""WDT"": 1}, ""QP"": {""JJR#IN#CD"": 1}, ""VP"": {""VBN#PP#PP"": 1, ""VBZ#VP"": 1, ""VBG#NP"": 1, ""VBN#VP"": 1, ""VBZ#NP"": 1, ""VBZ#ADJP#SBAR"": 1, ""MD#VP"": 1, ""VBP"": 1}, ""S"": {""S#VP"": 1, ""S#CC#S"": 1, ""S#:#S#."": 1}, ""SBAR"": {""WHNP#S"": 1, ""IN#S"": 1}, ""ADJP"": {""JJ"": 1}}",0.072,0.849,0.08,"{""V"": 9, ""A"": 4, ""&"": 2, ""N"": 8, ""P"": 7, ""D"": 5, ""^"": 2, ""$"": 3, "","": 4, ""O"": 4}"
This is amazing! Glad to know about this future scientist and learn about his Mission Mangal  Wishing him all the very best :),126,23,1,14,5,1,0,0,1,0,,"{""NP"": {""DT"": 1, ""DT#JJ#NN"": 1, ""PRP$#NNP#NNP#NNP"": 1, ""DT#RB"": 1}, ""ADJP"": {""JJ"": 1}, ""VP"": {""VBZ#ADJP"": 1, ""VB#PP"": 2, ""VP#CC#VP#NP"": 1, ""VBN#S#PP#-RRB-"": 1}, ""ROOT"": {""VP"": 1}, ""PP"": {""RB#FRAG"": 1}, ""ADVP"": {""NP#RB"": 1}, ""FRAG"": {""ADVP#:"": 1}}",0.0,0.518,0.482,"{""O"": 2, ""V"": 4, ""A"": 3, "","": 1, ""P"": 3, ""D"": 4, ""N"": 4, ""&"": 1, ""R"": 1, ""E"": 1}"
Nithya Menen Kirti Kulhari,26,4,1,0,8,1,0,2,0,0,,"{""NP"": {""NNP#NNP#NNP#NNP"": 1}, ""ROOT"": {""NP"": 1}}",0.0,1.0,0.0,"{""^"": 4}"
"Growing up I was always inclined towards sports & my mom ensured I got nutritious home-cooked meals to fuel my passion.But 11,72,604 children in India cant afford even a single meal a day!Its time to ask  with SavetheChildrenIndia.I nominate vidya balan taapsee pannu Sonakshi Sinha",282,45,1,21,8,1,1,4,0,1,,"{""ADVP"": {""RB#RB"": 1}, ""NP"": {""NP#CC#NP"": 1, ""JJ#JJ#NNS"": 1, ""PRP$#JJ#CD#NNS"": 1, ""RB#DT#JJ#NN"": 1, ""DT#JJ#NN"": 1, ""NP#NP#S"": 1, ""NN#NN#NN#NNP#NNP#NNP"": 1}, ""VP"": {""VBN#PP"": 1, ""VBD#ADVP#VP"": 1, ""VB#PP"": 1, ""VB#S"": 1, ""VBD#NP#S"": 1, ""VBD#SBAR"": 1}, ""S"": {""ADVP#NP#VP"": 1}, ""SBAR"": {""S"": 1}, ""SINV"": {""S#VP#NP"": 1}, ""ROOT"": {""SINV"": 1}}",0.0,0.951,0.049,"{""V"": 10, ""T"": 1, ""O"": 3, ""R"": 2, ""P"": 5, ""N"": 9, ""&"": 2, ""D"": 4, ""A"": 2, "","": 3, ""$"": 1, ""^"": 8, ""L"": 1}"
Thank you Neha :),17,4,1,3,4,1,0,0,1,0,,"{""S"": {""NP#NP"": 1}, ""VP"": {""VB#S"": 1, ""JJ"": 1, ""VP#:#VP"": 1}}",0.0,0.267,0.733,"{""V"": 1, ""O"": 1, ""^"": 1, ""E"": 1}"
Thank you and the entire team at Fox...always a pleasure. Looking forward to repeating the magic with  :),105,18,1,10,2,1,0,0,1,1,,"{""NP"": {""DT#JJ#NN"": 1}, ""VP"": {""NP#PP"": 1, ""VP#CC#VP"": 1, ""ADVP#NP"": 1, ""VP#:#VP"": 1, ""VBZ#S#PP#:"": 1}, ""PP"": {""IN"": 1}, ""S"": {""VP#."": 1}, ""ROOT"": {""PRN"": 1}, ""PRN"": {""S#-RRB-"": 1}}",0.0,0.603,0.397,"{""V"": 3, ""O"": 1, ""&"": 1, ""D"": 3, ""A"": 1, ""N"": 3, ""P"": 3, ""^"": 1, "","": 2, ""R"": 2, ""E"": 1}"
"Please say thank you to Aashna, it is indeed beautiful :)",57,11,1,6,13,1,0,0,1,0,,"{""NP"": {""NP#,#SBAR#:"": 1}, ""ADJP"": {""JJ"": 1}, ""VP"": {""VBZ#ADVP#ADJP"": 1, ""VB#NP#PP"": 1, ""VBP#VP"": 1}, ""SBAR"": {""S"": 1}, ""PRN"": {""S#-RRB-"": 1}, ""ROOT"": {""PRN"": 1}}",0.0,0.374,0.626,"{""V"": 4, ""O"": 2, ""P"": 1, ""^"": 1, "","": 1, ""R"": 1, ""A"": 1, ""E"": 1}"
"So glad to know little kids are understanding and learning from the film, we tried our best to keep it simple. The whole idea is to spark their curiosity about the world of science. Big hug to her ",197,38,1,25,10,1,0,0,1,0,,"{""NP"": {""JJ#NNS"": 1, ""PRP$#JJS"": 1, ""DT#JJ#NN"": 1, ""NP#NP"": 1}, ""VP"": {""VBG#CC#VBG#PP"": 1, ""VBP#VP"": 1, ""VB#S"": 1, ""VBD#NP#S"": 1, ""VB#NP#PP"": 1, ""VBZ#S"": 1}, ""S"": {""ADJP"": 1, ""ADVP#S#VP"": 1, ""NP#ADJP"": 1, ""S#,#NP#VP#."": 1}, ""ADJP"": {""JJ#S"": 1, ""JJ"": 1}, ""ROOT"": {""NP"": 1}}",0.0,0.731,0.269,"{""R"": 1, ""A"": 6, ""P"": 7, ""V"": 8, ""N"": 7, ""&"": 1, ""D"": 5, "","": 3, ""O"": 3}"
Thank you :),12,3,1,2,3,1,0,0,1,0,,"{""VP"": {""JJ"": 1, ""VP#:#VP"": 1}}",0.0,0.154,0.846,"{""V"": 1, ""O"": 1, ""E"": 1}"
"Had a super fun, interactive and enlightening meeting with the future scientists at INOX Leisure Ltd. today morning. The future definitely looks bright ",152,23,1,10,11,2,1,1,0,0,游때:1,"{""NP"": {""DT#JJ#NN"": 1, ""ADJP#NN"": 1, ""NP#,#NP"": 1, ""DT#JJ#NNS"": 1, ""NNP#NNP#NNP"": 1, ""NP#PP#NP"": 1}, ""ADJP"": {""JJ#CC#JJ"": 1, ""JJ"": 1}, ""VP"": {""VBD#NP#PP#NP"": 1, ""ADVP#VBZ#ADJP"": 1}, ""S"": {""VP#."": 1}}",0.0,0.514,0.486,"{""V"": 2, ""D"": 3, ""A"": 5, ""N"": 6, "","": 3, ""&"": 1, ""P"": 2, ""^"": 3, ""R"": 1}"
Thank you ,10,2,1,1,8,1,0,0,1,0,"游똂:1,游낕:1",{},0.0,0.286,0.714,"{""V"": 1, ""O"": 1}"
"This picture made my day...this was the motive behind making the the film, to inspire more kids and develop an interest in science. This is real success for me, not the box office numbers. Thank you so much for sharing ",219,40,1,25,6,1,0,0,1,0,,"{""NP"": {""DT"": 2, ""DT#DT#NN"": 1, ""JJR#NNS"": 1, ""JJ#NN"": 1, ""NN#NNS"": 1, ""NP#NP"": 1, ""NP#,#RB#NP"": 1}, ""VP"": {""VBD#NP"": 1, ""VBG#NP"": 1, ""VP#CC#VP"": 1, ""VBD#NP#PP#,#S"": 1, ""VBZ#NP"": 1, ""VBG"": 1, ""VB#S"": 1}, ""S"": {""S#:#S#."": 1, ""NP#ADJP"": 1}, ""PP"": {""IN#S"": 2}, ""ADJP"": {""RB#JJ#PP"": 1}}",0.0,0.687,0.313,"{""D"": 7, ""N"": 11, ""V"": 8, "","": 5, ""O"": 4, ""P"": 5, ""A"": 2, ""&"": 1, ""R"": 3}"
,0,0,0,0,6,1,0,0,1,0,"游똂:2,游낕:2",{},0.0,0.0,0.0,{}
Big hug to him ,15,4,1,4,6,1,0,0,1,0,,"{""NP"": {""NP#NP"": 1}, ""ROOT"": {""NP"": 1}}",0.0,0.492,0.508,"{""A"": 1, ""N"": 1, ""P"": 1, ""O"": 1}"
Thank you Rahul,15,3,1,1,6,1,0,0,1,0,,"{""S"": {""NP#NP"": 1}, ""VP"": {""VB#S"": 1}}",0.0,0.444,0.556,"{""V"": 1, ""O"": 1, ""^"": 1}"
Thank you ,10,2,1,1,6,1,0,0,1,0,"游똂:1,游낕:1",{},0.0,0.286,0.714,"{""V"": 1, ""O"": 1}"
Yes it was all Jagan's hard work and efforts. Glad you and your family enjoyed the film :),90,18,1,14,5,3,0,0,1,0,,"{""NP"": {""NNP#POS"": 1, ""NP#JJ#NN#CC#NNS"": 1, ""NP#NP"": 1, ""NP#CC#NP"": 1}, ""VP"": {""VBD#RB#NP"": 1}, ""S"": {""ADVP#NP#VP#."": 1}, ""ROOT"": {""PRN"": 1}, ""PP"": {""IN#NP#:"": 1}, ""PRN"": {""NP#-RRB-"": 1}}",0.053,0.492,0.455,"{""!"": 1, ""O"": 2, ""V"": 2, ""D"": 3, ""Z"": 1, ""A"": 2, ""N"": 4, ""&"": 2, "","": 1, ""E"": 1}"
Wow! Thats some dedication I hope youll enjoyed the trip to Mars,64,12,1,8,5,1,0,0,1,0,游땳:1,"{""INTJ"": {""UH#."": 1}, ""ROOT"": {""INTJ"": 1}, ""NP"": {""NP#SBAR"": 1}, ""VP"": {""VBD#NP#PP"": 1, ""VBP#SBAR"": 1}, ""SBAR"": {""S"": 2}}",0.0,0.437,0.563,"{""!"": 1, "","": 1, ""L"": 2, ""D"": 2, ""N"": 2, ""O"": 1, ""V"": 2, ""P"": 1, ""^"": 1}"
So good to know the kids had a good time :),43,11,1,11,5,3,0,0,1,0,,"{""NP"": {""RB"": 1, ""DT#NNS"": 1, ""DT#JJ#NN"": 1, ""NP#SBAR"": 1}, ""VP"": {""VBD#NP"": 1}, ""S"": {""VP#:"": 1, ""NP#ADJP"": 1}, ""SBAR"": {""S"": 1}, ""ADJP"": {""JJ#S"": 1}, ""PRN"": {""S#-RRB-"": 1}, ""ROOT"": {""PRN"": 1}}",0.0,0.427,0.573,"{""R"": 1, ""A"": 2, ""P"": 1, ""V"": 2, ""D"": 2, ""N"": 2, ""E"": 1}"
Thank you Atul :),17,4,1,3,5,1,0,0,1,0,,"{""S"": {""NP#NP"": 1}, ""VP"": {""VB#S"": 1, ""JJ"": 1, ""VP#:#VP"": 1}}",0.0,0.267,0.733,"{""V"": 1, ""O"": 1, ""^"": 1, ""E"": 1}"
"Thank you, hope she liked the film ",35,7,1,5,5,1,0,0,1,0,"游똂:1,游낕:1","{""VP"": {""VBD#NP"": 1, ""VB#SBAR"": 1, ""VB#S"": 1}, ""S"": {""NP#,#VP"": 1}, ""SBAR"": {""S"": 1}}",0.0,0.328,0.672,"{""V"": 3, ""O"": 2, "","": 1, ""D"": 1, ""N"": 1}"
Thank you Sophie,16,3,1,1,5,1,0,0,1,0,,"{""ADJP"": {""JJ"": 1}, ""S"": {""NP#ADJP"": 1}, ""VP"": {""VB#S"": 1}}",0.0,0.444,0.556,"{""V"": 1, ""O"": 1, ""^"": 1}"
Thank you,9,2,1,1,5,1,0,0,1,0,,{},0.0,0.286,0.714,"{""V"": 1, ""O"": 1}"
"Glad to see this, I hope they enjoyed the film :)",49,11,1,9,5,1,0,0,1,0,,"{""NP"": {""DT"": 1, ""NP#SBAR"": 1}, ""VP"": {""VBD#NP"": 1, ""VBP#NP"": 1, ""VB#PRN"": 1, ""VBN#S"": 1}, ""S"": {""VP#:"": 1, ""NP#,#NP#VP"": 1}, ""SBAR"": {""S"": 1}, ""PRN"": {""S#-RRB-"": 1}, ""ROOT"": {""VP"": 1}}",0.0,0.321,0.679,"{""A"": 1, ""P"": 1, ""V"": 3, ""D"": 2, "","": 1, ""O"": 2, ""N"": 1, ""E"": 1}"
Thank you ,10,2,1,1,5,1,0,0,1,0,"游똂:1,游낕:1",{},0.0,0.286,0.714,"{""V"": 1, ""O"": 1}"
Thank you so much ,18,4,1,3,5,1,0,0,1,0,"游똂:1,游낕:1","{""ADJP"": {""RB#JJ"": 1}, ""S"": {""NP#ADJP"": 1}, ""VP"": {""VB#S"": 1}}",0.0,0.545,0.455,"{""V"": 1, ""O"": 1, ""R"": 1, ""A"": 1}"
Glad you enjoyed it :),22,5,1,4,4,1,0,0,1,0,,"{""NP"": {""JJ#NN"": 1, ""NP#PP#-RRB-"": 1}, ""PP"": {""IN#NP#:"": 1}, ""ROOT"": {""NP"": 1}}",0.0,0.177,0.823,"{""A"": 1, ""O"": 2, ""V"": 1, ""E"": 1}"
Thank you Kriti :),18,4,1,2,4,1,0,0,1,0,,"{""S"": {""NP#NP"": 1}, ""VP"": {""VB#S"": 1, ""JJ"": 1, ""VP#:#VP"": 1}}",0.0,0.267,0.733,"{""V"": 1, ""O"": 1, ""^"": 1, ""E"": 1}"
We have all grown up playing Tota Udd Chidiya Udd. This simple game made us look towards the sky. Heres our version of  to celebrate 50yrs of ISRO vidya balan taapsee pannu Sonakshi Sinha Nithya Menen Sharman JoshiKirti Kulhari Jagan Shakti,240,42,4,19,7,1,0,8,1,1,,"{""NP"": {""NNP#NNP#NNP#NNP"": 1, ""DT#JJ#NN"": 1, ""CD#NN"": 1, ""S"": 1, ""NN#NN#NN#NNP#NNP#NNP#NNP#NNP#NNP#NNP#NNP#NNP#NNP"": 1}, ""PRT"": {""RP"": 1}, ""VP"": {""VBG#NP"": 1, ""VBN#PRT#S"": 1, ""VBP#RB#VP"": 1, ""VBP#PP"": 1, ""VBD#SBAR"": 1, ""VBZ#NP"": 1}, ""ROOT"": {""SINV"": 1}, ""SBAR"": {""S"": 1}, ""SINV"": {""VP#NP"": 1}}",0.0,0.876,0.124,"{""O"": 2, ""V"": 7, ""D"": 4, ""T"": 1, ""^"": 18, "","": 2, ""A"": 1, ""N"": 4, ""P"": 4}"
Thank you ,10,2,1,1,6,1,0,0,1,0,"游똂:1,游낕:1",{},0.0,0.286,0.714,"{""V"": 1, ""O"": 1}"
Thank you Warda ,16,3,1,1,6,1,0,0,1,0,游때:1,"{""S"": {""NP#NP"": 1}, ""VP"": {""VB#S"": 1}}",0.0,0.444,0.556,"{""V"": 2, ""O"": 1}"
Thank you Bhumi :),18,4,1,2,6,1,0,0,1,0,,"{""S"": {""NP#NP"": 1}, ""VP"": {""VB#S"": 1, ""JJ"": 1, ""VP#:#VP"": 1}}",0.0,0.267,0.733,"{""V"": 1, ""O"": 1, ""^"": 1, ""E"": 1}"
,0,0,0,0,6,1,0,0,1,0,"游똂:2,游낕:2",{},0.0,0.0,0.0,{}
Buckle up and get ready for Indias journey to Mars.  is in cinemas! Book your tickets NOW!BookMyShow:  Paytm: ,110,19,3,10,4,1,1,0,2,1,,"{""PRT"": {""RP"": 1}, ""VP"": {""VB#PRT"": 1, ""VB#NP#PP"": 1, ""VP#CC#VP"": 1, ""VBZ#PP"": 1, ""VB#S"": 1}, ""NP"": {""ADJP#NN"": 1, ""PRP$#NNS"": 1, ""NP#:#NP#:"": 1}, ""ADJP"": {""JJ#PP"": 1}, ""S"": {""VP#."": 2, ""NP#NP"": 1}}",0.0,0.846,0.154,"{""V"": 4, ""T"": 1, ""&"": 1, ""A"": 1, ""P"": 3, ""Z"": 1, ""N"": 3, ""^"": 2, "","": 5, ""D"": 1, ""R"": 1, ""G"": 1}"
"Ended the  journey with a special screening with these lovely ladies in Delhi last night, missed the loveliest vidya balan . Im sure I can say this on behalf of all of us...its a film we are all extremely proud of Now over to you guys ",235,46,1,29,12,1,1,1,0,1,"游똂:1,游낕:1","{""NP"": {""DT#JJ#NN"": 1, ""DT#JJ#NNS"": 1, ""JJ#NN"": 1, ""DT#JJ#NN#NN"": 1, ""DT"": 2, ""PRP$"": 1, ""UCP#NNS"": 1, ""NP#SBAR#PP"": 1}, ""PP"": {""IN#PP"": 1}, ""VP"": {""VBN#NP#PP#PP#NP"": 1, ""VBD#NP"": 1, ""VBP#RB#ADJP"": 1, ""VB#NP#PP#:#S"": 1, ""MD#VP"": 1, ""VB#ADJP"": 1}, ""S"": {""S#,#VP#."": 1, ""NP#NP"": 1}, ""ADJP"": {""RB#JJ"": 1, ""JJ#SBAR"": 1}, ""SBAR"": {""S"": 2}, ""UCP"": {""ADVP#PP"": 1}}",0.043,0.72,0.237,"{""V"": 5, ""D"": 7, ""N"": 7, ""P"": 9, ""A"": 6, ""^"": 3, "","": 3, ""L"": 2, ""O"": 5, ""R"": 2}"
 is proud to be the first Bollywood movie about space exploration to be screened at the Smithsonian Museum Theater. Get your tickets now!  taapsee pannu Sonakshi Sinha vidya balan Sharman Joshi Nithya Menen Kirti Kulhari Jagan Shakti,233,37,2,11,11,1,1,7,1,1,,"{""NP"": {""DT#JJ#NNP#NN"": 1, ""NN#NN"": 1, ""DT#NNP#NNP#NNP"": 1, ""NP#PP#S"": 1, ""PRP$#NNS"": 1, ""NNP#NNP#NN#NN#NNP#NNP#NNP#NNP#NNP#NNP#NNP#NNP"": 1}, ""VP"": {""VBN#PP"": 1, ""VB#VP"": 1, ""VBZ#ADJP"": 1, ""VB#NP#ADVP"": 1, ""VBP#ADJP"": 1}, ""S"": {""VP#."": 2}, ""ADJP"": {""JJ#S"": 1, ""JJ"": 1}, ""ROOT"": {""SINV"": 1}, ""SINV"": {""VP#NP"": 1}}",0.0,0.869,0.131,"{""V"": 5, ""A"": 2, ""P"": 4, ""D"": 3, ""^"": 16, ""N"": 5, "","": 2, ""R"": 1, ""G"": 1}"
 now releasing in Germany. Book your tickets at taapsee pannu Sonakshi Sinha vidya balan Sharman Joshi Nithya Menen Kirti Kulhari Jagan Shakti Fox Star Hindi ,158,25,3,7,10,1,1,8,1,2,,"{""NP"": {""RB"": 1, ""NP#VP#."": 1, ""PRP$#NNS"": 1, ""JJ#NN"": 1, ""NNP#NNP#NN#NN#NNP#NNP#NNP#NNP#NNP#NNP#NNP#NNP#NNP#NNP#NNP"": 1}, ""VP"": {""VBG#PP"": 1, ""VB#NP#PP"": 1}, ""ROOT"": {""NP"": 1, ""SINV"": 1}, ""SINV"": {""VP#NP"": 1}}",0.0,1.0,0.0,"{""R"": 1, ""V"": 2, ""P"": 2, ""^"": 18, "","": 1, ""D"": 1, ""N"": 1}"
"Thank you so much Reddy ji, glad you could make it and it was an evening well-spent ",84,17,1,12,8,1,0,0,1,0,"游똂:1,游낕:1","{""NP"": {""DT#NN#NN"": 1}, ""ADVP"": {""RB#RB"": 1}, ""ADJP"": {""JJ#JJ"": 1, ""JJ"": 1, ""ADVP#ADJP#,#ADJP"": 1}, ""VP"": {""MD#VP"": 1, ""VBD#NP"": 1, ""VB#S"": 1}, ""S"": {""S#CC#S"": 1, ""NP#ADJP#SBAR"": 1}, ""SBAR"": {""S"": 1}}",0.0,0.732,0.268,"{""V"": 4, ""O"": 4, ""R"": 2, ""A"": 2, ""^"": 2, "","": 1, ""&"": 1, ""D"": 1, ""N"": 1}"
"Bas ek din aur, phir sab mangal hoga! Book your tickets for  Now! Find us at your nearest theatres. BookMyShow:  Paytm:  vidya balan taapsee pannu Sonakshi Sinha Nithya Menen Kirti Kulhari Jagan Shakti Fox Star Hindi",216,36,5,16,8,1,1,7,2,1,,"{""NP"": {""NN#,#JJ#NN#NN#NN"": 1, ""PRP$#NNS"": 1, ""PRP$#JJS#NNS"": 1, ""NN#NN#NN#NNP#NNP#NNP#NNP#NNP#NNP#NNP#NNP#NNP#NNP#NNP#NNP"": 1, ""NP#:#S"": 1}, ""VP"": {""VBP#NP"": 1, ""VB#NP#PP"": 2}, ""S"": {""VP#."": 2, ""ADJP#:#NP"": 1}, ""ROOT"": {""NP"": 1}, ""PP"": {""IN#ADVP"": 1}, ""ADJP"": {""JJ"": 1}}",0.0,1.0,0.0,"{""^"": 18, ""G"": 6, "","": 6, ""!"": 1, ""V"": 2, ""D"": 2, ""N"": 2, ""P"": 2, ""R"": 1, ""O"": 1, ""A"": 1}"
Team  shares their journey along with some silly banter & the fun-filled conversation! Catch it only on Hotstar at taapsee pannu Sonakshi Sinha vidya balan Sharman Joshi  Nithya Menen Kirti Kulhari Jagan Shakti Fox Star Hindi,225,36,3,11,13,1,0,9,1,1,,"{""NP"": {""DT#JJ#NN"": 2, ""NP#CC#NP"": 1, ""JJ#NN"": 1, ""NNP#NNP#NN#NN#NNP#NNP#NNP#NNP#NNP#NNP#NNP#NNP#NNP#NNP#NNP"": 1}, ""PRT"": {""RP"": 1}, ""VP"": {""VBZ#NP#PRT#PP"": 1, ""VB#NP#ADVP#PP"": 1}, ""ROOT"": {""SINV"": 1}, ""SINV"": {""VP#NP"": 1}}",0.0,0.902,0.098,"{""N"": 4, ""V"": 2, ""D"": 3, ""P"": 4, ""A"": 2, ""&"": 1, "","": 1, ""O"": 1, ""R"": 1, ""^"": 18}"
"Mangalyaan wouldnt have happened if there was no ISRO. Team  pays their tribute to the founder of ISRO, Vikram Sarabhai on his 100th birth anniversary with Google Lens.taapsee pannu vidya balan Sonakshi Sinha Nithya Menen Kirti Kulhari Fox Star Hindi Google India",263,43,2,14,10,1,1,7,0,1,,"{""NP"": {""EX"": 1, ""PRP$#JJ#NN#NN"": 1, ""NNP#NNP#NNP#NN#NN"": 1, ""NP#,#NP"": 1, ""NNP#NNP#NNP#NNP#NNP#NNP#NNP#NNP#NNP#NNP#NNP"": 1}, ""VP"": {""VBD#NP"": 1, ""VBN#SBAR"": 1, ""VBP#VP"": 1, ""VBZ#NP#PP"": 1}, ""SBAR"": {""IN#S"": 1}, ""ROOT"": {""SINV"": 1}, ""FRAG"": {""NP"": 1}, ""SINV"": {""FRAG#VP#NP"": 1}}",0.051,0.949,0.0,"{""^"": 19, ""V"": 5, ""P"": 5, ""X"": 1, ""D"": 4, ""N"": 7, "","": 3, ""A"": 1, ""G"": 1}"
"This is exactly how the  journey has been, a little topsy-turvy but fun nonetheless. Catch it in cinemas this Thursday! taapsee pannu Sonakshi Sinha vidya balan Sharman Joshi Nithya MenenKirti Kulhari Jagan Shakti Fox Star Hindi  ",230,37,3,13,9,1,1,8,0,3,,"{""NP"": {""DT"": 1, ""DT#JJ"": 1, ""NP#UCP"": 1, ""DT#NNP"": 1, ""NNP#NNP#NN#NN#NNP#NNP#NNP#NNP#NNP#NNP#NNP#NNP#NNP#NNP"": 1}, ""WHADVP"": {""RB#WRB"": 1}, ""VP"": {""VBN"": 1, ""VBN#ADVP"": 1, ""VP#,#NP"": 1, ""VBZ#VP"": 1, ""VBZ#SBAR"": 1, ""VB#NP#PP#NP"": 1, ""VBP#ADJP"": 1}, ""ADJP"": {""RB"": 1, ""JJ"": 1}, ""UCP"": {""ADJP#CC#VP"": 1}, ""SBAR"": {""WHADVP#S"": 1}, ""ROOT"": {""SQ"": 1, ""SINV"": 1}, ""SQ"": {""VP#."": 1}, ""SINV"": {""VP#NP"": 1}}",0.0,0.887,0.113,"{""O"": 2, ""V"": 4, ""R"": 3, ""D"": 3, ""N"": 3, "","": 3, ""A"": 2, ""&"": 1, ""P"": 1, ""^"": 16, ""G"": 1}"
"Besides being a unique show high on adventure and adrenaline, it will also shed light upon pressing issues like climate change and ways to protect our planet. Looking forward to watching our Hon. PM Narendra Modi ji on Man Vs Wild with Bear Grylls tonight at 9 pm on Discovery Channel IN",287,52,1,32,8,1,0,3,0,0,,"{""NP"": {""DT#JJ#NN#NN"": 1, ""NN#CC#NN"": 1, ""NN#NN#CC#NNS"": 1, ""PRP$#NNP#NNP#NNP#NNP#NN"": 1, ""NNP#NNP#NNP"": 2, ""NNP#NNPS"": 1, ""CD#NN"": 1}, ""PP"": {""IN#S"": 2, ""TO#S"": 1}, ""VP"": {""VBG#NP"": 1, ""VBG#NP#PP#S"": 1, ""VB#NP#PP"": 1, ""MD#ADVP#VP"": 1, ""VBG#NP#PP#NP#PP"": 1, ""VBG#PRT#PP"": 1}, ""S"": {""PP#,#NP#VP#."": 1}, ""PRT"": {""RP"": 1}}",0.0,0.864,0.136,"{""P"": 11, ""V"": 7, ""D"": 3, ""A"": 1, ""N"": 16, ""&"": 2, "","": 3, ""O"": 1, ""R"": 2, ""^"": 8, ""$"": 1}"
Eid Mubarak everyone!  May the blessings of the Almighty be with everyone  ,75,12,1,7,8,1,1,0,0,1,"游똂:1,游낕:1","{""NP"": {""NP#NP#."": 1, ""DT#NNS"": 1, ""DT#NNP"": 1, ""NP#SBAR"": 1}, ""ROOT"": {""NP"": 1, ""FRAG"": 1}, ""VP"": {""VBP#PP"": 1}, ""SBAR"": {""S"": 1}, ""FRAG"": {""NP"": 1}}",0.0,0.744,0.256,"{""^"": 2, ""N"": 4, "","": 1, ""V"": 2, ""D"": 2, ""P"": 2}"
Very well said Muruga sir  Congratulations to you too and thank you once again for giving us your wonderful story :),116,21,1,14,10,1,0,0,1,0,"游똂:1,游낕:1","{""NP"": {""PRP$#JJ#NN"": 1}, ""ADVP"": {""RB#RB"": 1}, ""PP"": {""IN#S"": 1}, ""VP"": {""VBZ#PP#ADVP"": 1, ""VBG#NP#NP"": 1, ""VB#NP#ADVP#PP"": 1, ""VBD#SBAR"": 1}, ""S"": {""VP#:"": 1, ""S#CC#S"": 1, ""NP#ADVP#VP"": 1}, ""SBAR"": {""S"": 1}, ""PRN"": {""S#-RRB-"": 1}, ""ROOT"": {""PRN"": 1}}",0.0,0.456,0.544,"{""R"": 5, ""V"": 3, ""^"": 1, ""N"": 3, ""P"": 2, ""O"": 3, ""&"": 1, ""D"": 1, ""A"": 1, ""E"": 1}"
Thank you :),12,3,1,2,10,1,0,0,1,0,,"{""VP"": {""JJ"": 1, ""VP#:#VP"": 1}}",0.0,0.154,0.846,"{""V"": 1, ""O"": 1, ""E"": 1}"
Catch me and the women of  discuss space science & a lot more withArnab Goswami. Premiering on Republic TV at 5 PM.taapsee pannu Sonakshi Sinha vidya balan Sharman Joshi Nithya MenenKirti Kulhari Jagan Shakti Fox Star Hindi  ,225,40,4,16,10,1,1,9,0,3,,"{""NP"": {""DT#NNS"": 1, ""JJ#NN#NN"": 1, ""NP#CC#NP"": 2, ""DT#RB"": 1, ""ADJP#NNP"": 1, ""CD"": 1, ""NNP#NNP#NNP#NNP#NN#NN#NNP#NNP#NNP#NNP#NNP#NNP#NNP#NNP#NNP#NNP"": 1}, ""ADVP"": {""NP#RBR"": 1}, ""ADJP"": {""ADVP#JJ"": 1}, ""VP"": {""VB#PP"": 1}, ""S"": {""VP#."": 1}, ""ROOT"": {""SINV"": 1}, ""SINV"": {""VP#NP"": 1}}",0.0,1.0,0.0,"{""V"": 3, ""O"": 1, ""&"": 2, ""D"": 2, ""N"": 7, ""P"": 3, ""R"": 1, ""G"": 2, ""^"": 16, "","": 2, ""$"": 1}"
Witness the journey of the brightest minds of the country! Advance bookings are open. Bookyour tickets for  NOW!Paytm - BookMyShow - ,133,23,4,12,7,1,1,0,2,1,,"{""NP"": {""DT#JJS#NNS"": 1, ""NNP#NNS"": 1, ""JJ#NNS"": 1, ""NP#PP#PRN#:"": 1}, ""VP"": {""VBP#ADJP"": 1}, ""S"": {""VP#."": 1}, ""ROOT"": {""NP"": 1}, ""ADJP"": {""JJ"": 1}, ""PRN"": {"":#NP"": 1}}",0.0,0.797,0.203,"{""V"": 3, ""D"": 3, ""N"": 5, ""P"": 3, ""A"": 2, "","": 5, ""^"": 3, ""R"": 1}"
Wishing you and John Abraham all the love and luck for ,55,11,1,9,16,1,0,1,1,1,,"{""NP"": {""PDT#DT#NN"": 1, ""NP#CC#NP"": 2, ""NP#NP"": 1}, ""PP"": {""IN"": 1}, ""VP"": {""VBG#NP#PP"": 1}}",0.0,0.468,0.532,"{""V"": 1, ""O"": 1, ""&"": 2, ""^"": 2, ""X"": 1, ""D"": 1, ""N"": 2, ""P"": 1}"
Hima MON JAI ,13,3,1,3,14,1,0,1,0,0,"游똂:1,游낕:1","{""NP"": {""NNP#NNP#NNP"": 1}, ""ROOT"": {""NP"": 1}}",0.0,1.0,0.0,"{""!"": 1, ""^"": 2}"
Thank you,9,2,1,1,14,1,0,0,1,0,,{},0.0,0.286,0.714,"{""V"": 1, ""O"": 1}"
Thank you Maniesh :),20,4,1,2,14,1,0,0,1,0,,"{""S"": {""NP#NP"": 1}, ""VP"": {""VB#S"": 1, ""JJ"": 1, ""VP#:#VP"": 1}}",0.0,0.267,0.733,"{""V"": 1, ""O"": 1, ""^"": 1, ""E"": 1}"
Gippy Grewalaji,15,2,1,0,14,1,0,1,0,0,,"{""ROOT"": {""NP"": 1}}",0.0,1.0,0.0,"{""^"": 2}"
Thank you Shabana ji ,21,4,1,2,14,1,0,0,1,0,"游똂:1,游낕:1","{""SINV"": {""VP#NP"": 1}, ""ROOT"": {""SINV"": 1}}",0.0,0.545,0.455,"{""V"": 1, ""O"": 1, ""^"": 2}"
Thank you ,10,2,1,1,14,1,0,0,1,0,"游똂:1,游낕:1",{},0.0,0.286,0.714,"{""V"": 1, ""O"": 1}"
Thank you,9,2,1,1,14,1,0,0,1,0,,{},0.0,0.286,0.714,"{""V"": 1, ""O"": 1}"
Does the  team really need its Mission Director at Twitter India ? I think its doing alright!  your questions now.,114,20,1,11,7,1,0,1,0,3,,"{""NP"": {""PRP$#NNP#NNP"": 1, ""PRP$"": 1, ""PRP$#NNS"": 1}, ""VP"": {""VB#NP#PP"": 1, ""VBG#NP"": 1, ""VBP#S"": 1, ""ADVP"": 1}, ""SQ"": {""VBZ#NP#ADVP#VP#."": 1}, ""ROOT"": {""SQ"": 1}}",0.0,0.881,0.119,"{""V"": 4, ""D"": 2, ""N"": 4, ""R"": 2, ""L"": 2, ""P"": 1, ""^"": 2, "","": 3, ""O"": 1, ""!"": 1}"
Thank you Huma :),17,4,1,3,4,1,0,0,1,0,,"{""S"": {""NP#NP"": 1}, ""VP"": {""VB#S"": 1, ""JJ"": 1, ""VP#:#VP"": 1}}",0.0,0.267,0.733,"{""V"": 2, ""O"": 1, ""E"": 1}"
Thank you so much :),20,5,1,4,4,1,0,0,1,0,,"{""ADJP"": {""JJ"": 1}, ""FRAG"": {""ADJP#:"": 1}, ""PP"": {""RB#FRAG"": 1}, ""VP"": {""VB#NP#PP#-RRB-"": 1}, ""ROOT"": {""VP"": 1}}",0.0,0.342,0.658,"{""V"": 1, ""O"": 1, ""R"": 1, ""A"": 1, ""E"": 1}"
Thank you ,10,2,1,1,4,1,0,0,1,0,"游똂:1,游낕:1",{},0.0,0.286,0.714,"{""V"": 1, ""O"": 1}"
Thank you :),12,3,1,2,4,1,0,0,1,0,,"{""VP"": {""JJ"": 1, ""VP#:#VP"": 1}}",0.0,0.154,0.846,"{""V"": 1, ""O"": 1, ""E"": 1}"
Thank you Karan ,16,3,1,1,12,1,0,0,1,0,,"{""S"": {""NP#NP"": 1}, ""VP"": {""VB#S"": 1}}",0.0,0.444,0.556,"{""V"": 1, ""O"": 1, ""^"": 1}"
Thank you :),12,3,1,2,12,1,0,0,1,0,,"{""VP"": {""JJ"": 1, ""VP#:#VP"": 1}}",0.0,0.154,0.846,"{""V"": 1, ""O"": 1, ""E"": 1}"
Thank you so much ,18,4,1,3,12,1,0,0,1,0,"游똂:1,游낕:1","{""ADJP"": {""RB#JJ"": 1}, ""S"": {""NP#ADJP"": 1}, ""VP"": {""VB#S"": 1}}",0.0,0.545,0.455,"{""V"": 1, ""O"": 1, ""R"": 1, ""A"": 1}"
"Thats another wonderful news, Best Supporting Actor - Swanand Kirkire for our Marathi film ! Big congratulations, truly well-deserved! ",135,19,1,7,12,1,0,0,1,2,,"{""NP"": {""DT#JJ#NN"": 1, ""NP#NP"": 1, ""NN#VBG#NN"": 1, ""NP#,#NP"": 1, ""PRP$#NNP#NN"": 1, ""NP#:#NP#."": 1, ""JJ#NNS"": 1, ""NP#,#ADJP"": 1}, ""ROOT"": {""NP"": 1, ""FRAG"": 1}, ""ADJP"": {""RB#JJ"": 1}, ""FRAG"": {""NP#."": 1}}",0.0,0.398,0.602,"{""L"": 1, ""D"": 2, ""A"": 4, ""N"": 4, "","": 5, ""V"": 1, ""^"": 3, ""P"": 1, ""R"": 1}"
"Yes and the next call was to me, half anxious...half excited to confirm if wed actually won the  for Best Film On Social Issues for . All I can say, Saari duniya se kaho, Copy That! ",182,36,1,26,12,1,0,0,1,2,游때:1,"{""NP"": {""DT#JJ#NN"": 1, ""NP#CC#NP"": 1, ""NP#,#ADJP"": 1, ""DT"": 4, ""JJS#NNP#NNP#NNP#NNS"": 1, ""NP#SBAR"": 1, ""NNP#NNP#NNP#NNP"": 1, ""NP#,#NP#,"": 1}, ""ADJP"": {""RB#JJ"": 1, ""JJ#S"": 1}, ""PP"": {""IN"": 1}, ""VP"": {""VBD#PP"": 1, ""VBD#NP#PP#PP"": 1, ""VB#SBAR"": 1, ""VB"": 1, ""MD#VP"": 1, ""VBP#NP"": 1}, ""S"": {""NP#ADVP#VP"": 1, ""NP#ADJP"": 1, ""S#:#S#."": 1}, ""SBAR"": {""IN#S"": 1, ""S"": 1}}",0.0,0.693,0.307,"{""!"": 1, ""&"": 1, ""D"": 3, ""A"": 5, ""N"": 3, ""V"": 6, ""P"": 6, ""O"": 3, "","": 6, ""R"": 3, ""^"": 4, ""G"": 1}"
Thank you Meena ji ,19,4,1,2,11,1,0,0,1,0,"游똂:1,游낕:1","{""SINV"": {""VP#NP"": 1}, ""ROOT"": {""SINV"": 1}}",0.0,0.545,0.455,"{""V"": 1, ""O"": 1, ""^"": 2}"
Make some noise for the Desi Boyz...together we are always a riot! John Abraham ,80,14,1,9,8,1,1,1,0,1,,"{""NP"": {""DT#NNP#NNP"": 1}, ""VP"": {""VBP#ADVP#NP"": 1}, ""S"": {""ADVP#NP#VP"": 1, ""S#:#S#."": 1}, ""ROOT"": {""NP"": 1}}",0.245,0.755,0.0,"{""V"": 2, ""D"": 3, ""N"": 3, ""P"": 1, ""^"": 3, "","": 2, ""R"": 2, ""O"": 1}"
"When you're hungry, eat healthy. Learn about nutrition and good  by playing   & win exciting prizes! Ab Download the GOQii app and use my invite code Akshay999 for offers  ",172,29,2,15,7,1,0,1,2,5,,"{""WHADVP"": {""WRB"": 1}, ""NP"": {""CC"": 1, ""JJ#NNS"": 1, ""DT#NNP#NN"": 1, ""PRP$#JJ#NN#NNS"": 1}, ""ADJP"": {""JJ"": 3, ""ADJP#PP#."": 1}, ""VP"": {""VBP#ADJP"": 1, ""VB#ADJP"": 1, ""VBN#PP"": 1, ""VBG#S"": 1, ""VB#NP#PP"": 1, ""VP#CC#VP"": 1, ""VB#VP"": 1}, ""S"": {""SBAR#,#VP#."": 1}, ""SBAR"": {""WHADVP#S"": 1}, ""ROOT"": {""UCP"": 1}, ""PP"": {""IN#S"": 1}, ""UCP"": {""VP#CC#ADJP"": 1}}",0.0,0.521,0.479,"{""R"": 1, ""L"": 1, ""A"": 4, "","": 3, ""V"": 7, ""P"": 3, ""N"": 5, ""&"": 3, ""G"": 1, ""D"": 2, ""^"": 1, ""$"": 1}"
Fake health trends benefit no one. Learn about good  by playing   and win exciting prizes! Ab Download the GOQii app and use my invite code Akshay999 for offers   ,163,28,3,15,6,1,0,1,2,5,,"{""NP"": {""JJ#NN#NNS"": 1, ""JJ#NNS"": 1, ""DT#NNP#NN"": 1, ""PRP$#JJ#NN#NNS"": 1}, ""VP"": {""VBP#NP"": 1, ""VBG"": 1, ""VP#CC#VP"": 2, ""VB#NP#PP"": 1, ""VB#VP"": 1}, ""ROOT"": {""ADJP"": 1}, ""ADJP"": {""JJ"": 1, ""JJ#PP#PP#."": 1}, ""PP"": {""IN#ADJP"": 1, ""IN#S"": 1}}",0.121,0.433,0.446,"{""A"": 3, ""N"": 7, ""V"": 7, ""D"": 3, "","": 2, ""R"": 1, ""P"": 2, ""&"": 2, ""G"": 1, ""^"": 1, ""$"": 1}"
