"Pyjamas are forgiving in nature, its jeans that really know how to hold a grudge.   This and more such witty writing in the wifes latest book, . Released today, grab your copies now!  Twinkle Khanna ",199,35,1,19,14,1,1,1,0,2,游땍:2,"{""NP"": {""PRP$#NNS"": 2, ""NP#SBAR"": 1, ""NP#,#NP"": 1, ""DT"": 1, ""JJR#JJ#NNS"": 1, ""NP#CC#NP"": 1, ""DT#JJ#JJS#NN"": 1, ""NP#,"": 1, ""NP#VP#."": 1}, ""WHNP"": {""WDT"": 1}, ""WHADVP"": {""WRB"": 1}, ""VP"": {""VBP#SBAR"": 1, ""JJ#PP"": 1, ""VBP#VP"": 1, ""VBG#PP"": 1, ""VBN#NP"": 1, ""VBP#NP#ADVP"": 1}, ""S"": {""ADVP#VP"": 1, ""S#,#VP#."": 1}, ""SBAR"": {""WHADVP#S"": 1, ""WHNP#S"": 1}, ""ROOT"": {""NP"": 2}}",0.0,0.909,0.091,"{""N"": 8, ""V"": 6, ""A"": 4, ""P"": 4, "","": 6, ""L"": 1, ""R"": 4, ""D"": 3, ""O"": 1, ""&"": 1, ""^"": 2}"
"Prepare for ! Teaser out on September 13, 2018. 2.0 Lyca Productions Dharma Productions",87,14,3,7,10,1,1,3,0,1,,"{""PP"": {""IN"": 1}, ""VP"": {""VB#PP"": 1, ""VB#PRT#PP"": 1}, ""S"": {""VP#."": 2}, ""ROOT"": {""NP"": 1}, ""PRT"": {""RP"": 1}, ""NP"": {""NNP#CD#,#CD"": 1, ""NNP#NNP#NNP#NNP#NNP"": 1}}",0.16,0.84,0.0,"{""V"": 1, ""P"": 2, "","": 3, ""N"": 1, ""T"": 1, ""^"": 5, ""$"": 3}"
Its reached me and made me smile  Thank you for the extremely kind words Ranveer Allahbadia . Love & prayers always ,116,21,1,12,7,1,0,1,1,0,"游때:1,游눞:1,游똂:2,游낕:2","{""NP"": {""PRP$"": 1, ""DT#ADJP#NNS"": 1, ""NN#CC#NNS"": 1, ""NP#ADVP"": 1}, ""VP"": {""VBD#NP"": 2, ""VP#CC#VP"": 1, ""VB#NP#PP"": 1, ""VBP#VP"": 1}, ""ADJP"": {""RB#JJ"": 1}, ""SINV"": {""S#VP#NP#."": 1}, ""ROOT"": {""SINV"": 1, ""FRAG"": 1}, ""FRAG"": {""NP"": 1}}",0.0,0.495,0.505,"{""L"": 1, ""V"": 4, ""O"": 3, ""&"": 2, ""P"": 1, ""D"": 1, ""R"": 2, ""A"": 1, ""N"": 3, ""^"": 2, "","": 1}"
"For too long, the word toilet has been thought of as a dirty word. It has always been considered to be an unclean place.Not any more. Im proud to have partnered with Harpic India to bring a sparkling clean toilet within everybodys reach.  ",239,44,3,23,5,1,1,1,0,2,,"{""ADJP"": {""RB#JJ"": 1, ""JJ#S"": 1}, ""PP"": {""IN#ADJP"": 1, ""IN#PP"": 1}, ""NP"": {""DT#NN#NN"": 1, ""DT#JJ#NN"": 2, ""DT#JJ#JJ#NN"": 1, ""JJ#NN"": 1}, ""VP"": {""VBN#PP"": 1, ""VBN#VP"": 2, ""VBZ#VP"": 1, ""VB#NP#ADVP"": 1, ""VBN#S"": 1, ""VBZ#ADVP#VP"": 1, ""VB#NP#PP"": 1, ""VBN#PP#S"": 1, ""VB#VP"": 1, ""VB#ADJP"": 1}, ""S"": {""PP#,#NP#VP#."": 1, ""VP#."": 1}, ""ADVP"": {""DT#RBR"": 1}}",0.06,0.746,0.194,"{""P"": 8, ""R"": 3, ""A"": 7, "","": 5, ""D"": 6, ""N"": 6, ""V"": 10, ""O"": 1, ""L"": 1, ""^"": 2}"
"A historic day for India! Love for all, freedom for all  RIP ",61,12,1,9,9,1,0,0,0,1,游깯:1,"{""NP"": {""DT#JJ#NN"": 1, ""NP#PP#."": 1, ""DT"": 1, ""DT#NNP"": 1, ""NP#,#NP"": 1}, ""ROOT"": {""NP"": 2}}",0.0,0.509,0.491,"{""D"": 3, ""A"": 1, ""N"": 2, ""P"": 3, ""^"": 1, "","": 2, ""V"": 1, ""G"": 1}"
"Happy and proud to be the Honorary Ambassador of the Lal Bahadur Shastri Memorial Foundation.  Keep up the good work, Vinamra Shastri. We ought to live by Shastri jis Jai Jawan Jai Kisan motto for our great nation. Lal Bahadur Shastri Memorial Foundation",254,43,1,21,5,1,1,2,0,0,,"{""ADJP"": {""JJ#CC#JJ"": 1}, ""NP"": {""DT#NNP#NNP"": 1, ""DT#NNP#NNP#NNP#NNP#NNP"": 1, ""DT#JJ#NN"": 1, ""NNP#NNP#NNP#NNP#NNP#NNP#NN"": 1, ""PRP$#JJ#NN"": 1, ""NNP#NNP#NNP#NNP#NNP"": 1}, ""VP"": {""VB#PRT#NP"": 1, ""VB#PP#PP"": 1, ""MD#S"": 1}, ""S"": {""VP#,#NP#."": 1}, ""FRAG"": {""ADJP#S#."": 1}, ""ROOT"": {""FRAG"": 1, ""NP"": 1}, ""PRT"": {""RP"": 1}}",0.0,0.701,0.299,"{""A"": 5, ""&"": 1, ""P"": 5, ""V"": 4, ""D"": 4, ""N"": 6, ""^"": 14, "","": 4, ""T"": 1, ""O"": 1, ""G"": 2}"
The sentiment is mutual ,24,4,1,2,6,1,0,0,1,0,,"{""ADJP"": {""JJ"": 1}, ""VP"": {""VBZ#ADJP"": 1}}",0.0,1.0,0.0,"{""D"": 1, ""N"": 1, ""V"": 1, ""A"": 1}"
"The story of Indias first Gold medal victory for the first time in the Kingdom of Saudi Arabia. Happy to share,  is the first ever Bollywood movie to release in the Kingdom Of Saudi Arabia, in cinemas from today! Excel Entertainment Zee Studios Int'l",250,44,3,20,13,1,0,2,0,1,,"{""NP"": {""NNP#JJ#NN"": 1, ""DT#JJ#NN"": 1, ""DT#NNP"": 1, ""DT#JJ"": 1, ""DT#NNP#NNP#NNP#NNP"": 1, ""NP#S"": 1, ""NNP#NNP#NNP#NNPS#NNP#POS"": 1, ""NP#NNP"": 1}, ""VP"": {""VBD#NP#PP#PP"": 1, ""VB#PP#,#PP"": 1}, ""ROOT"": {""SQ"": 1, ""NP"": 1}, ""ADVP"": {""RB#PP"": 1}, ""SQ"": {""ADVP#,#VBZ#NP#ADVP#NP#NP#."": 1}}",0.0,0.721,0.279,"{""D"": 5, ""N"": 10, ""P"": 10, ""Z"": 1, ""A"": 4, ""^"": 10, "","": 4, ""V"": 3, ""R"": 1}"
Kicking the midweek blues like  ,32,5,1,2,8,1,1,0,0,1,"游녢:1,游낕:1","{""NP"": {""DT#JJ#NN"": 1}, ""PP"": {""IN"": 1}, ""VP"": {""VBG#NP#PP"": 1}}",0.0,0.615,0.385,"{""V"": 1, ""D"": 1, ""A"": 1, ""N"": 1, ""P"": 1}"
"Witness the return of the hilarious trio Dharmendra Deol Sunny Deol and Bobby Deol along with kriti kharbanda in ! Looks like a laugh riot, catch it in cinemas from tomorrow.",174,31,1,16,5,1,1,4,0,1,,"{""NP"": {""DT#ADJP#NN"": 1, ""NNP#NNP#NNP#NNP#CC#NNP#NNP"": 1, ""JJ#NN"": 1, ""NP#ADVP"": 1, ""NP#NP"": 1, ""DT#NN#NN"": 1}, ""ADJP"": {""JJ"": 1}, ""ADVP"": {""IN#PP"": 1}, ""PRT"": {""RP"": 1}, ""VP"": {""VB#NP#PRT"": 1, ""VBP#NP#PP"": 1}, ""S"": {""VP#."": 1, ""NP#,#VP#."": 1}}",0.091,0.608,0.301,"{""V"": 3, ""D"": 3, ""N"": 5, ""P"": 7, ""A"": 1, ""^"": 9, ""&"": 1, "","": 3, ""O"": 1}"
"Today being the birth anniversary of one of Indias greatest sportsman,  is also marked as . The best tribute would be to not just celebrate it for a day but make sports a way of life.",183,36,1,23,6,1,0,0,0,2,,"{""NP"": {""DT#NN#NN"": 1, ""CD"": 1, ""NP#PP#ADJP"": 1, ""NN#S"": 1, ""DT#JJS#NN"": 1, ""NP#NP#PP"": 1}, ""PP"": {""IN"": 1}, ""ADJP"": {""JJS#JJ"": 1}, ""VP"": {""VBG#NP"": 1, ""VBN#PP"": 1, ""VBZ#ADVP#VP"": 1, ""ADVP#VB#NP#PP"": 1, ""VB#S"": 1, ""MD#VP"": 1, ""VBP#NP"": 1, ""VP#CC#VP"": 1}, ""S"": {""NP#,#VP#."": 1}, ""ADVP"": {""RB#RB"": 1}}",0.054,0.806,0.14,"{""N"": 9, ""V"": 7, ""D"": 4, ""P"": 6, ""$"": 1, ""Z"": 1, ""A"": 2, "","": 3, ""R"": 3, ""O"": 1, ""&"": 1}"
"A mad superheros superb story,  now streaming on  Pad Man Sonam K Ahuja Radhika Apte Twinkle Khanna Sony Pictures India ",120,20,3,9,8,1,1,5,0,3,游:1,"{""NP"": {""DT#JJ#NNS"": 1, ""NN#,#RB#NN"": 1, ""NNP#NNP#NNP#NNP#NNP#NNP#NNP#NNP#NNP#NNP"": 1}, ""FRAG"": {""NP"": 1}, ""VP"": {""VBD#NP#PP"": 1}, ""SINV"": {""FRAG#VP#NP"": 1}, ""ROOT"": {""SINV"": 1}}",0.137,0.687,0.176,"{""D"": 1, ""A"": 2, ""N"": 2, "","": 1, ""R"": 1, ""V"": 1, ""P"": 1, ""^"": 12}"
Whether edited or real footage...this elephant seems to be more in tune with the environment than most of us. ,110,19,1,13,8,1,1,0,0,1,,"{""ADJP"": {""JJ#CC#JJ"": 1}, ""NP"": {""ADJP#NN"": 1, ""JJS"": 1}, ""ADVP"": {""RBR#IN"": 1}, ""VP"": {""VB#ADVP"": 1, ""VBZ#S"": 1, ""VBP#PP"": 1}, ""S"": {""NP#:#NP#VP"": 1, ""SBAR#VP#."": 1}, ""SBAR"": {""IN#S"": 1}}",0.0,1.0,0.0,"{""P"": 6, ""V"": 3, ""&"": 1, ""A"": 1, ""N"": 4, "","": 2, ""D"": 2, ""R"": 2, ""O"": 1}"
The daughter showed me this video today which gave me something to mull over. Its rather sad to see how we are invading spaces not belonging to us...where else will these creatures go if not invade ours?,203,37,1,21,7,1,1,0,0,0,,"{""NP"": {""DT#JJ#NN"": 1, ""PRP$#ADJP#NNS"": 1, ""DT#NNS"": 1, ""NP#:#SBARQ"": 1}, ""WHNP"": {""WDT"": 1}, ""PRT"": {""RP"": 1}, ""VP"": {""VB#PRT"": 1, ""VBD#NP#NP#S"": 1, ""VBD#NP#NP#SBAR"": 1, ""VBG"": 1, ""VBP#VP"": 1, ""VB#SBAR"": 1, ""VB"": 1, ""VP#CONJP#VP"": 1, ""VBG#PP"": 1}, ""SBAR"": {""WHNP#S"": 1, ""WHADVP#S"": 1}, ""ROOT"": {""NP"": 1}, ""WHADVP"": {""WRB"": 1, ""WRB#ADJP"": 1}, ""ADJP"": {""RB#JJ#S"": 1, ""RB"": 1}, ""CONJP"": {""IN#RB"": 1}, ""SQ"": {""MD#NP#VP"": 1}, ""SBARQ"": {""WHADVP#SQ#."": 1}, ""PP"": {""RB#S"": 1}}",0.079,0.921,0.0,"{""D"": 4, ""N"": 6, ""V"": 10, ""O"": 5, ""P"": 5, "","": 3, ""L"": 1, ""R"": 6, ""A"": 1}"
This one gave me the chills... what a hard-hitting trailer this is with such an interesting star cast. Looking forward to this one - ,133,24,1,17,7,1,0,0,1,1,,"{""NP"": {""DT#NNS"": 1, ""DT#JJ#NN"": 1, ""DT"": 1, ""PDT#DT#JJ#NN"": 1, ""NP#VP"": 1, ""NP#SBAR"": 1}, ""VP"": {""VBD#NP#NP"": 1, ""VBN"": 1, ""VBZ#PP"": 1, ""VBG#ADVP#PP"": 1}, ""S"": {""S#:#X#."": 1, ""VP#:"": 1}, ""X"": {""WP"": 1, ""X#NP"": 1}, ""SBAR"": {""S"": 1}}",0.0,0.886,0.114,"{""D"": 5, ""$"": 2, ""V"": 3, ""O"": 3, ""N"": 4, "","": 3, ""A"": 3, ""P"": 2, ""R"": 1}"
" everyone. Wishing you all love, happiness and prosperity ",58,8,1,3,6,1,0,0,0,1,,"{""NP"": {""NN#."": 1, ""NN#,#NN#CC#NN"": 1}, ""ROOT"": {""NP"": 1}, ""PP"": {""RB#NP"": 1}, ""VP"": {""VBG#NP#PP"": 1}}",0.0,0.34,0.66,"{""N"": 4, "","": 2, ""V"": 1, ""O"": 1, ""D"": 1, ""&"": 1}"
"Congratulations Golden Girl, Vinesh Phogat for creating history by becoming the first Indian woman wrestler to win a gold medal at the Asian Games! More power to you ",166,28,1,12,15,1,0,1,0,0,"游뗿:1,游낕:1","{""NP"": {""NNP#NNP#NNP"": 1, ""DT#JJ#JJ#NN#NN"": 1, ""DT#JJ#NN"": 1, ""DT#NNP#NNPS"": 1, ""NP#,#NP#."": 1, ""JJR#NN"": 1}, ""PP"": {""IN#S"": 2}, ""VP"": {""VB#NP#PP"": 1, ""VBG#NP#S"": 1, ""VBG#NP#PP"": 1}, ""ROOT"": {""NP"": 2}}",0.0,0.634,0.366,"{""N"": 8, ""^"": 4, "","": 2, ""P"": 5, ""V"": 3, ""D"": 3, ""A"": 4, ""O"": 1}"
"Thank you so much Sachin Tendulkar  And heres wishing one of the sweetest and most enterprising community, Happy Parsi New Year ",128,21,1,11,4,1,0,1,1,0,"游똂:1,游낕:1","{""NP"": {""CD"": 1, ""DT#ADJP#NN"": 1, ""JJ#NNP#NNP#NNP"": 1, ""NP#,#NP"": 1, ""NP#SBAR"": 1}, ""ADVP"": {""RB#RB"": 1}, ""VP"": {""VB#NP#ADVP"": 1, ""VBG#NP"": 1, ""VBZ#S"": 1}, ""ADJP"": {""JJ"": 1, ""RBS#JJ"": 1, ""ADJP#CC#ADJP"": 1}, ""SBAR"": {""CC#S"": 1}, ""SINV"": {""VP#NP"": 1}, ""ROOT"": {""SINV"": 1}}",0.0,0.587,0.413,"{""V"": 2, ""O"": 1, ""R"": 2, ""A"": 5, ""^"": 3, ""&"": 2, ""L"": 1, ""$"": 1, ""P"": 1, ""D"": 1, ""N"": 2, "","": 1}"
You guys are the best  Thank you ,33,7,1,6,8,1,0,0,1,0,"游똂:1,游낕:1","{""NP"": {""PRP#NNS"": 1, ""DT#JJS#S"": 1}, ""VP"": {""VBP#NP"": 1}}",0.0,0.427,0.573,"{""O"": 2, ""N"": 2, ""V"": 1, ""D"": 1, ""A"": 1}"
Sending lots of love to you guys ,33,7,1,6,8,1,0,0,1,0,,"{""NP"": {""PRP#NNS"": 1}, ""VP"": {""VBG#NP#PP"": 1}}",0.0,0.588,0.412,"{""V"": 1, ""N"": 3, ""P"": 2, ""O"": 1}"
,0,0,0,0,8,1,0,0,1,0,"游똂:2,游낕:2",{},0.0,0.0,0.0,{}
Thank you Pune ,15,3,1,2,8,1,0,0,1,0,,"{""ADJP"": {""JJ"": 1}, ""S"": {""NP#ADJP"": 1}, ""VP"": {""VB#S"": 1}}",0.0,0.444,0.556,"{""V"": 1, ""O"": 1, ""^"": 1}"
,0,0,0,0,8,1,0,0,1,0,"游때:1,游똂:1,游낕:1",{},0.0,0.0,0.0,{}
Thank you Silchar Akkians ,26,4,1,1,8,1,0,0,1,0,"游똂:1,游낕:1","{""SINV"": {""VP#NP"": 1}, ""ROOT"": {""SINV"": 1}}",0.0,0.545,0.455,"{""V"": 2, ""O"": 1, ""^"": 1}"
Lots of love ,13,3,1,3,8,1,0,0,1,0,"游똂:1,游낕:1","{""ROOT"": {""NP"": 1}}",0.0,0.323,0.677,"{""N"": 2, ""P"": 1}"
Love you all ,13,3,1,3,8,1,0,0,1,0,"游똂:1,游낕:1","{""NP"": {""DT"": 1}, ""VP"": {""VBZ#NP"": 1}, ""SINV"": {""VP#NP"": 1}, ""ROOT"": {""SINV"": 1}}",0.0,0.323,0.677,"{""V"": 1, ""O"": 1, ""D"": 1}"
Thank you so much ,18,4,1,3,8,1,0,0,1,0,,"{""ADJP"": {""RB#JJ"": 1}, ""S"": {""NP#ADJP"": 1}, ""VP"": {""VB#S"": 1}}",0.0,0.545,0.455,"{""V"": 1, ""O"": 1, ""R"": 1, ""A"": 1}"
Humbled and grateful for the love ,34,6,1,4,8,1,0,0,1,0,"游똂:1,游낕:1","{""VP"": {""VBN"": 1}, ""ADJP"": {""JJ#PP"": 1}, ""UCP"": {""VP#CC#ADJP"": 1}, ""ROOT"": {""UCP"": 1}}",0.0,0.357,0.643,"{""V"": 1, ""&"": 1, ""A"": 1, ""P"": 1, ""D"": 1, ""N"": 1}"
Thank you ,10,2,1,1,8,1,0,0,1,0,"游똂:1,游낕:1",{},0.0,0.286,0.714,"{""V"": 1, ""O"": 1}"
Thank you so much ,18,4,1,3,8,1,0,0,1,0,"游똂:1,游낕:1","{""ADJP"": {""RB#JJ"": 1}, ""S"": {""NP#ADJP"": 1}, ""VP"": {""VB#S"": 1}}",0.0,0.545,0.455,"{""V"": 1, ""O"": 1, ""R"": 1, ""A"": 1}"
Thank you for the love ,23,5,1,4,8,1,0,0,1,0,,"{""VP"": {""VB#NP#PP"": 1}}",0.0,0.309,0.691,"{""V"": 1, ""O"": 1, ""P"": 1, ""D"": 1, ""N"": 1}"
Thank you Warda ,16,3,1,1,8,1,0,0,1,0,游때:1,"{""S"": {""NP#NP"": 1}, ""VP"": {""VB#S"": 1}}",0.0,0.444,0.556,"{""V"": 2, ""O"": 1}"
Big thank you Karan on behalf of Team  ,39,8,1,5,7,1,0,0,1,1,"游땏:1,游똂:1,游낕:1","{""S"": {""NP#NP"": 1}, ""VP"": {""VBP#S"": 1}}",0.0,0.737,0.263,"{""A"": 1, ""V"": 1, ""O"": 1, ""^"": 1, ""P"": 2, ""N"": 2}"
,0,0,0,0,7,1,0,0,1,0,"游땏:1,游똂:1,游낕:1",{},0.0,0.0,0.0,{}
Thank you looking forward to your review ,41,7,1,3,7,1,0,0,1,0,游땎:1,"{""VP"": {""VBG#ADVP#PP"": 1, ""VB#S"": 1}}",0.0,0.706,0.294,"{""V"": 2, ""O"": 1, ""R"": 1, ""P"": 1, ""D"": 1, ""N"": 1}"
 maybe a sports drama with hockey at it's centre but the sets of Gold witnessed every sport possible...let the games begin Excel Entertainment Ritesh Sidhwani Farhan Akhtar Mouni Roy Reema Kagti Kunal Kapoor Amit Sadh Viineet Kumar Sunny Kaushal,245,39,5,13,6,1,0,9,1,1,游뗵:1,"{""NP"": {""DT#NNS#NN"": 1, ""PRP#POS"": 1, ""NP#NN"": 1, ""DT#NNS"": 2, ""NP#PP#VP"": 1, ""NNP#NNP#NNP#NNP#NNP#NNP#NNP#NNP#NNP#NNP#NNP#NNP#NNP#NNP#NNP#NNP#NNP#NNP"": 1}, ""ADJP"": {""JJ"": 1}, ""S"": {""NP#ADJP"": 1}, ""VP"": {""VBN#S"": 1, ""VB#NP#PP#PRN"": 1, ""VB"": 1, ""VB#S"": 1, ""VP#:#VP"": 1}, ""PRN"": {""CC#NP"": 1}, ""SINV"": {""VP#NP"": 1}, ""ROOT"": {""SINV"": 1}}",0.0,0.754,0.246,"{""R"": 1, ""D"": 4, ""N"": 7, ""P"": 3, ""L"": 1, ""&"": 1, ""^"": 19, ""V"": 3, ""A"": 1, "","": 1}"
"Getting some amazing feedback on the Road Safety Awareness campaign both online and offline. The idea was to send out a message in an entertaining manner, full credit to my director R. Balki for bringing that out so effectively.Hope to see some real changes now for the better",276,48,1,30,3,5,0,0,0,0,,"{""NP"": {""DT#JJ#NN"": 2, ""DT#NNP#NNP#NNP#NN"": 1, ""NP#ADJP"": 1, ""JJ#NN"": 1, ""PRP$#NN#NNP#NNP"": 1, ""DT#JJ#NNS"": 1, ""DT#JJR"": 1, ""NP#,#NP"": 1}, ""ADJP"": {""DT#JJ#CC#JJ"": 1, ""ADVP#JJ#S"": 1}, ""PP"": {""IN#S"": 1}, ""VP"": {""VBG#NP#PP"": 1, ""VB#NP#ADVP#PP"": 1, ""VBG#ADJP"": 1, ""VB#PRT#NP"": 1, ""VBD#S"": 1}, ""S"": {""VP#."": 1}, ""PRT"": {""RP"": 1}, ""ADVP"": {""DT#IN#RB"": 1}}",0.026,0.713,0.261,"{""V"": 6, ""D"": 9, ""A"": 7, ""N"": 10, ""P"": 7, ""^"": 3, ""&"": 1, "","": 4, ""T"": 2, ""O"": 1, ""R"": 3}"
Narendra ModitShankar Mahadevanfor #IndependenceDay Shankar...yppable like Non stop India!,90,9,1,3,12,5,0,2,0,1,,"{""NP"": {""NNP#NNP#NNP#NNP#NNP"": 1, ""NNP#NN#NNP"": 1, ""NP#:#NP#."": 1}, ""ROOT"": {""NP"": 1}}",0.183,0.584,0.233,"{""^"": 7, "","": 2, ""A"": 1, ""P"": 1, ""V"": 1}"
Thank you Diana ,16,3,1,1,6,5,0,0,1,0,游땕:1,"{""S"": {""NP#NP"": 1}, ""VP"": {""VB#S"": 1}}",0.0,0.444,0.556,"{""V"": 1, ""O"": 1, ""^"": 1}"
Thank you ,10,2,1,1,6,5,0,0,1,0,游똂:1,{},0.0,0.286,0.714,"{""V"": 1, ""O"": 1}"
Thank you ,10,2,1,1,2,5,0,0,1,0,"游땕:1,游똂:1",{},0.0,0.286,0.714,"{""V"": 1, ""O"": 1}"
,0,0,0,0,2,5,0,0,1,0,"游뗿:1,游땕:1,游똂:1",{},0.0,0.0,0.0,{}
Thank you so much brother ,26,5,1,3,2,5,0,0,1,0,,"{""ADJP"": {""RB#RB#JJ"": 1}, ""S"": {""NP#ADJP"": 1}, ""VP"": {""VB#S"": 1}}",0.0,0.615,0.385,"{""V"": 1, ""O"": 1, ""R"": 1, ""A"": 1, ""N"": 1}"
Thank you Abbas Mustan ji ,26,5,1,2,2,5,0,0,1,0,游똂:1,"{""NP"": {""NNP#NNP#NNP"": 1}, ""SINV"": {""VP#NP"": 1}, ""ROOT"": {""SINV"": 1}}",0.0,0.615,0.385,"{""V"": 1, ""O"": 1, ""^"": 3}"
,0,0,0,0,2,5,0,0,1,0,"游땕:1,游똂:1",{},0.0,0.0,0.0,{}
 Thank you Suhel,16,3,1,1,2,5,0,0,1,0,"游땍:2,游똂:1","{""S"": {""NP#NP"": 1}, ""VP"": {""VB#S"": 1}}",0.0,0.444,0.556,"{""V"": 2, ""O"": 1}"
Thank you so much ,18,4,1,3,2,5,0,0,1,0,游똂:1,"{""ADJP"": {""RB#JJ"": 1}, ""S"": {""NP#ADJP"": 1}, ""VP"": {""VB#S"": 1}}",0.0,0.545,0.455,"{""V"": 1, ""O"": 1, ""R"": 1, ""A"": 1}"
"That was the idea, glad you liked it ",37,8,1,6,2,5,0,0,1,0,游땕:1,"{""NP"": {""DT"": 1}, ""VP"": {""VBD#NP"": 1, ""VBD#NP#,#S"": 1}, ""S"": {""ADJP"": 1}, ""SBAR"": {""S"": 1}, ""ADJP"": {""JJ#SBAR"": 1}}",0.0,0.508,0.492,"{""O"": 3, ""V"": 2, ""D"": 1, ""N"": 1, "","": 1, ""A"": 1}"
,0,0,0,0,2,5,0,0,1,0,游똂:2,{},0.0,0.0,0.0,{}
Agreed! Thank you so much Sunil. Hope you enjoy it ,51,10,1,6,2,5,0,0,1,0,游땕:1,"{""VP"": {""VBN"": 1, ""VB#S"": 1}, ""S"": {""VP#."": 2, ""NP#ADVP#NP"": 1}, ""ROOT"": {""SINV"": 1}, ""ADVP"": {""RB#RB"": 1}, ""SINV"": {""VBZ#NP#VP"": 1}}",0.0,0.348,0.652,"{""V"": 4, "","": 2, ""O"": 3, ""R"": 1, ""A"": 1, ""^"": 1}"
Freedom is never free. Let us salute all those who fought for our freedom and to those who fight for us day and night at the borders to keep us safe. Let us not take their sacrifices for granted and always work towards a better India. Happy ,241,47,1,27,2,5,0,0,0,1,,"{""NP"": {""PDT#DT"": 1, ""DT"": 1, ""NN#CC#NN"": 1, ""DT#NNS#S"": 1, ""NP#SBAR"": 2, ""PRP$#NNS"": 1, ""DT#JJR#NNP"": 1}, ""ADJP"": {""JJ"": 3}, ""VP"": {""VBZ#ADVP#ADJP"": 1, ""VB#S"": 2, ""VBP#PP#NP#PP"": 1, ""VBD#PP"": 1, ""JJ"": 1, ""VB#NP#PP"": 1, ""VB#PP"": 1, ""VP#CC#ADVP#VP"": 1, ""VB#NP#RB#VP"": 1}, ""S"": {""NP#ADJP"": 1, ""VP#."": 2}, ""ROOT"": {""ADJP"": 1}, ""WHNP"": {""WP"": 2}, ""PP"": {""PP#CC#PP"": 1, ""IN#S"": 1}, ""SBAR"": {""WHNP#S"": 2}}",0.118,0.574,0.309,"{""N"": 6, ""V"": 10, ""R"": 3, ""A"": 4, "","": 3, ""O"": 7, ""X"": 1, ""D"": 5, ""P"": 7, ""&"": 3, ""^"": 1}"
Thank you ,10,2,1,1,13,5,0,1,0,0,游똂:1,{},0.0,0.286,0.714,"{""V"": 1, ""O"": 1}"
"A story which will make your chest swell with pride...this journey has been nothing less than ! Now over to you guys, go and experience it at a theatre near you tomorrow!  Excel Entertainment Reema Kagti Farhan Akhtar Ritesh Sidhwani Mouni Roy",243,42,3,22,11,5,1,5,0,2,,"{""NP"": {""NP#SBAR"": 1, ""PRP#NNS"": 1, ""NP#PP#NP"": 1, ""NNP#NNP#NNP#NNP#NNP#NNP#NNP#NNP#NNP"": 1}, ""WHNP"": {""WDT"": 1}, ""VP"": {""MD#VP"": 1, ""VBP#PP"": 1, ""VBN#NP#ADVP"": 1, ""VBZ#VP"": 1, ""VBP#CC#VBP#NP#PP"": 1, ""VBZ"": 1}, ""S"": {""S#:#S#."": 1, ""ADVP#PP#,#VP#."": 1}, ""SBAR"": {""WHNP#S"": 1}, ""PP"": {""IN#PP"": 1}, ""ADVP"": {""RBR#IN"": 1}, ""ROOT"": {""SINV"": 1}, ""SINV"": {""VP#NP"": 1}}",0.0,0.853,0.147,"{""D"": 5, ""N"": 10, ""V"": 7, ""P"": 6, "","": 4, ""A"": 1, ""R"": 1, ""O"": 3, ""&"": 1, ""^"": 8}"
Follow traffic rules for your own and others safety kyunki road kisi ke baap ki nahi hai. ,90,17,2,11,6,2,1,0,0,1,,"{""NP"": {""NN#NNS"": 1, ""PRP$#JJ#CC#NNS#NN#NNS#NN#NNS#NN#NN#NN#NNS"": 1, ""NP#VP"": 1}, ""VP"": {""VBN"": 1, ""VB#NP#PP"": 1}, ""S"": {""VP#."": 1}}",0.0,0.851,0.149,"{""V"": 1, ""N"": 5, ""P"": 1, ""D"": 1, ""&"": 1, ""^"": 7, ""!"": 1, "","": 1}"
"Better late than never. Follow traffic rules for your own and others safety, kyunki road kisi ke baap ki nahi hai. ",115,21,2,13,6,2,1,0,0,1,,"{""ADVP"": {""RBR#RB"": 1, ""ADVP#PP"": 1}, ""PP"": {""IN#ADVP"": 1}, ""FRAG"": {""ADVP#."": 1}, ""ROOT"": {""FRAG"": 1}, ""NP"": {""NN#NNS"": 1, ""PRP$#JJ#CC#NNS#NN"": 1, ""JJ#NN#NNS"": 1, ""NN#NN#NNS"": 1}, ""VP"": {""VB#NP#PP"": 1, ""VBP"": 1, ""VBP#SBAR"": 1}, ""S"": {""S#,#NP#VP#."": 1}, ""SBAR"": {""S"": 1}}",0.0,0.769,0.231,"{""R"": 2, ""A"": 1, ""P"": 2, "","": 3, ""V"": 1, ""N"": 5, ""D"": 1, ""&"": 1, ""^"": 7, ""!"": 1}"
It is always better to be safe than sorry. Follow traffic rules for your own and others safety kyunki road kisi ke baap ki nahi hai. ,133,26,2,17,6,2,1,0,0,1,,"{""NP"": {""NN#NNS"": 1, ""PRP$#JJ#CC#NNS#NN#NNS#NN#NNS#NN#NN#NN#NNS"": 1, ""NP#VP"": 1}, ""ADJP"": {""JJR"": 1, ""JJ"": 1, ""JJ#PP"": 1}, ""PP"": {""IN#ADJP"": 1}, ""VP"": {""VB#ADJP"": 1, ""VBZ#ADVP#ADJP#S"": 1, ""VBN"": 1, ""VB#NP#PP"": 1}, ""S"": {""VP#."": 1}}",0.041,0.69,0.27,"{""O"": 1, ""V"": 3, ""R"": 1, ""A"": 3, ""P"": 3, "","": 2, ""N"": 5, ""D"": 1, ""&"": 1, ""^"": 7, ""!"": 1}"
"When I got to know the shocking facts & figures related to road accidents which can be prevented I was immediately on board for the Road Safety Campaign to help create awareness.Thank you to Sh. Nitin Gadkari, Sh. Mansukh Mandaviya & Sh.Yudhvir Singh Malik for the opportunity ",277,47,1,26,6,5,1,2,0,0,游똂:1,"{""WHADVP"": {""WRB"": 1}, ""NP"": {""DT#JJ#NNS"": 1, ""NN#NNS"": 1, ""NP#VP"": 1, ""NP#CC#NP#SBAR"": 1, ""DT#NNP#NNP#NNP"": 1, ""NP#,#NP#."": 1, ""NNP#NNP#CC#NNP"": 1, ""NP#NP"": 1}, ""VP"": {""VBN#PP"": 1, ""VBN"": 1, ""VB#VP"": 2, ""MD#VP"": 1, ""VBD#S"": 1, ""VB#NP#PP"": 1, ""VB#S"": 1, ""VBD#ADVP#PP#S"": 1}, ""WHNP"": {""WDT"": 1}, ""S"": {""SBAR#NP#VP#."": 1}, ""SBAR"": {""WHNP#S"": 1, ""WHADVP#S"": 1}, ""ROOT"": {""NP"": 2}}",0.095,0.686,0.219,"{""R"": 2, ""O"": 3, ""V"": 10, ""P"": 7, ""D"": 4, ""A"": 1, ""N"": 8, ""&"": 2, ""^"": 10, "","": 5, ""G"": 2}"
Met the living hockey legend Mr. Balbir Singh Sr. who was part of the winning team that brought home the first prestigious Gold for India back in 1948 along with Sudhir Chaudhary. Such an inspiration of a man with even more inspiring stories.,242,43,1,27,12,5,1,2,0,0,,"{""NP"": {""DT#NN#NN"": 1, ""NP#NP"": 1, ""NNP#NNP#NNP#NNP"": 1, ""DT#VBG#NN"": 1, ""DT#JJ#JJ#NN"": 1, ""CD"": 1, ""NP#SBAR"": 2, ""PDT#DT#NN"": 1, ""ADJP#NNS"": 1, ""NP#PP#PP#."": 1}, ""WHNP"": {""WP"": 1, ""WDT"": 1}, ""ADVP"": {""NP#IN"": 1, ""RB#PP"": 1}, ""PP"": {""IN#ADVP"": 1}, ""VP"": {""VBD#ADVP#NP#PP#ADVP#PP"": 1, ""VBD#NP"": 1, ""VBZ#NP"": 1}, ""SBAR"": {""WHNP#S"": 2}, ""ROOT"": {""NP"": 1}, ""ADJP"": {""RB#RBR#JJ"": 1}}",0.0,0.798,0.202,"{""V"": 3, ""D"": 5, ""N"": 9, ""^"": 8, ""O"": 1, ""P"": 8, ""A"": 6, ""R"": 2, ""$"": 1, "","": 2}"
"A major chunk of  was shot in Bradford. Pleased to see BradfordCity of Film extending their support in honour of India's first Gold medal and turning their city Gold yesterday. I had a great time filming there, thank you for making it a wonderful experience. ",259,45,1,23,9,5,1,1,0,2,,"{""NP"": {""DT#JJ#NN"": 3, ""NNP#POS"": 1, ""NP#JJ#NN#NN"": 1, ""NNP#NN"": 1, ""NP#VP"": 1}, ""PP"": {""IN"": 1, ""IN#S"": 1}, ""VP"": {""VBN#PP"": 1, ""VBD#VP"": 1, ""VBG#NP#PP"": 1, ""VBG#NP#NP"": 1, ""VP#CC#VP"": 1, ""VB#NP#S"": 1, ""VBN#S"": 1, ""VBG#ADVP"": 1, ""VBD#NP"": 1, ""VBG#NP"": 1, ""VBP#NP#PP"": 1}, ""S"": {""VP#."": 1}, ""ROOT"": {""SINV"": 1}, ""SINV"": {""S#,#VP#NP#."": 1}}",0.0,0.6,0.4,"{""D"": 5, ""A"": 4, ""N"": 9, ""P"": 7, ""V"": 9, ""^"": 5, "","": 4, ""Z"": 1, ""&"": 1, ""O"": 3, ""R"": 1}"
Dreams don't have an expiration date. A dream that took 12 years to realize. Watch the story of free India's first  on 15th August. ,132,24,1,12,7,5,1,0,0,2,,"{""NP"": {""DT#NN#NN"": 1, ""CD#NNS"": 1, ""DT#NN#SBAR#."": 1, ""JJ#NNP#POS"": 1, ""NP#JJ"": 1, ""JJ#NNP"": 1}, ""VP"": {""VBP#RB#VP"": 1, ""VB"": 1, ""VBD#NP#S"": 1}, ""S"": {""VP#."": 1}, ""ROOT"": {""NP"": 1}, ""WHNP"": {""WDT"": 1}, ""SBAR"": {""WHNP#S"": 1}}",0.0,0.714,0.286,"{""N"": 6, ""V"": 5, ""D"": 3, "","": 3, ""P"": 4, ""$"": 1, ""A"": 3, ""Z"": 1, ""^"": 1}"
Thank you so much Viru Paaji for coming. So glad to know you enjoyed the film ,78,16,1,12,4,5,0,0,1,0,游똂:1,"{""NP"": {""VBG"": 1}, ""ADJP"": {""RB#JJ"": 1, ""RB#JJ#S"": 1}, ""S"": {""NP"": 1, ""NP#ADJP#S"": 1, ""VP#."": 1}, ""VP"": {""VB#S"": 1, ""VBD#NP"": 1, ""VB#SBAR"": 1}, ""ROOT"": {""ADJP"": 1}, ""SBAR"": {""S"": 1}}",0.0,0.574,0.426,"{""V"": 4, ""O"": 2, ""R"": 2, ""A"": 2, ""^"": 2, ""P"": 2, "","": 1, ""D"": 1, ""N"": 1}"
"Thank you so much brother that's very generous of you, tried my best",68,13,1,8,4,5,0,0,1,0,游똂:1,"{""NP"": {""JJ#NN"": 1, ""NP#SBAR"": 1, ""PRP$#JJS"": 1}, ""WHNP"": {""WDT"": 1}, ""ADJP"": {""RB#JJ#PP"": 1}, ""VP"": {""VBZ#ADJP"": 1, ""VBD#NP"": 1, ""VB#NP#SBAR"": 1}, ""S"": {""NP#,#VP"": 1}, ""SBAR"": {""WHNP#S"": 1, ""IN#S"": 1}}",0.0,0.493,0.507,"{""V"": 2, ""O"": 2, ""R"": 2, ""A"": 3, ""N"": 1, ""L"": 1, ""P"": 1, "","": 1, ""D"": 1}"
"Thank you so much Guru Paaji, i hope so too ",44,10,1,8,4,5,0,0,1,0,,"{""NP"": {""FW"": 1}, ""ADVP"": {""RB#RB"": 2}, ""S"": {""NP#ADVP#NP"": 1, ""S#,#NP#VP"": 1}, ""VP"": {""VB#S"": 1, ""VBP#ADVP"": 1}}",0.0,0.565,0.435,"{""V"": 2, ""O"": 2, ""R"": 3, ""A"": 1, ""N"": 2, "","": 1}"
 Glad to be in the capital today as PVRCinemas  unites for India's first Gold,77,14,1,8,18,5,1,1,0,2,"游꿟:1,游끤:1","{""NP"": {""NNP#POS"": 1, ""NP#JJ#NN"": 1}, ""VP"": {""VB#PP#NP"": 1, ""VBZ#PP"": 1, ""VB#S#SBAR"": 1}, ""SBAR"": {""IN#S"": 1}}",0.0,0.812,0.188,"{""A"": 2, ""P"": 4, ""V"": 2, ""D"": 1, ""N"": 2, ""^"": 2, ""Z"": 1}"
 Celebrate the 70th anniversary of our first Gold medal victory at the iconic Chhatrapati Shivaji Maharaj Terminus today. Thank you Central Railway for commemorating this important occasion in India's sporting history ,218,31,1,11,15,5,1,1,0,2,,"{""NP"": {""DT#JJ#NN"": 2, ""PRP$#JJ#NNP#NN#NN"": 1, ""DT#JJ#NNP#NNP#NNP#NNP#NN"": 1, ""NNP#POS"": 1, ""NP#NN#NN"": 1}, ""PP"": {""IN#S"": 1}, ""VP"": {""VB#NP#PP"": 1, ""VBG#NP#PP"": 1, ""VB#S"": 1}, ""S"": {""VP#."": 1, ""NP#NP"": 1}}",0.0,0.705,0.295,"{""V"": 4, ""D"": 4, ""A"": 4, ""N"": 9, ""P"": 4, ""^"": 4, "","": 1, ""O"": 1, ""Z"": 1}"
" A view to behold as the Sabarmati Riverfront turns Gold, do go have a look to believe it. ",91,18,2,12,15,5,1,0,0,2,,"{""NP"": {""DT#NNP#NNP"": 1, ""DT#NN#S"": 2}, ""VP"": {""VBZ#NP"": 1, ""VB#SBAR"": 1, ""VB#VP"": 1, ""VBP#S"": 1}, ""S"": {""NP#,#VP#."": 1}, ""SBAR"": {""IN#S"": 1}}",0.0,1.0,0.0,"{""D"": 3, ""N"": 2, ""P"": 3, ""V"": 6, ""^"": 3, "","": 2, ""O"": 1}"
 The cosmopolitan Magarpatta City turns Gold on this iconic day marking 70 years of India's first Gold . ,105,18,2,10,14,5,1,0,0,2,游끤:1,"{""NP"": {""DT#JJ#NNP#NNP"": 1, ""DT#JJ#NN"": 1, ""CD#NNS"": 1, ""NNP#POS"": 1, ""NP#JJ#NN"": 1, ""NP#VP"": 1}, ""VP"": {""VBG#NP"": 1, ""VBZ#NP"": 1}}",0.0,1.0,0.0,"{""D"": 2, ""A"": 3, ""^"": 4, ""V"": 2, ""P"": 2, ""N"": 2, ""$"": 1, ""Z"": 1, "","": 1}"
The Pink City has a beautiful GOLDEN hue today as the Statue Circle turns Gold. ,80,15,2,8,14,5,1,0,0,2,,"{""NP"": {""DT#NNP#NNP"": 1, ""DT#JJ#NNP#NN#NN"": 1, ""DT#NNP#NNP#NNP#NNP"": 1}, ""VP"": {""VBZ#NP"": 1}}",0.0,0.769,0.231,"{""D"": 3, ""^"": 4, ""V"": 2, ""A"": 1, ""N"": 4, ""P"": 1, "","": 1}"
