.Tim Tebow and I look at Tebow fan tattoos  ,44,9,1,6,13,3,0,1,1,1,,"{""INTJ"": {""UH"": 1}, ""ROOT"": {""INTJ"": 1}, ""NP"": {""NP#CC#NP"": 1, ""NNP#NN#NNS"": 1}, ""VP"": {""VBP#PP"": 1}}",0.0,0.753,0.247,"{"","": 1, ""^"": 3, ""&"": 1, ""O"": 1, ""V"": 1, ""P"": 1, ""N"": 2}"
I eat the top layer of my popcorn using only my tongue. ,56,12,1,8,20,3,0,0,0,1,,"{""NP"": {""DT#JJ#NN"": 1, ""NP#VP"": 1}, ""VP"": {""VBG#ADVP#NP"": 1, ""VBP#NP"": 1}}",0.0,0.847,0.153,"{""O"": 1, ""V"": 2, ""D"": 3, ""A"": 1, ""N"": 3, ""P"": 1, ""R"": 1, "","": 1}"
It's Hashtags time! Tweet out a funny or embarrassing reason why you're single and tag it with . Could be on the show!,118,23,1,13,20,3,0,0,0,1,,"{""NP"": {""NNP#NN"": 1, ""DT#ADJP#NN"": 1, ""NP#SBAR"": 1}, ""VP"": {""VBZ#NP"": 1, ""VBP#ADJP"": 1, ""VB#PRT#NP"": 1, ""VB#NP#PP"": 1, ""VP#CC#VP"": 1, ""VB#PP"": 1, ""MD#VP"": 1}, ""S"": {""VP#."": 2}, ""PRT"": {""RP"": 1}, ""ADJP"": {""JJ#CC#VBG"": 1, ""JJ"": 1}, ""WHADVP"": {""WRB"": 1}, ""SBAR"": {""WHADVP#S"": 1}, ""PP"": {""IN"": 1}}",0.104,0.757,0.139,"{""L"": 2, ""^"": 1, ""N"": 3, "","": 3, ""V"": 4, ""T"": 1, ""D"": 2, ""A"": 3, ""&"": 2, ""R"": 1, ""O"": 1, ""P"": 2}"
"Tonight on the show: Sienna Miller, Tim Tebow, and music from Noel Gallagher's High Flying Birds! ",98,16,1,7,14,3,0,2,0,1,,"{""NP"": {""NP#,#NP"": 1, ""NNP#NNP#POS"": 1, ""NP#NNP#NNP#NNP"": 1, ""NP#:#NP#,#CC#NP#."": 1}, ""ROOT"": {""NP"": 1}}",0.0,1.0,0.0,"{""N"": 4, ""P"": 2, ""D"": 1, "","": 4, ""^"": 5, ""&"": 1, ""Z"": 1, ""A"": 1, ""V"": 1}"
"Back in New York with a great show tonight! Sarah Jessica Parker is here, Jesse Tyler Ferguson stops by, and music from wes ft. M  &  GoldLink! Plus, players from Super Bowl Champion Philadelphia Philadelphia Eagles!!  ",219,36,1,17,14,3,0,6,0,2,,"{""NP"": {""DT#JJ#NN"": 1, ""RB"": 1, ""NNP#NNP#NNP"": 2, ""NN#NN#NNP#CC#NNP"": 1, ""NNP#NNP#NNP#NNP#NNP#NNPS"": 1}, ""PP"": {""IN"": 1}, ""ADVP"": {""RB#PP"": 1}, ""FRAG"": {""ADVP#NP#."": 1}, ""ROOT"": {""FRAG"": 1}, ""VP"": {""VBZ#ADVP"": 1, ""VBZ#PP"": 1, ""NP#PP"": 1, ""VP#,#CC#VP"": 1, ""VBZ"": 1}, ""S"": {""S#,#NP#VP#."": 1, ""CC#,#NP#VP"": 1}}",0.037,0.664,0.299,"{""R"": 2, ""P"": 5, ""^"": 16, ""D"": 1, ""A"": 1, ""N"": 4, "","": 7, ""V"": 4, ""&"": 2, ""G"": 1}"
"What an awesome trip! Thank you for hosting us, Minneapolis! When can I come back?? ",84,15,1,9,14,3,0,0,1,0,,"{""NP"": {""WP"": 1, ""DT#JJ#NN"": 1, ""NP#NP#."": 1}, ""ROOT"": {""NP"": 1, ""SBARQ"": 1}, ""VP"": {""VBG#NP"": 1, ""VB#NP#PP"": 1, ""VB#PRT#NP"": 1}, ""S"": {""VP#,#NP#."": 1}, ""PP"": {""IN#S"": 1}, ""WHADVP"": {""WRB"": 1}, ""PRT"": {""RP"": 1}, ""SQ"": {""MD#NP#VP"": 1}, ""SBARQ"": {""WHADVP#SQ"": 1}}",0.0,0.614,0.386,"{""O"": 4, ""D"": 1, ""A"": 1, ""N"": 1, "","": 4, ""V"": 4, ""P"": 1, ""^"": 1, ""R"": 2}"
Thank you Minneapolis! Good night. ,35,5,1,2,6,1,0,0,0,1,,"{""S"": {""NP#NP"": 1, ""VP#."": 1}, ""VP"": {""VB#S"": 1}, ""ROOT"": {""INTJ"": 1}, ""INTJ"": {""JJ#NN#."": 1}}",0.0,0.345,0.655,"{""V"": 1, ""O"": 1, ""^"": 1, "","": 2, ""A"": 1, ""N"": 1}"
"LIVE in 10 minutes!!!! Justin Timberlake, the cast of This Is Us, Dwayne Johnson and Chris Stapleton.  from Minneapolis!",120,19,1,11,5,1,0,4,0,1,,"{""NP"": {""CD#NNS"": 1, ""NNP#NNP#NNP"": 1, ""NP#NP"": 1, ""DT"": 1, ""NP#,#NP"": 1, ""NP#,#NP#CC#NP"": 1}, ""VP"": {""VBZ#NP"": 1}, ""ROOT"": {""FRAG"": 1}, ""FRAG"": {""PP#."": 1}}",0.0,1.0,0.0,"{""V"": 2, ""P"": 3, ""$"": 1, ""N"": 2, "","": 5, ""^"": 7, ""D"": 1, ""O"": 2, ""&"": 1}"
Getting ready - we are on LIVE in MN after This Is Us TONIGHT!!! ,65,14,1,10,1,1,0,1,0,1,,"{""ADJP"": {""JJ"": 1}, ""VP"": {""VBG#ADJP"": 1, ""VBP#PP#PP"": 1, ""VBZ#NP"": 1}, ""S"": {""S#:#S"": 1}, ""NP"": {""DT"": 1}, ""SINV"": {""S#VP#NP"": 1}, ""ROOT"": {""SINV"": 1}}",0.0,0.78,0.22,"{""V"": 3, ""A"": 2, "","": 2, ""O"": 3, ""P"": 3, ""^"": 1, ""R"": 1}"
YESSSSS!!!! THAT IS HOW YOU DO IT!! Magic. Loved THAT! See you in a few.  ,74,15,1,11,1,1,0,0,0,2,,"{""NP"": {""NNP#NNP#NNP"": 1, ""NNP#NNP#NNP#NNP#NNP#NNP"": 1, ""NNP#NNP#."": 1, ""DT#JJ"": 1}, ""VP"": {""VBZ#NP"": 1, ""VB#NP#PP"": 1}, ""S"": {""VP#."": 1}, ""ROOT"": {""NP"": 1}}",0.0,0.72,0.28,"{""!"": 1, "","": 5, ""O"": 5, ""V"": 4, ""R"": 1, ""^"": 1, ""P"": 1, ""D"": 1, ""A"": 1}"
Go get em Justin.   ,20,4,1,3,1,1,0,0,0,3,,"{""VP"": {""VBP#NP"": 1}}",0.0,1.0,0.0,"{""V"": 2, ""O"": 1, ""^"": 1, "","": 1}"
Have the parties started yet? Cheers!! Minnesota Super Bowl Pepsi  ,67,10,1,4,18,1,1,2,0,2,,"{""NP"": {""DT#NNS"": 1, ""NNP#NNP#NNP#NNP#NNP#NNP"": 1}, ""VP"": {""VBN#ADVP"": 1}, ""SQ"": {""VBP#NP#VP#."": 1}, ""ROOT"": {""SQ"": 1, ""NP"": 1}}",0.0,0.405,0.595,"{""V"": 2, ""D"": 1, ""N"": 2, ""R"": 1, "","": 2, ""^"": 4}"
You guys have been phenomenal. Keep it up - youre almost at the homestretch.,76,14,1,10,18,1,0,0,1,0,,"{""NP"": {""PRP#NNS"": 1}, ""ADJP"": {""JJ"": 1, ""JJ#RB"": 1}, ""VP"": {""VBN#ADJP"": 1, ""VBP#VP"": 1, ""VB#NP#PRT"": 1, ""ADJP#PP"": 1, ""VP#:#VP"": 1}, ""S"": {""VP#."": 1}, ""PRT"": {""RP"": 1}}",0.0,1.0,0.0,"{""O"": 2, ""N"": 2, ""V"": 3, ""A"": 1, "","": 3, ""T"": 1, ""L"": 1, ""R"": 1, ""P"": 1, ""D"": 1}"
Here!!! Town Ball!! ,20,3,1,1,17,1,0,0,1,0,,"{""NP"": {""NNP#NNP#NNP#NNP"": 1}, ""FRAG"": {""ADVP#NP"": 1}, ""ROOT"": {""FRAG"": 1}}",0.0,1.0,0.0,"{""R"": 1, "","": 2, ""^"": 1, ""N"": 1}"
"On my way to Town Ball Tavern at Target Field. Fallon Tonight is having a tailgating party!!!! Food, games, music, hands high sweatshirts, KOOZIES and Ben & Jerry's Tonight Dough Pint Slices! ",192,32,1,14,17,1,0,3,0,1,,"{""NP"": {""NNP#NNP#NNP"": 1, ""DT#VBG#NN#NNP#NNP"": 1, ""NP#,#NP#,"": 1, ""JJ#NNS"": 1, ""NNP#CC#NNP#POS"": 1, ""NP#NNP#NNP#NNP#NNPS"": 1, ""NP#,#NP#CC#NP"": 1}, ""FRAG"": {""PP#."": 1}, ""ROOT"": {""FRAG"": 1}, ""VP"": {""VBG#NP"": 1, ""VBZ#VP"": 1, ""VBZ#NP"": 1}, ""S"": {""S#,#NP#VP#."": 1}}",0.0,1.0,0.0,"{""P"": 3, ""D"": 2, ""N"": 13, ""^"": 9, "","": 7, ""V"": 2, ""A"": 1, ""&"": 2}"
Off to Town Ball Tavern at Target Field. The Tonight Show is having a party. See you there! Happy  ,99,19,1,11,17,1,0,0,1,1,,"{""NP"": {""NNP#NNP#NNP"": 1, ""DT#NNP#NNP"": 1, ""EX"": 1}, ""ADVP"": {""IN#PP"": 1}, ""FRAG"": {""ADVP#."": 1}, ""ROOT"": {""FRAG"": 1, ""ADJP"": 1}, ""VP"": {""VBG#NP"": 1, ""VBZ#VP"": 1, ""VB#S"": 1}, ""S"": {""NP#NP"": 1, ""VP#."": 1}, ""ADJP"": {""JJ"": 1}}",0.0,0.705,0.295,"{""P"": 3, ""^"": 5, "","": 3, ""D"": 2, ""N"": 3, ""V"": 3, ""O"": 1, ""R"": 1, ""A"": 1}"
,0,0,0,0,13,1,1,0,0,0,,{},0.0,0.0,0.0,{}
Pepsias scared. And cold. We did so many takes that my right had was frozen into a GI Joe Kung Fu grip around the @Pepsi Pepsi was probably 5-6 stories up!#PepsiHalftime,169,31,1,19,13,1,0,2,0,1,,"{""NP"": {""DT"": 1, ""DT#NNP#NNP#NNP#NNP#NN"": 1, ""CD#NNS"": 1, ""NP#SBAR"": 1}, ""VP"": {""VBD"": 1, ""VB"": 1, ""VBD#ADVP#ADVP"": 1, ""VBN#PP#PP"": 1, ""VBD#VP"": 2, ""VBZ#SBAR"": 1, ""VBD#SBAR"": 1}, ""S"": {""CC#VP#."": 1}, ""ROOT"": {""NP"": 1}, ""ADVP"": {""NP#RB"": 1}, ""SBAR"": {""S"": 1, ""IN#S"": 2}}",0.22,0.78,0.0,"{""^"": 6, ""A"": 5, "","": 3, ""&"": 1, ""O"": 1, ""V"": 5, ""R"": 2, ""P"": 3, ""D"": 3, ""N"": 2, ""@"": 1, ""$"": 1, ""T"": 1, ""#"": 1}"
Here is proof that I was really sitting ON the Pepsi sign (harnessed to it actually) with a drone camera keeping me company just so you dont think it was CGI. I was there - the breeze coming off of the East River - preparing me for MN - freezing my S off. ,256,53,1,36,13,1,1,1,0,1,,"{""NP"": {""RB"": 2, ""DT#NNP#NN"": 1, ""DT#JJ#NN"": 1, ""NP#VP"": 2, ""NP#PRN#PP"": 1, ""DT#NNP#NNP"": 1, ""PRP$#NNP"": 1, ""NP#:#S"": 1}, ""PRT"": {""RP"": 3}, ""VP"": {""VBN#PP#ADVP"": 1, ""VBD#NP"": 2, ""VBP#SBAR"": 2, ""VBG#S#SBAR"": 1, ""VBG#PRT#NP"": 1, ""VBD#ADVP#VP"": 1, ""VBZ#NP#SBAR"": 1, ""VBG#PRT#PP"": 1, ""VBG#NP#PP"": 1, ""VBG#NP#PRT"": 1}, ""PRN"": {""-LRB-#VP#-RRB-"": 1}, ""S"": {""NP#NP"": 1, ""NP"": 1, ""S#:#S#:#S"": 1}, ""SBAR"": {""S"": 2, ""RB#IN#S"": 1, ""IN#S"": 1}}",0.03,0.97,0.0,"{""R"": 5, ""V"": 12, ""N"": 8, ""P"": 7, ""O"": 7, ""D"": 5, "","": 7, ""^"": 4, ""T"": 2}"
Watch in the mirror for full effect. See you tomorrow! ,55,10,1,6,3,1,1,0,0,1,,"{""NP"": {""JJ#NN"": 1}, ""VP"": {""VB#PP"": 1, ""VB#NP#NP"": 1}, ""S"": {""VP#."": 2}}",0.0,1.0,0.0,"{""V"": 2, ""P"": 2, ""D"": 1, ""N"": 3, ""A"": 1, "","": 2, ""O"": 1}"
Kevin Hart I got the bug!!! Thanks for having me. Thats a crowd!!!  ,68,13,1,7,3,1,0,1,0,2,,"{""NP"": {""NNP#NNP#PRP"": 1, ""CD#NNS"": 1, ""DT#NN#NN"": 1}, ""VP"": {""VBG#NP"": 1, ""VBD#NP#PP"": 1, ""VBZ"": 1}, ""PP"": {""NP#IN#S"": 1}, ""ROOT"": {""SINV"": 1}, ""SINV"": {""VP#NP"": 1}}",0.0,0.711,0.289,"{""^"": 2, ""O"": 2, ""V"": 2, ""D"": 2, ""N"": 3, "","": 3, ""P"": 1, ""L"": 1}"
"Thank you to the Salzer family in Champlin, MN for the best tater tot hot dish in town. You made me feel so welcome.",116,24,1,17,3,1,0,0,0,0,,"{""NP"": {""DT#NNP#NN"": 1, ""NNP#,#NNP"": 1, ""DT#JJS#NN#NN#JJ#NN"": 1}, ""VP"": {""VB#NP#PP"": 1, ""VBP#ADJP"": 1, ""VBD#SBAR"": 1}, ""S"": {""VP#."": 1}, ""ADJP"": {""RB#JJ"": 1}, ""SBAR"": {""S"": 1}}",0.0,0.665,0.335,"{""V"": 4, ""O"": 3, ""P"": 4, ""D"": 2, ""^"": 3, ""N"": 4, "","": 3, ""A"": 3, ""R"": 1}"
You guys are the best!!! So fun!! Thanks!!,42,8,1,5,13,1,0,0,1,0,,"{""NP"": {""PRP#NNS"": 1, ""DT#JJS#NN"": 1, ""CD#NNS"": 1, ""NP#NP"": 1, ""NP#VP"": 1}, ""ADVP"": {""RB#NP"": 1}, ""VP"": {""ADVP#VBN"": 1, ""VBP#NP"": 1}}",0.0,0.281,0.719,"{""O"": 1, ""N"": 2, ""V"": 1, ""D"": 1, ""A"": 2, "","": 3, ""R"": 1}"
Z100 New York. I will bring it back. I promise.,47,10,1,6,13,1,0,1,0,0,,"{""NP"": {""NNP#NNP#NNP#."": 1}, ""ROOT"": {""NP"": 1}, ""VP"": {""VB#NP#ADVP"": 1, ""MD#VP"": 1, ""VBP"": 1}}",0.0,0.753,0.247,"{""$"": 1, ""A"": 1, ""N"": 1, "","": 3, ""O"": 3, ""V"": 3, ""R"": 1}"
Right now Elvis Duran Show and Z100 New York with Elvis Duran!! We will talk all things Super Bowl. Tell Alexa to play Z100.,124,24,1,14,13,1,0,3,0,0,,"{""ADVP"": {""RB#RB"": 1}, ""NP"": {""NNP#NNP#NNP#CC#NNP#NNP#NNP"": 1, ""DT#NNS"": 1}, ""S"": {""NP#NP"": 1, ""ADVP#NP#VP#."": 1, ""VP#."": 1}, ""VP"": {""VB#S"": 2, ""MD#VP"": 1, ""VBD#SBAR"": 1}, ""SBAR"": {""S"": 1}}",0.0,0.762,0.238,"{""R"": 2, ""^"": 8, ""&"": 1, ""$"": 2, ""A"": 1, ""N"": 2, ""P"": 2, "","": 3, ""O"": 1, ""V"": 4, ""D"": 1}"
"Tonight: @samsmithworld, Cecily Strong, and magic from Dan White! Plus, your funniest  tweets! ",95,13,1,4,14,3,0,1,0,2,,"{""NP"": {""NP#:#NP#,#NP#,#CC#NP#."": 1}, ""ROOT"": {""NP"": 1}, ""VP"": {""VBZ"": 1}, ""S"": {""CC#,#NP#VP#."": 1}}",0.0,0.595,0.405,"{""N"": 2, "","": 6, ""@"": 1, ""^"": 3, ""A"": 3, ""&"": 1, ""P"": 1, ""V"": 1, ""D"": 1}"
Celebrate  today with a MAMA you love!  LitWorld ,49,8,1,4,13,1,1,1,1,1,,"{""NP"": {""DT#NNP"": 1}, ""VP"": {""VBP"": 1}, ""S"": {""NP#NP#PP#NP#VP#."": 1}, ""ROOT"": {""NP"": 1}}",0.0,0.379,0.621,"{""V"": 2, ""N"": 2, ""P"": 1, ""D"": 1, ""O"": 1, "","": 1, ""G"": 1}"
These puppies predict whether the Philadelphia Eagles or New England Patriots will win Super Bowl LII!!  ,105,16,1,6,13,1,0,2,1,1,,"{""NP"": {""DT#NNS"": 1, ""DT#NNP#NNPS"": 1, ""NNP#NNP#NNPS"": 1, ""NP#CC#NP"": 1, ""NNP#NNP#NNP#NNP"": 1}, ""VP"": {""MD#VP"": 1, ""VBP#SBAR"": 1}, ""SBAR"": {""IN#S"": 1}}",0.0,0.628,0.372,"{""D"": 2, ""N"": 1, ""V"": 3, ""P"": 1, ""^"": 7, ""&"": 1, ""A"": 1, "","": 1}"
I'm coming to Minnesota and I really want a home-cooked meal!! Who wants to host me? Send your recipe and why I should come to your home to JimmyVisitsMinnesota@tonightshow.com!!,178,29,1,20,1,3,0,0,1,0,,"{""NP"": {""DT#JJ#NN#NN"": 1, ""NP#SBAR"": 1, ""NP#CC#SBAR"": 1}, ""VP"": {""VBG#PP"": 1, ""VBP#VP"": 1, ""VBZ#S"": 1, ""VBP#NP"": 1, ""VB#PP#PP"": 1, ""MD#VP"": 1}, ""S"": {""NP#ADVP#VP"": 1, ""S#CC#S#."": 1}, ""WHNP"": {""WP"": 1}, ""SBAR"": {""WHNP#S"": 1, ""WHADVP#S"": 1}, ""WHADVP"": {""WRB"": 1}}",0.0,0.901,0.099,"{""L"": 1, ""V"": 7, ""P"": 4, ""^"": 1, ""&"": 2, ""O"": 4, ""R"": 2, ""D"": 3, ""N"": 4, "","": 3, ""U"": 1}"
Happy Birthday Justin Timberlake!!! Heres to many more years of bro biking and Drip Drops! Love ya bro!    ,107,18,1,10,0,1,0,1,0,4,,"{""NP"": {""JJ#NN#NNP#NNP#NNP"": 1, ""JJ#JJR#NNS"": 1, ""NN#NN"": 1, ""NP#CC#NP"": 1}, ""VP"": {""VBZ#PP"": 1}, ""ROOT"": {""SQ"": 1}, ""SQ"": {""VBD#NP#NP#."": 1}}",0.0,0.638,0.362,"{""A"": 3, ""N"": 5, ""^"": 2, "","": 3, ""L"": 1, ""P"": 2, ""&"": 1, ""V"": 3, ""D"": 1}"
See you tomorrow morning Elvis Duran Show!!! Bright and early. I cant wait!!! (How early is early?) ,100,17,1,7,0,1,0,1,0,1,,"{""NP"": {""NN#NN#NNP#NNP#NNP#NNP#NNP"": 1, ""JJ"": 2, ""NP#CC#NP"": 1, ""NP#PRN"": 1}, ""S"": {""NP#NP"": 1, ""VP#."": 1}, ""VP"": {""VB#S"": 1, ""VBZ#ADJP"": 1, ""MD#VP"": 1}, ""WHADVP"": {""WRB"": 1}, ""ADJP"": {""JJ"": 1}, ""SBAR"": {""WHADVP#S#."": 1}, ""PRN"": {""-LRB-#SBAR#-RRB-"": 1}}",0.0,0.787,0.213,"{""V"": 4, ""O"": 2, ""N"": 3, ""^"": 2, "","": 6, ""A"": 4, ""&"": 1, ""R"": 1}"
"Tonight on the show: Katie Couric stops by and Rita Ora  is here to chat! Plus, music from Liam & Rita Ora ! ",109,23,1,15,14,3,0,4,0,1,,"{""NP"": {""NP#:#S#."": 1, ""NNP#CC#NNP#NNP"": 1, ""NP#,#NP#."": 1}, ""PP"": {""IN"": 1}, ""VP"": {""VBZ#PP"": 1, ""VBZ#ADVP#PP"": 1}, ""S"": {""S#CC#S"": 1}, ""ROOT"": {""NP"": 2}}",0.098,0.902,0.0,"{""N"": 3, ""P"": 4, ""D"": 1, "","": 4, ""^"": 7, ""V"": 4, ""&"": 2, ""R"": 1}"
.christine teigen and I take the Best Friends Challenge!  ,58,9,1,5,12,3,0,1,1,1,,"{""INTJ"": {""UH"": 1}, ""ROOT"": {""INTJ"": 1}, ""NP"": {""JJ#NN"": 1, ""NP#CC#NP"": 1, ""DT#JJS#NNS#NN"": 1}, ""VP"": {""VBP#NP"": 1}}",0.0,0.36,0.64,"{"","": 2, ""^"": 2, ""&"": 1, ""O"": 1, ""V"": 1, ""D"": 1, ""A"": 1, ""N"": 2}"
Think Fast with Dakota Johnson!  ,33,5,1,2,13,3,0,0,1,1,,"{""S"": {""VP#."": 1}}",0.0,1.0,0.0,"{""V"": 1, ""A"": 1, ""P"": 1, ""^"": 2, "","": 1}"
"Once I made my kids waffles before they went skiing, and they didnt fall down the entire day. Now they think waffles are what keep them from falling down while skiing. ",168,31,1,21,22,3,0,0,0,1,,"{""NP"": {""PRP$#NNS"": 1, ""DT#JJ#NN"": 1}, ""VP"": {""VBD#NP"": 2, ""VBZ#SBAR"": 1, ""VB#PRT#NP"": 1, ""VBP#VP"": 1, ""VBG#PRT#PP"": 1, ""VBP#NP#PP"": 1, ""VBP#SBAR"": 2}, ""S"": {""SBAR#VP"": 1, ""S#,#CC#S#."": 1, ""ADVP#NP#VP#."": 1}, ""SBAR"": {""IN#S"": 2, ""WHNP#S"": 1, ""S"": 1}, ""PRT"": {""RP"": 2}, ""WHNP"": {""WP"": 1}, ""PP"": {""IN#S"": 1}}",0.052,0.948,0.0,"{""R"": 2, ""O"": 6, ""V"": 8, ""D"": 2, ""N"": 6, ""P"": 3, "","": 3, ""&"": 1, ""T"": 2, ""A"": 1}"
My buddy has a Giants jersey that he refuses to wash for the entire season. He keeps it on a hanger in the garage so his regular clothes dont steal its power. ,159,32,1,19,18,3,0,0,0,1,,"{""NP"": {""DT#NNP#NN"": 1, ""DT#JJ#NN"": 1, ""NP#SBAR"": 1, ""PRP$#JJ#NNS#NN"": 1}, ""VP"": {""VB#PP"": 1, ""VBZ#S"": 1, ""VBZ#NP"": 1, ""VBP#NP"": 1, ""VBZ#NP#PP#SBAR"": 1}, ""SBAR"": {""IN#S"": 2}}",0.0,0.917,0.083,"{""D"": 7, ""N"": 6, ""V"": 6, ""^"": 2, ""P"": 6, ""O"": 3, ""A"": 2, "","": 2}"
It's Hashtags time! Tweet out your funny or embarrassing superstition and tag it with . Could be on the show!,109,20,1,12,18,3,0,0,0,1,,"{""NP"": {""NNP#NN"": 1, ""PRP$#ADJP#NN"": 1}, ""VP"": {""VBZ#NP"": 1, ""VB#PRT#NP"": 1, ""VB#NP#PP"": 1, ""VP#CC#VP"": 1, ""VB#PP"": 1, ""MD#VP"": 1}, ""S"": {""VP#."": 2}, ""PRT"": {""RP"": 1}, ""ADJP"": {""JJ#CC#VBG"": 1}, ""PP"": {""IN"": 1}}",0.113,0.736,0.151,"{""L"": 1, ""^"": 1, ""N"": 3, "","": 3, ""V"": 4, ""T"": 1, ""D"": 2, ""A"": 2, ""&"": 2, ""O"": 1, ""P"": 2}"
"Tonight: Dakota Johnson is here, Lester Holt stops by, and Jason Aldean performs! ",82,13,1,4,13,3,0,2,0,1,,"{""VP"": {""VBZ#ADVP"": 1, ""VBZ#PP"": 1, ""VBZ"": 1}, ""S"": {""S#,#NP#VP"": 1, ""S#,#CC#S"": 1}, ""PP"": {""IN"": 1}, ""FRAG"": {""NP#:#S#."": 1}, ""ROOT"": {""FRAG"": 1}}",0.136,0.864,0.0,"{""N"": 1, "","": 4, ""^"": 6, ""V"": 3, ""R"": 1, ""P"": 1, ""&"": 1}"
Will Ferrell is a genius. Watch  this weekend with Chris Stapleton.,67,11,1,5,18,1,0,1,1,1,,"{""VP"": {""VBZ#NP"": 1, ""VB#NP#PP"": 1}, ""S"": {""VP#."": 1}}",0.0,1.0,0.0,"{""V"": 3, ""^"": 3, ""D"": 2, ""N"": 2, "","": 2, ""P"": 1}"
"Tonight: Chelsea Handler, desus and mero & stand-up from Rob Haze (Rob HZ Hazeopedia 8.16.19)! Plus, it's !  ",109,18,1,10,14,3,0,3,0,2,,"{""NP"": {""NP#,#NP#CC#NP"": 1, ""NNP#NNP#NNP"": 1, ""CD"": 1, ""NP#NP"": 1, ""NP#PRN"": 1, ""NP#CC#NP"": 1, ""NP#:#NP#."": 1}, ""PRN"": {""-LRB-#NP#-RRB-"": 1}, ""ROOT"": {""NP"": 1}, ""VP"": {""VBZ"": 1}, ""S"": {""CC#,#NP#VP#."": 1}}",0.218,0.782,0.0,"{""N"": 2, "","": 7, ""^"": 8, ""&"": 2, ""A"": 1, ""P"": 1, ""$"": 1, ""V"": 1, ""L"": 1}"
Peter & His Heckler   ,22,4,1,2,13,3,0,0,1,2,,"{""NP"": {""SYM"": 1, ""NP#NP#NP"": 1}, ""ROOT"": {""NP"": 1}}",0.0,1.0,0.0,"{""^"": 1, ""&"": 1, ""D"": 1, ""N"": 1}"
 crushed it last night!!!  ,27,4,1,2,12,1,0,0,1,3,,"{""NP"": {""JJ#NN#NNS"": 1}, ""S"": {""NP#NP"": 1}, ""VP"": {""VBN#S"": 1}}",0.551,0.449,0.0,"{""V"": 1, ""O"": 1, ""A"": 1, ""N"": 1, "","": 1}"
Check out .    ,15,3,1,2,4,1,0,0,1,4,,"{""PRT"": {""RP"": 1}, ""VP"": {""VB#PRT"": 1}, ""S"": {""VP#."": 1}}",0.0,1.0,0.0,"{""V"": 1, ""T"": 1, "","": 1}"
Turn it up!!,12,3,1,3,4,1,0,0,0,0,,"{""VP"": {""VB#NP#PP"": 1}}",0.0,1.0,0.0,"{""V"": 1, ""O"": 1, ""T"": 1, "","": 1}"
Its on!!    ,12,2,1,2,4,1,0,0,0,4,,"{""VP"": {""VB#PP"": 1}}",0.0,1.0,0.0,"{""L"": 1, ""P"": 1, "","": 1}"
Watch Will tonight. Things get weird. It was so fun- and congrats MIGOS the new album is out in 15 minutes!!!!,110,21,1,13,4,1,0,1,1,0,,"{""NP"": {""NNP#NN"": 1, ""DT#JJ#NN"": 1, ""CD#NNS"": 1}, ""VP"": {""VBP#ADJP"": 1, ""VBD#ADJP"": 1, ""VBZ#ADVP#ADJP"": 1, ""VBZ#SBAR"": 1}, ""S"": {""VP#."": 1, ""CC#S"": 1, ""S#:#S"": 1}, ""ADJP"": {""JJ"": 2, ""RB#JJ"": 1}, ""ADVP"": {""IN#PP"": 1}, ""SBAR"": {""S"": 1}}",0.059,0.626,0.315,"{""V"": 6, ""R"": 2, "","": 3, ""N"": 4, ""A"": 3, ""O"": 1, ""&"": 1, ""D"": 1, ""P"": 2, ""$"": 1}"
"Tonight on the show: Will Ferrell, Kid Animal Expert Robert Irwin, and music from MIGOS! Plus, your funniest  tweets! ",118,19,1,7,14,3,0,1,0,2,,"{""NP"": {""NNP#NNP#NNP#NNP#NNP"": 1, ""NP#,#NP"": 1, ""NP#:#NP#,#CC#NP#."": 1}, ""ROOT"": {""NP"": 1}, ""VP"": {""VBZ"": 1}, ""S"": {""CC#,#NP#VP#."": 1}}",0.0,0.811,0.189,"{""N"": 5, ""P"": 2, ""D"": 2, "","": 6, ""V"": 3, ""^"": 5, ""&"": 1, ""A"": 1}"
Ice T shares some of his lesser-known voiceover work  ,54,9,1,6,13,3,0,0,1,1,,"{""NP"": {""NNP#NNP#NNS"": 1, ""DT"": 1, ""PRP$#JJ#NN#NN"": 1, ""NP#NP"": 1}, ""ROOT"": {""NP"": 1}}",0.0,0.761,0.239,"{""^"": 2, ""V"": 1, ""D"": 2, ""P"": 1, ""A"": 1, ""N"": 2}"
"Until last year, my dad thought that Van Halen was saying Had enough! in their song Panama. ",92,17,1,9,18,3,0,0,0,1,,"{""NP"": {""JJ#NN"": 1, ""PRP$#NN#NN"": 1}, ""ADVP"": {""RB#RB"": 1}, ""VP"": {""VBG#ADVP"": 1, ""VBD#VP"": 1, ""VBD#SBAR"": 1}, ""S"": {""PP#,#NP#VP#."": 1}, ""SBAR"": {""IN#S"": 1}, ""ROOT"": {""FRAG"": 1}, ""FRAG"": {""PP#."": 1}}",0.0,1.0,0.0,"{""P"": 3, ""A"": 1, ""N"": 3, "","": 3, ""D"": 2, ""V"": 4, ""^"": 3, ""R"": 1}"
It's Hashtags time! Tweet out a song lyric that you or a friend got wrong and tag it with . Could be on our show!,113,25,1,17,18,3,0,0,0,1,,"{""NP"": {""NNP#NN"": 1, ""DT#NN#NN"": 1, ""NP#CC#NP"": 1}, ""VP"": {""VBZ#NP"": 1, ""VBD#ADJP"": 1, ""VB#PRT#NP#SBAR"": 1, ""VB#NP#PP"": 1, ""VP#CC#VP"": 1, ""VB#PP"": 1, ""MD#VP"": 1}, ""S"": {""VP#."": 2}, ""PRT"": {""RP"": 1}, ""ADJP"": {""JJ"": 1}, ""SBAR"": {""IN#S"": 1}, ""PP"": {""IN"": 1}}",0.115,0.744,0.141,"{""L"": 1, ""^"": 1, ""N"": 5, "","": 3, ""V"": 5, ""T"": 1, ""D"": 3, ""P"": 3, ""O"": 2, ""&"": 2, ""A"": 1}"
"Fun show tonight! Ice T (ICE T) is here, Meghan Trainor stops by, and The Avett Brothers perform! ",98,18,1,10,15,3,0,3,0,1,,"{""NP"": {""RB"": 1, ""NP#PRN"": 1, ""DT#NNP#NNPS"": 1}, ""VP"": {""VBP#NP"": 1, ""VBZ#ADVP"": 1, ""VBZ#PP"": 1, ""VBP"": 1}, ""S"": {""S#PRN#CC#S#."": 1}, ""PRN"": {""-LRB-#NP#-RRB-"": 1, "",#S#,"": 1}, ""PP"": {""IN"": 1}}",0.078,0.732,0.19,"{""A"": 3, ""N"": 4, "","": 6, ""^"": 4, ""V"": 3, ""R"": 1, ""P"": 1, ""&"": 1, ""D"": 1}"
.Alex Rodriguez has Hitting Contest with 22-Month-Old Baseball Prodigy!  ,73,9,1,2,14,3,0,1,1,1,,"{""INTJ"": {""UH"": 1}, ""ROOT"": {""INTJ"": 1}, ""NP"": {""JJ#NNP#NNP"": 1}, ""VP"": {""VBZ#NP"": 1}}",0.0,1.0,0.0,"{"","": 2, ""^"": 2, ""V"": 2, ""N"": 3, ""P"": 1, ""$"": 1}"
"Tonight: Alex Rodriguez, Taylor Kitsch, Clive Davis & music from Bebe Rexha ft. Florida Georgia Line! ",102,16,1,5,14,3,0,4,0,1,,"{""NP"": {""NNP#NNP#CC#NNP"": 1, ""NNP#NNP#NNP#NNP#NNP#NNP"": 1, ""NP#:#NP#,#NP#,#NP#."": 1}, ""ROOT"": {""NP"": 1}}",0.0,1.0,0.0,"{""N"": 3, "","": 5, ""^"": 10, ""&"": 1, ""P"": 1, ""V"": 1}"
Water War with Jason Momoa  ,28,5,1,2,13,3,0,0,1,1,,"{""ROOT"": {""NP"": 1}}",0.494,0.506,0.0,"{""N"": 2, ""P"": 1, ""^"": 2}"
Tonight Show is on right nowwwwwwww!!!! Turn on NBC!,52,9,1,6,4,1,0,0,0,0,,"{""NP"": {""JJ#NN#NN#NN"": 1}, ""VP"": {""VBZ#PP"": 1}}",0.0,1.0,0.0,"{""N"": 2, ""V"": 2, ""P"": 2, ""R"": 2, "","": 2, ""^"": 1}"
Thats a good idea. Any idea hands high??,40,8,1,4,4,1,0,1,1,0,,"{""NP"": {""DT#JJ#NN"": 1, ""NP#NP#."": 1, ""JJ#NNS"": 1, ""NP#NP#NP"": 1}, ""ROOT"": {""NP"": 2}}",0.0,0.648,0.352,"{""L"": 1, ""D"": 2, ""A"": 2, ""N"": 3, "","": 2}"
.Elias should try WALKING WITH a guitar tuner.   ,49,8,1,3,3,1,0,1,0,3,,"{""INTJ"": {""UH"": 1}, ""ROOT"": {""INTJ"": 1}, ""NP"": {""DT#NN#NN"": 1}, ""VP"": {""VBG#PP"": 1, ""VB#S"": 1, ""MD#VP"": 1}}",0.0,1.0,0.0,"{"","": 2, ""^"": 1, ""V"": 3, ""P"": 1, ""D"": 1, ""N"": 2}"
No Sleep Till Brooklyn. On my way.,34,7,1,5,0,1,0,0,1,0,,"{""VP"": {""VBP#PP"": 1}, ""ROOT"": {""FRAG"": 1}, ""FRAG"": {""PP#."": 1}}",0.268,0.732,0.0,"{""D"": 2, ""N"": 2, ""P"": 2, ""^"": 1, "","": 2}"
"Tonight: Greg Kinnear, Water War with Jason Momoa, and music from The War on Drugs! ",84,15,1,8,14,3,0,1,0,1,,"{""NP"": {""NP#,#NP#,"": 1, ""NP#CC#NP"": 1, ""NP#:#NP#."": 1}, ""ROOT"": {""NP"": 1}}",0.384,0.616,0.0,"{""N"": 6, "","": 4, ""^"": 4, ""P"": 3, ""&"": 1, ""D"": 1}"
"Happy ! Tonight on the show Trevor Noah is here, Dakota Fanning stops by, and stand-up from Jeff Dye! ",102,19,1,11,13,3,0,2,0,2,,"{""INTJ"": {""UH#."": 1}, ""ROOT"": {""INTJ"": 1}, ""NP"": {""DT#NN#NNP#NNP"": 1}, ""PP"": {""IN"": 1}, ""VP"": {""VBZ#ADVP"": 1, ""VBZ#PP"": 1, ""NP#PP"": 1, ""VP#,#CC#VP"": 1}, ""S"": {""S#,#NP#VP#."": 1}}",0.073,0.731,0.196,"{""A"": 2, "","": 4, ""N"": 2, ""P"": 3, ""D"": 1, ""^"": 6, ""V"": 2, ""R"": 1, ""&"": 1}"
"The first-ever tag-team Lip Sync Battle with WWE's Triple H, Stephanie McMahon and The New Day (Austin Creed, KOFI & Florida Man)!  ",132,22,1,11,13,3,0,6,1,1,,"{""NP"": {""DT#JJ#NN"": 1, ""NNP#NNP#NNP"": 1, ""NNP#POS"": 1, ""NP#JJ#NN"": 1, ""DT#NNP#NNP"": 1, ""NNP#CC#NNP#NNP"": 1, ""NP#,#NP"": 1, ""NP#PRN"": 1, ""NP#,#NP#CC#NP"": 1, ""NP#NP#."": 1}, ""PRN"": {""-LRB-#NP#-RRB-"": 1}, ""ROOT"": {""NP"": 1}}",0.126,0.874,0.0,"{""D"": 2, ""A"": 2, ""N"": 6, ""P"": 1, ""Z"": 1, ""^"": 8, "","": 4, ""&"": 2}"
"Great show tonight: Jessica Chastain, Ricky Martin, and music from Franz Ferdinand! Plus, your funniest  tweets! ",113,16,1,4,14,3,0,3,0,2,,"{""NP"": {""JJ#NN#NN"": 1, ""NP#:#NP#,#NP#,#CC#NP#."": 1}, ""ROOT"": {""NP"": 1}, ""VP"": {""VBZ"": 1}, ""S"": {""CC#,#NP#VP#."": 1}}",0.0,0.628,0.372,"{""A"": 2, ""N"": 4, "","": 6, ""^"": 6, ""&"": 1, ""P"": 1, ""V"": 1, ""D"": 1}"
".camila, The Roots and I perform ""Havana"" with Classroom Instruments!  ",71,10,1,4,13,3,0,2,1,1,,"{""INTJ"": {""UH"": 1}, ""ROOT"": {""INTJ"": 1}, ""NP"": {""DT#NNPS"": 1, ""NP#,#NP#CC#NP"": 1, ""``#NP#PP"": 1}, ""VP"": {""VBP#NP"": 1}}",0.0,1.0,0.0,"{"","": 5, ""^"": 3, ""D"": 1, ""N"": 2, ""&"": 1, ""O"": 1, ""V"": 1, ""P"": 1}"
My dad bought a treadmill to get in shape. We came home once and there was a beer in the cup holder. ,101,22,1,17,20,3,0,0,0,1,,"{""NP"": {""DT#NN#S"": 1, ""EX"": 1, ""DT#NN#NN"": 1}, ""VP"": {""VB#PP"": 1, ""VBD#NP"": 2, ""VBD#NP#ADVP"": 1}, ""S"": {""S#CC#S#."": 1}}",0.0,1.0,0.0,"{""D"": 4, ""N"": 7, ""V"": 4, ""P"": 3, "","": 2, ""O"": 1, ""R"": 2, ""&"": 1}"
It's Hashtags time! Tweet out your funny or embarrassing story about working out or dieting and tag it with . Could be on the show!,131,25,1,14,20,3,0,0,0,1,,"{""NP"": {""NNP#NN"": 1, ""PRP$#ADJP#NN"": 1}, ""VP"": {""VBZ#NP"": 1, ""VBG#PRT"": 1, ""VB#PRT#NP#PP"": 1, ""VB#CC#VB#NP#PP"": 1, ""VP#CC#VP"": 1, ""VB#PP"": 1, ""MD#VP"": 1}, ""S"": {""VP#."": 2}, ""PRT"": {""RP"": 2}, ""ADJP"": {""JJ#CC#JJ"": 1}, ""PP"": {""IN#S"": 1, ""IN"": 1}}",0.093,0.783,0.124,"{""L"": 1, ""^"": 1, ""N"": 3, "","": 3, ""V"": 6, ""T"": 2, ""D"": 2, ""A"": 2, ""&"": 3, ""P"": 3, ""O"": 1}"
"Tonight on the show: Chris Hemsworth is here, Carrie Brownstein stops by, and CAITLYN SMITH performs! ",102,16,1,5,15,3,0,3,0,1,,"{""NP"": {""NP#:#S#,#S#."": 1}, ""PP"": {""IN"": 1}, ""VP"": {""VBZ#ADVP"": 1, ""VBZ#PP"": 1, ""VBZ"": 1}, ""S"": {""S#,#CC#S"": 1}, ""ROOT"": {""NP"": 1}}",0.112,0.888,0.0,"{""N"": 2, ""P"": 2, ""D"": 1, "","": 4, ""^"": 6, ""V"": 3, ""R"": 1, ""&"": 1}"
 ,1,0,1,0,14,1,0,0,1,2,,{},0.0,0.0,0.0,{}
He looks like hes got this down!,32,7,1,5,2,1,0,0,1,0,,"{""NP"": {""DT"": 1}, ""PRT"": {""RP"": 1}, ""VP"": {""VBD#NP#PRT"": 1, ""VBZ#SBAR"": 1}, ""SBAR"": {""IN#S"": 1}}",0.0,0.682,0.318,"{""O"": 2, ""V"": 2, ""P"": 1, ""L"": 1, ""T"": 1, "","": 1}"
"Tonight: Password with Tomlin and Wagner, Jane Seymour Fonda, and Cole M. Sprouse. Plus, music from WALK THE MOON! ",115,19,1,9,14,3,0,4,0,1,,"{""NP"": {""NNP#CC#NNP"": 1, ""NNP#NNP#NNP"": 3, ""NP#,#NP#,#CC#NP"": 1, ""NP#:#NP#."": 1, ""NP#,#NP#."": 1}, ""ROOT"": {""NP"": 2}}",0.0,1.0,0.0,"{""N"": 4, "","": 7, ""^"": 8, ""P"": 2, ""&"": 2, ""A"": 1, ""V"": 1, ""D"": 1}"
"Fun show tonight! James Spader is here, camila stops by, and stand-up from pete lee! Happy !  ",94,17,1,9,14,3,0,2,0,2,,"{""NP"": {""RB"": 1, ""JJ#NN"": 1}, ""VP"": {""VBP#NP"": 1, ""VBZ#ADVP"": 1, ""VBZ#PP"": 1, ""NP#PP"": 1, ""VP#,#CC#VP"": 1}, ""S"": {""S#,#NP#VP#."": 1}, ""ROOT"": {""INTJ"": 1}, ""PP"": {""IN"": 1}, ""INTJ"": {""UH#."": 1}}",0.071,0.578,0.35,"{""A"": 3, ""N"": 2, "","": 5, ""^"": 5, ""V"": 2, ""R"": 1, ""P"": 2, ""&"": 1}"
