fixed tweet,tweet length,number of words,number of lines,number of short words,upload hour,tweet source code,included media(?),number of user mentions,number of links,number of hashtags,emojis,pcfg rules,negativity score,neutrality score,positivity score,part of speech tagging
happy happy birthday to my favorite dance partner Madonna. Love ya pal.,71,12,1,5,15,1,0,1,0,0,,"{""ADJP"": {""JJ#JJ"": 1}, ""NP"": {""ADJP#NN"": 1, ""PRP$#JJ#NN#NN"": 1}, ""VP"": {""VBZ"": 2}, ""S"": {""ADVP#NP#VP#."": 1}}",0.0,0.354,0.646,"{""A"": 3, ""N"": 4, ""P"": 1, ""D"": 2, ""^"": 1, "","": 2, ""V"": 1}"
"Tonight: John Travolta, marlon wayans and  Ask Again, Yes author Mary Beth Keane! Plus, music from Caroline Jones! ",115,18,1,7,13,1,0,3,0,2,,"{""NP"": {""NN#NNS"": 1, ""NNP#NN#NNP#NNP#NNP"": 1, ""NP#,#NP"": 1, ""NP#,#NP#CC#NP"": 1, ""NP#:#NP#."": 1, ""NP#,#NP#."": 1}, ""ROOT"": {""NP"": 2}}",0.0,0.838,0.162,"{""N"": 3, "","": 6, ""^"": 9, ""&"": 1, ""V"": 2, ""R"": 1, ""!"": 1, ""P"": 1}"
Wheel of Musical Impressions w/ ac  ,36,6,1,3,12,1,0,1,1,1,,"{""X"": {""SYM"": 1, ""X#PP"": 1}, ""NP"": {""JJ#NNP#NN"": 1}, ""FRAG"": {""X#:#NP"": 1}, ""ROOT"": {""FRAG"": 1}}",0.0,0.725,0.275,"{""N"": 3, ""P"": 2, ""^"": 1}"
Kate UptonYou know I am.,24,5,1,4,22,1,0,2,0,0,,"{""VP"": {""VBP"": 1, ""VBP#SBAR"": 1}, ""SBAR"": {""S"": 1}}",0.0,1.0,0.0,"{""^"": 2, ""V"": 2, ""O"": 1, "","": 1}"
YOU were the one making ME laugh! Thanks again for doing that. I was honored.,77,15,1,8,22,1,0,0,1,0,,"{""NP"": {""NNP#NN"": 1, ""NP#VP"": 1, ""DT"": 1}, ""VP"": {""VBG#NP"": 2, ""VBD#NP"": 1, ""VB#ADVP#PP"": 1, ""VBD#ADJP"": 1}, ""S"": {""VP#."": 1}, ""PP"": {""IN#S"": 1}, ""ADJP"": {""VBN"": 1}}",0.0,0.509,0.491,"{""O"": 4, ""V"": 5, ""D"": 1, ""$"": 1, "","": 3, ""N"": 1, ""R"": 1, ""P"": 1, ""A"": 1}"
"Tonight on the show: Ice Cube, Kieran Culkin and Wheel of Musical Impressions with ac! Plus, music from JUANES & ac! ",117,21,1,10,12,1,0,4,0,1,,"{""NP"": {""NN#NN"": 1, ""NP#,#NP#CC#NP"": 1, ""JJ#NNS"": 1, ""NP#:#NP#PP#."": 1, ""NNP#CC#NNP"": 1, ""NP#,#NP#."": 1}, ""ROOT"": {""NP"": 2}}",0.0,0.884,0.116,"{""N"": 6, ""P"": 4, ""D"": 1, "","": 5, ""^"": 7, ""&"": 2, ""V"": 1}"
Jonathan Groff sings a voice memo as Disney's Frozen 2s Kristoff  ,66,11,1,4,12,1,0,1,1,1,,"{""NP"": {""DT#NN#NN"": 1, ""NNP#POS"": 1, ""NP#NNP#NNP#NNP"": 1}, ""VP"": {""VBZ#NP#PP"": 1}}",0.0,1.0,0.0,"{""^"": 3, ""V"": 1, ""D"": 1, ""N"": 3, ""P"": 1, ""Z"": 1, ""A"": 1}"
"Tonight: Henry Golding, Jonathan Groff and music from Yung Rnzl  ft. SWIZZ BEATZ! ",82,13,1,5,12,1,0,3,0,1,👑:1,"{""NP"": {""NNP#NNP#NN#NNP#NNP"": 1, ""NP#,#NP#CC#NP"": 1, ""NP#:#NP#."": 1}, ""ROOT"": {""NP"": 1}}",0.0,1.0,0.0,"{""N"": 3, "","": 4, ""^"": 6, ""&"": 1, ""P"": 1, ""V"": 1, ""A"": 1}"
"Fun show tonight with COMMON, Kate Upton, and music from COMMON ft. SWIZZ BEATZ! ",81,14,1,7,12,1,0,4,0,1,,"{""NP"": {""RB"": 1, ""NP#,#NP#,#CC#NP"": 1, ""NNP#NNP#NNP#NNP"": 1}, ""VP"": {""VBP#NP#PP#PP"": 1}}",0.0,0.784,0.216,"{""A"": 2, ""N"": 4, ""P"": 2, ""^"": 4, "","": 4, ""&"": 1, ""V"": 1}"
"Fun show tonight with a very special guest! Plus, Lil Rel Howery and a performance from Natalie Merchant! ",106,18,1,10,15,1,0,2,0,1,,"{""NP"": {""RB"": 1, ""DT#RB#JJ#NN"": 1, ""NNP#NNP#NNP"": 1, ""NP#CC#NP"": 1, ""NP#,#NP#."": 1}, ""VP"": {""VBP#NP#PP"": 1}, ""ROOT"": {""NP"": 1}}",0.0,0.671,0.329,"{""A"": 2, ""N"": 4, ""P"": 2, ""D"": 2, ""R"": 1, "","": 3, ""V"": 1, ""^"": 5, ""&"": 1}"
Michael Rubin visionary! A genius! This is cool to see.,55,10,1,6,13,1,0,1,0,0,,"{""NP"": {""DT#NN#."": 1, ""DT"": 1}, ""FRAG"": {""NP#ADVP#."": 1}, ""ROOT"": {""FRAG"": 1, ""NP"": 1}, ""VP"": {""VB"": 1, ""VBZ#ADJP"": 1}, ""ADJP"": {""JJ#S"": 1}}",0.0,0.527,0.473,"{""^"": 2, ""N"": 2, "","": 3, ""D"": 1, ""O"": 1, ""V"": 2, ""A"": 1, ""P"": 1}"
"Tonight: Greg Kinnear, Phoebe Waller-Bridge and music from Sean Don! ",69,10,1,5,1,1,0,1,0,1,,"{""NP"": {""NP#,#NP#CC#NP"": 1, ""NP#:#NP#."": 1}, ""ROOT"": {""NP"": 1}}",0.0,1.0,0.0,"{""N"": 2, "","": 3, ""^"": 6, ""&"": 1, ""P"": 1}"
"My friend had a giant hole rusted through the bottom of his car. He would pretend to stop the car with his feet, Flintstones style. ",132,25,1,15,20,1,0,0,0,1,,"{""NP"": {""DT#JJ#NN"": 1, ""NP#VP"": 1, ""PRP$#NNS"": 1, ""JJ#NN"": 1, ""NP#,#NP"": 1}, ""VP"": {""VBN#PP"": 1, ""VBD#NP"": 1, ""VB#NP#PP"": 1, ""VB#S"": 1, ""MD#VP"": 1}}",0.129,0.755,0.115,"{""D"": 6, ""N"": 7, ""V"": 4, ""A"": 2, ""P"": 4, "","": 3, ""O"": 1, ""^"": 1}"
Its Hashtags time! Tag a tweet with  and then tell us about a funny or weird thing that happened to you or a friend involving cars. Could be on the show!,153,31,1,18,20,1,0,0,0,1,,"{""NP"": {""PRP$#NN#NN"": 1, ""DT#ADJP#NN"": 1, ""NP#CC#NP"": 1, ""NP#SBAR"": 1}, ""FRAG"": {""NP#."": 1}, ""ROOT"": {""FRAG"": 1}, ""PP"": {""IN"": 1}, ""VP"": {""VB#NP#PP"": 1, ""VBG#NP"": 1, ""VBD#PP#S"": 1, ""ADVP#VB#NP#PP"": 1, ""VP#CC#VP"": 1, ""VB#PP"": 1, ""MD#VP"": 1}, ""ADJP"": {""JJ#CC#JJ"": 1}, ""WHNP"": {""WDT"": 1}, ""S"": {""VP#."": 2}, ""SBAR"": {""WHNP#S"": 1}}",0.051,0.749,0.2,"{""L"": 1, ""N"": 7, "","": 3, ""V"": 6, ""D"": 4, ""P"": 5, ""&"": 3, ""R"": 1, ""O"": 2, ""A"": 2}"
"Tonight on the show: Dakota Johnson, Posty, Jon Lovitz and a performance from Tyler Childers! ",94,15,1,6,12,1,0,3,0,1,,"{""NP"": {""NP#,#NP#,#NP#CC#NP"": 1, ""NNP#NNPS"": 1, ""NP#:#NP#PP#."": 1}, ""ROOT"": {""NP"": 1}}",0.0,1.0,0.0,"{""N"": 3, ""P"": 2, ""D"": 2, "","": 4, ""^"": 7, ""&"": 1}"
"Tonight: Julianne Moore, Jacob Tremblay and talk + stand-up from julio torres ~* ",81,13,1,5,20,1,0,3,0,1,,"{""NP"": {""NN#NN#NN"": 1, ""JJ#NNS#NNS"": 1, ""NP#,#NP#CC#NP"": 1, ""NP#:#NP#X"": 1}, ""X"": {""SYM"": 1}, ""ROOT"": {""NP"": 1}}",0.0,1.0,0.0,"{""N"": 1, "","": 3, ""^"": 6, ""&"": 2, ""V"": 1, ""A"": 1, ""P"": 1, ""G"": 1}"
Thank you!!!,12,2,1,0,16,1,0,0,1,0,,"{""ADJP"": {""JJ"": 1}, ""S"": {""NP#ADJP"": 1}, ""VP"": {""VB#S"": 1}}",0.0,0.229,0.771,"{""V"": 1, ""O"": 1, "","": 1}"
Storytime: Hasan Minhaj and I trade embarrassing stories about our parents  ,76,11,1,3,12,11,0,1,1,1,,"{""NP"": {""NP#CC#NP"": 1, ""JJ#NNS"": 1, ""PRP$#NNS"": 1}, ""VP"": {""VBP#NP"": 1}, ""FRAG"": {""NP#:#S"": 1}, ""ROOT"": {""FRAG"": 1}}",0.224,0.776,0.0,"{""N"": 3, "","": 1, ""^"": 2, ""&"": 1, ""O"": 1, ""V"": 1, ""A"": 1, ""P"": 1, ""D"": 1}"
"Tonight: Hasan Minhaj, Vanessa Kirby and a performance from Sam Fender ",71,11,1,4,12,1,0,3,0,1,,"{""NP"": {""NP#,#NP#CC#NP"": 1, ""NP#:#NP"": 1}, ""ROOT"": {""NP"": 1}}",0.0,1.0,0.0,"{""N"": 2, "","": 2, ""^"": 6, ""&"": 1, ""D"": 1, ""P"": 1}"
".Queer Eye's Fab Five and I ride ""The BEAST""  ",46,9,1,6,12,1,0,1,1,1,,"{""INTJ"": {""UH"": 1}, ""ROOT"": {""INTJ"": 1}, ""NP"": {""NNP#NNP#POS"": 1, ""NP#NNP#CD"": 1, ""NP#CC#NP"": 1}, ""S"": {""``#NP"": 1}, ""VP"": {""VBP#S"": 1}}",0.0,0.7,0.3,"{"","": 3, ""A"": 2, ""N"": 2, ""$"": 1, ""&"": 1, ""O"": 1, ""V"": 1, ""D"": 1}"
Bobby Berkies?,14,2,1,0,2,1,0,2,0,0,,"{""NP"": {""NNP#NNP#."": 1}, ""ROOT"": {""NP"": 1}}",0.0,1.0,0.0,"{""^"": 2, "","": 1}"
Boat buddies forever. Haaaaaa. You guys killed it. Thank you.,61,10,1,5,2,1,0,0,1,0,,"{""NP"": {""PRP#NNS"": 1}, ""VP"": {""VBZ#ADVP"": 1, ""VBD#NP"": 1}, ""S"": {""VP#."": 1}, ""ROOT"": {""FRAG"": 1}, ""FRAG"": {""NP#."": 1}}",0.3,0.533,0.167,"{""^"": 1, ""N"": 2, ""R"": 1, "","": 4, ""!"": 1, ""O"": 3, ""V"": 2}"
High-speed boat tour on the Hudson River with Queer Eye's Fab 5 !,65,13,1,8,20,11,1,1,0,1,,"{""NP"": {""JJ#NN#NN"": 1, ""DT#NNP#NNP"": 1, ""NNP#NNP#POS"": 1, ""NP#QP"": 1, ""NP#PP#PP#."": 1}, ""QP"": {""CD#CD"": 1}, ""ROOT"": {""NP"": 1}}",0.0,0.752,0.248,"{""A"": 3, ""N"": 3, ""P"": 2, ""D"": 1, ""^"": 2, ""$"": 1, "","": 1}"
"Tonight: Dwayne Johnson, Issa Rae and Eddy Grant performs Electric Avenue! ",75,11,1,4,13,1,0,3,0,1,,"{""NP"": {""NNP#NNP#NNP#NNP#NNP"": 1, ""NP#,#NP#CC#NP"": 1, ""NP#:#NP#."": 1}, ""ROOT"": {""NP"": 1}}",0.0,0.782,0.218,"{""N"": 1, "","": 3, ""^"": 8, ""&"": 1, ""V"": 1}"
We test how well Queer Eye's Fab Five know each other ,54,11,1,8,12,1,0,1,1,1,,"{""NP"": {""NNP#NNP#POS"": 1, ""NP#NNP#NNP"": 1, ""DT#JJ"": 1}, ""WHADVP"": {""WRB#RB"": 1}, ""VP"": {""VBP#NP"": 1, ""NN#SBAR"": 1}, ""SBAR"": {""WHADVP#S"": 1}}",0.0,0.638,0.362,"{""O"": 1, ""N"": 3, ""R"": 2, ""A"": 3, ""V"": 1, ""D"": 1}"
"Tonight on the show: Kevin Bacon, Queer Eyes Fab Five and music from The Highwomen! ",84,15,1,8,13,1,0,3,0,1,,"{""NP"": {""NNP#NNP#NNP#CD"": 1, ""NP#,#NP#CC#NP"": 1, ""DT#NNP"": 1, ""NP#:#NP#PP#."": 1}, ""ROOT"": {""NP"": 1}}",0.0,0.81,0.19,"{""N"": 4, ""P"": 2, ""D"": 2, "","": 3, ""^"": 3, ""A"": 2, ""$"": 1, ""&"": 1}"
"Tonight:Rachel Brosnahan,Carla Guginoand music from$ex $ymbol! Plus,  Solo ChampionSEN Bugha!",93,10,1,1,0,1,0,4,0,2,,"{""NP"": {""NNP#NNP#NN"": 1, ""$#CD"": 1, ""NP#ADJP"": 1, ""NP#,#NP"": 1, ""NP#:#NP#."": 1, ""NNP#NNP#NNP"": 1, ""NP#,#NP#."": 1}, ""ADJP"": {""$#JJ"": 1}, ""ROOT"": {""NP"": 2}}",0.0,1.0,0.0,"{""N"": 3, "","": 5, ""^"": 7, ""P"": 1, ""V"": 1}"
"Our  jumped to #2 on the Amazon Best Seller list overnight! If you want to read with me, order here  or pick up a copy at your local bookstore!",143,29,1,22,17,1,1,0,1,1,,"{""NP"": {""PRP$"": 1, ""##CD"": 1, ""DT#NNP#NNP#NNP#NN"": 1, ""PRP$#JJ#NN"": 1}, ""VP"": {""VBD#PP#PP#ADVP"": 1, ""VB#PP"": 1, ""VBP#S"": 1, ""VB#ADVP"": 1, ""VB#PRT#NP"": 1, ""VP#CC#VP"": 1}, ""S"": {""SBAR#,#VP#."": 1}, ""SBAR"": {""IN#S"": 1}, ""PRT"": {""RP"": 1}}",0.0,0.763,0.237,"{""D"": 4, ""V"": 5, ""P"": 6, ""$"": 1, ""^"": 1, ""A"": 2, ""N"": 4, ""R"": 2, "","": 3, ""O"": 2, ""&"": 1, ""T"": 1}"
Congratulations Marina!! Clash Royale later?,44,5,1,0,18,1,0,0,1,0,,"{""NP"": {""NNP#NNP#NNP#NNP#NNP"": 1}, ""FRAG"": {""NP#ADVP#."": 1}, ""ROOT"": {""FRAG"": 1}}",0.0,0.471,0.529,"{""!"": 1, ""^"": 1, "","": 2, ""N"": 2, ""R"": 1}"
"Fun show tonight with Zachary Quinto, Betty Gilpin, and stand up from Mike Vecchione! Plus, a science demo from Kevin Delaney! ",127,21,1,10,13,1,0,2,0,1,,"{""NP"": {""RB"": 1, ""NP#,#NP#,"": 1, ""DT#NN#NN"": 1, ""NP#,#NP#."": 1}, ""VP"": {""VBP#NP#PP"": 1, ""VBP#PRT#PP"": 1, ""VP#CC#VP"": 1}, ""PRT"": {""RP"": 1}, ""ROOT"": {""NP"": 1}}",0.0,0.83,0.17,"{""A"": 1, ""N"": 4, ""P"": 3, ""^"": 8, "","": 5, ""&"": 1, ""V"": 2, ""T"": 1, ""D"": 1}"
Tonight Show Testimony  ,24,3,1,1,13,1,0,0,1,1,,"{""NP"": {""NNP#NNP#NNP"": 1}, ""ROOT"": {""NP"": 1}}",0.0,1.0,0.0,"{""N"": 3}"
"Tonight: octavia spencer, Fred Armisen and music from The Lost Boy ft. CHEEKY ANDY! ",84,14,1,7,13,1,0,3,0,1,,"{""NP"": {""NN#NN"": 1, ""DT#NNP#NNP#NNP#NNP#NNP"": 1, ""NP#,#NP#CC#NP"": 1, ""NP#:#NP#."": 1}, ""ROOT"": {""NP"": 1}}",0.166,0.834,0.0,"{""N"": 3, "","": 4, ""^"": 5, ""&"": 1, ""P"": 1, ""D"": 1, ""A"": 2, ""V"": 1}"
"Tonight: David Spade, Jeff Foxworthy & music from redhearse! ",61,9,1,3,12,1,0,3,0,1,,"{""NP"": {""NNP#NNP#,#NNP#NNP#CC#NNP"": 1, ""NP#:#NP#."": 1}, ""ROOT"": {""NP"": 1}}",0.0,1.0,0.0,"{""N"": 3, "","": 3, ""^"": 4, ""&"": 1, ""P"": 1}"
"So excited for ! 5 amazing books this year: Ask Again, Yes by Mary Beth Keane, The Chain by Adrian McKinty, The Silent Patient by Alex Michaelides, Fleishman Is in Trouble by Taffy Brodesser-Akner, and The Gone Dead by thegonedead. Vote now ",241,42,1,25,16,1,0,5,1,1,,"{""PP"": {""IN"": 1}, ""ADJP"": {""JJ#PP"": 1}, ""FRAG"": {""RB#ADJP#."": 1}, ""ROOT"": {""FRAG"": 1, ""NP"": 1}, ""NP"": {""CD#JJ#NNS"": 1, ""NP#NP"": 1, ""NNP#NNP#NNP"": 1, ""DT#NNP"": 1, ""DT#NNP#NNP"": 1, ""NNP#NNPS"": 1, ""DT#VBN#NNP"": 1, ""NP#,#NP#,#NP#,#NP#,#CC#NP"": 1, ""VP#PP"": 1, ""NP#:#NP#."": 1}, ""VP"": {""VB#ADVP#,#ADVP#PP"": 1, ""VB#ADVP"": 1}}",0.135,0.676,0.188,"{""R"": 3, ""A"": 4, ""P"": 7, "","": 8, ""$"": 1, ""N"": 5, ""D"": 4, ""V"": 4, ""!"": 1, ""^"": 11, ""&"": 1}"
Mad Lib Theater with Kenan Thompson and JOE MANGANIELLO!  ,58,9,1,5,13,1,0,2,1,1,,"{""NP"": {""NNP#NNP#NNP"": 1, ""NP#CC#NP"": 1, ""NP#PP#."": 1}, ""ROOT"": {""NP"": 1}}",0.304,0.696,0.0,"{""A"": 1, ""^"": 6, ""P"": 1, ""&"": 1, "","": 1}"
"Tonight: Kenan Thompson, JOE MANGANIELLO and a performance from Robyn! ",71,10,1,4,22,11,0,3,0,1,,"{""NP"": {""NP#,#NP#CC#NP"": 1, ""NP#:#NP#."": 1}, ""ROOT"": {""NP"": 1}}",0.0,1.0,0.0,"{""N"": 2, "","": 3, ""^"": 5, ""&"": 1, ""D"": 1, ""P"": 1}"
"Tried to impress my wife by walking out of the ocean like Daniel Craig/James Bond. Got knocked over by a wave: riptide, pants down, bloody knee, hair looked like a bad toupee, and a little kid on the beach saw me and started crying. ",233,44,1,24,15,3,0,0,0,1,,"{""NP"": {""NNP#NNPS#NNP"": 1, ""NP#,#ADVP"": 1, ""NP#:#NP"": 1, ""JJ#NN#,#NN"": 1, ""DT#JJ#NN"": 2}, ""PRT"": {""RP"": 2}, ""PP"": {""IN#S"": 1}, ""VP"": {""VBG#PRT#PP"": 1, ""VB#NP#PP"": 1, ""VBN#S"": 1, ""VBD#PRT#PP"": 1, ""VBD#PP"": 1, ""VBD#NP"": 1, ""VBG"": 1, ""VBD#S"": 1, ""VP#CC#VP"": 1}, ""S"": {""VP#."": 1, ""S#PRN#CC#S#."": 1}, ""ADVP"": {""NP#RB"": 1}, ""PRN"": {"",#NP#VP#,"": 1}}",0.181,0.668,0.151,"{""V"": 9, ""P"": 9, ""D"": 6, ""N"": 10, ""^"": 3, "","": 7, ""R"": 1, ""A"": 3, ""&"": 2, ""O"": 1}"
Its Hashtags time! Tag a tweet with  and then tell us about a funny or weird thing that happened to you at the beach. Could be on the show!,139,29,1,18,15,3,0,0,0,1,,"{""NP"": {""PRP$#NN#NN"": 1, ""DT#ADJP#NN"": 1, ""NP#SBAR"": 1}, ""FRAG"": {""NP#."": 1}, ""ROOT"": {""FRAG"": 1}, ""PP"": {""IN"": 1}, ""VP"": {""VB#NP#PP"": 1, ""VBD#PP#PP"": 1, ""ADVP#VB#NP#PP"": 1, ""VP#CC#VP"": 1, ""VB#PP"": 1, ""MD#VP"": 1}, ""ADJP"": {""JJ#CC#JJ"": 1}, ""WHNP"": {""WDT"": 1}, ""S"": {""VP#."": 2}, ""SBAR"": {""WHNP#S"": 1}}",0.056,0.828,0.115,"{""L"": 1, ""N"": 6, "","": 3, ""V"": 5, ""D"": 4, ""P"": 6, ""&"": 2, ""R"": 1, ""O"": 2, ""A"": 2}"
"Winnie: ""Can I play that game where the emoji is being chased by a ghost?""Me, realizing she means PAC-MAN:",106,20,2,11,14,3,1,0,0,1,,"{""NP"": {""DT#NNS"": 1}, ""WHADVP"": {""WRB"": 1}, ""VP"": {""VBD#PP"": 1, ""VBG#VP"": 1, ""VBZ#VP"": 1, ""VB#NP#SBAR"": 1, ""VBD#:#``#SQ"": 1, ""VBZ#NP"": 1}, ""S"": {""``#NP#,#ADVP#NP#VP#:"": 1}, ""SBAR"": {""WHADVP#S"": 1}, ""SQ"": {""MD#NP#VP#."": 1}, ""FRAG"": {""VP"": 1}, ""ROOT"": {""FRAG"": 1}}",0.0,0.87,0.13,"{""^"": 2, "","": 6, ""V"": 7, ""O"": 3, ""D"": 3, ""N"": 3, ""R"": 1, ""P"": 1}"
"Tonight on the show: Joel McHale, marc maron, Blake Griffin, and stand up from Dusty Slay! ",91,16,1,7,13,1,0,4,0,1,,"{""NP"": {""JJ#NN"": 1, ""NP#ADVP"": 1, ""NP#,#NP#,#NP#,#CC#NP"": 1, ""NP#:#NP#."": 1}, ""ADVP"": {""RB#PP"": 1}, ""ROOT"": {""NP"": 1}}",0.0,1.0,0.0,"{""N"": 2, ""P"": 2, ""D"": 1, "","": 5, ""^"": 7, ""&"": 1, ""V"": 2, ""T"": 1}"
All the details on The Big Day out now's debut record!   ,57,11,1,7,12,1,0,1,1,2,,"{""NP"": {""PDT#DT#NNS"": 1, ""DT#NNP#NNP"": 1, ""NN#NN"": 1}, ""VP"": {""VBZ#NP"": 1}, ""S"": {""NP#ADVP#ADVP#VP#."": 1}}",0.0,1.0,0.0,"{""X"": 1, ""D"": 2, ""N"": 4, ""P"": 2, ""A"": 1, ""L"": 1, "","": 1}"
"The Big Day out nowr,The Big Day out nowlligator! #ChancetheSnapper #FallonTonight",82,11,1,7,20,1,0,2,0,2,,"{""NP"": {""DT#NNP#NNP#NN#NN"": 1, ""DT#NNP#NNP"": 1, ""NP#,#NP#."": 1, ""NN#NN"": 1}, ""ROOT"": {""NP"": 2}}",0.0,1.0,0.0,"{""D"": 2, ""A"": 2, ""N"": 4, ""P"": 2, "","": 2, ""#"": 2}"
"TONIGHT: The Big Day out now is here, talk with David Crosby & Cameron Crowe, and David Crosby performs with The Roots! Plus, Jennifer Lopez shows a sneak peek of ! ",165,31,1,16,14,1,0,6,0,2,,"{""NP"": {""DT#NNP#NNP"": 1, ""NNP#NNP#CC#NNP#NNP"": 1, ""DT#NNPS"": 1, ""DT#JJ#NN"": 1}, ""ADVP"": {""RB#RB"": 1}, ""PP"": {""IN"": 1}, ""VP"": {""VB#PP"": 1, ""VBZ#S"": 1, ""VBZ#PP"": 1, ""VBZ#NP"": 1}, ""S"": {""ADVP#,#VP"": 1, ""NP#ADVP#VP"": 1, ""S#,#CC#S"": 1, ""CC#,#NP#VP#."": 1}, ""FRAG"": {""NP#:#S#."": 1}, ""ROOT"": {""FRAG"": 1}}",0.0,1.0,0.0,"{""N"": 5, "","": 6, ""D"": 3, ""A"": 1, ""P"": 4, ""R"": 2, ""V"": 5, ""^"": 8, ""&"": 2}"
NeverEnding Story Duet with Stephen Colbert   ,46,6,1,2,12,1,0,1,1,2,,"{""VP"": {""VBG#NP"": 1}}",0.0,1.0,0.0,"{""^"": 4, ""N"": 1, ""P"": 1}"
In case you didnt recognize one of the backup dancers from Jennifer Lopezs  tonight,83,14,1,7,2,1,1,1,0,1,,"{""NP"": {""CD"": 1, ""DT#JJ#NNS"": 1, ""NNP#NNPS"": 1}, ""VP"": {""VB#NP#NP"": 1, ""VBP#VP"": 1}, ""S"": {""PP#NP#VP"": 1}}",0.0,1.0,0.0,"{""P"": 3, ""N"": 3, ""O"": 1, ""V"": 2, ""$"": 1, ""D"": 1, ""^"": 2, ""R"": 1}"
I am at  at !! Jennifer Lopez,29,7,1,5,1,1,1,1,0,2,,"{""NP"": {""NNP#NNP#NNP"": 1}, ""PP"": {""IN#PP"": 1}, ""VP"": {""VBP#PP"": 1}}",0.0,1.0,0.0,"{""O"": 1, ""V"": 1, ""P"": 2, "","": 1, ""^"": 2}"
"Back with all-new shows this week! Tonight: Jesse Eisenberg, Fran Lebowitz, and a performance from ZXLTRXN! ",108,16,1,7,12,3,0,1,0,1,,"{""NP"": {""JJ#NNS"": 1, ""NP#:#NP#,#NP#,#CC#NP#."": 1}, ""PP"": {""IN#NP#NP"": 1}, ""ADVP"": {""RB#PP"": 1}, ""FRAG"": {""ADVP#."": 1}, ""ROOT"": {""FRAG"": 1, ""NP"": 1}}",0.0,1.0,0.0,"{""R"": 1, ""P"": 2, ""A"": 1, ""V"": 1, ""D"": 2, ""N"": 3, "","": 5, ""^"": 5, ""&"": 1}"
There are so many good songs this summer!! Check out the  playlist! I add to it every Friday! ,94,18,1,11,17,1,0,0,1,1,,"{""NP"": {""EX"": 1, ""ADJP#JJ#NNS"": 1, ""VB"": 1, ""NP#NP#S"": 1, ""DT#NNP"": 1}, ""ADJP"": {""RB#JJ"": 1}, ""VP"": {""VBG#NP#PP"": 1, ""VBP#NP"": 1, ""VBP#PP#NP"": 1}}",0.0,0.786,0.214,"{""X"": 1, ""V"": 3, ""R"": 1, ""A"": 2, ""N"": 3, ""D"": 3, "","": 3, ""T"": 1, ""O"": 2, ""P"": 1, ""^"": 1}"
Haaaaaa.,8,1,1,0,1,1,0,0,1,0,,"{""FRAG"": {""NP#."": 1}, ""ROOT"": {""FRAG"": 1}}",0.0,1.0,0.0,"{""!"": 1, "","": 1}"
,0,0,0,0,22,1,1,0,0,0,,{},0.0,0.0,0.0,{}
,0,0,0,0,22,1,1,0,0,0,,{},0.0,0.0,0.0,{}
Taking blurry tennis photos since 2005.  ,41,6,1,0,22,1,1,0,0,1,🎾:1,"{""NP"": {""JJ#NN#NNS"": 1, ""CD"": 1}, ""VP"": {""VBG#NP#PP"": 1}, ""S"": {""VP#."": 1}}",0.219,0.781,0.0,"{""V"": 1, ""A"": 1, ""N"": 2, ""P"": 1, ""$"": 1, "","": 1}"
LIVE. You get one chance and you nailed it! Thank you my pal. ,62,13,1,9,5,1,0,0,1,0,,"{""VP"": {""VB"": 1, ""VBP#NP"": 1, ""VBN#NP"": 1, ""VB#S"": 1}, ""S"": {""VP#."": 2, ""S#CC#S#."": 1, ""NP#NP"": 1}, ""NP"": {""CD#NN"": 1}}",0.0,0.697,0.303,"{""A"": 1, "","": 3, ""O"": 4, ""V"": 3, ""$"": 1, ""N"": 2, ""&"": 1, ""D"": 1}"
Love you guys!! Thanks. ,24,4,1,2,5,1,0,0,0,1,,"{""NP"": {""CD#NNS"": 1}, ""VP"": {""VBD#NP"": 1}, ""S"": {""ADVP#NP#VP#."": 1}}",0.0,0.207,0.793,"{""V"": 1, ""O"": 1, ""N"": 2, "","": 2}"
.MEGATRON and Phoebe Robinson!! Another song made up on the spot with The Roots from your tweets!  ,99,17,1,11,4,1,0,3,1,1,,"{""INTJ"": {""UH"": 1}, ""ROOT"": {""INTJ"": 1}, ""NP"": {""NP#CC#NP"": 1, ""DT#NNPS"": 1, ""PRP$#NNS"": 1}, ""PRT"": {""RP"": 1}, ""VP"": {""VBD#PRT#PP#PP"": 1, ""VBD#SBAR"": 1}, ""SBAR"": {""S"": 1}}",0.0,1.0,0.0,"{"","": 3, ""^"": 3, ""&"": 1, ""D"": 4, ""N"": 4, ""V"": 1, ""T"": 1, ""P"": 3}"
First Break - Making up a song on the spot with The Roots from your tweets!! More with Mrs. Petty on NBC Entertainment NEXT!! Are you watching?!   ,147,27,1,18,3,1,0,3,1,1,,"{""NP"": {""DT#NNPS"": 1, ""PRP$#NNS"": 1, ""CD"": 1, ""NNP#NNP#NNP#NNP"": 1, ""NP#VP#VP"": 1, ""NP#:#S"": 1}, ""PRT"": {""RP"": 1}, ""PP"": {""ADVP#IN#NP"": 1}, ""ADVP"": {""NP#RBR"": 1}, ""VP"": {""PP#VBP#NP"": 1, ""VBG#NP"": 1, ""VBG#PRT#NP#PP"": 1}, ""ROOT"": {""NP"": 1}}",0.071,0.792,0.137,"{""A"": 3, ""N"": 5, "","": 4, ""V"": 3, ""T"": 1, ""D"": 4, ""P"": 5, ""^"": 4, ""O"": 1}"
"We've got another LIVE show tonight! Mrs. Petty is here and we have dinner together at Red Lobster! Plus, Phoebe Robinson and a performance from Julia Michaels! Dont miss it! ",175,30,1,17,0,3,0,3,0,1,,"{""NP"": {""DT#JJ#NN#NN"": 1, ""NNP#NNPS"": 1, ""NP#CC#NP"": 1, ""NP#,#NP#."": 1}, ""VP"": {""VBN#NP"": 1, ""VBP#VP"": 2, ""VBZ#ADVP"": 1, ""VBN#ADVP#PP"": 1, ""VBP#NP"": 1}, ""S"": {""S#CC#S#."": 1}, ""ROOT"": {""NP"": 1}}",0.094,0.86,0.046,"{""L"": 1, ""V"": 6, ""D"": 2, ""A"": 2, ""N"": 5, "","": 5, ""^"": 6, ""R"": 2, ""&"": 2, ""O"": 2, ""P"": 2}"
TONIGHT! Red Lobster Redemption with MEGATRON! ,47,6,1,2,23,2,1,1,0,1,,"{""VP"": {""VB"": 1}, ""S"": {""VP#."": 1}, ""ROOT"": {""NP"": 1}, ""NP"": {""NNP#NNP#NNP"": 1, ""NP#PP#."": 1}}",0.0,1.0,0.0,"{""R"": 1, "","": 2, ""A"": 1, ""N"": 2, ""P"": 1, ""^"": 1}"
Nice T!! I got a new cool one coming out in a few weeks that youll dig. Think... Eddie.,87,19,1,14,16,1,0,0,1,0,,"{""NP"": {""DT#JJ#JJ#NN"": 1, ""DT#JJ#NNS"": 1, ""NP#VP"": 1, ""NP#:#NP#."": 1}, ""PRT"": {""RP"": 1}, ""VP"": {""VB"": 1, ""VBG#PRT#PP#SBAR"": 1, ""VBD#NP"": 1, ""VBD#SBAR"": 1}, ""SBAR"": {""IN#S"": 1, ""S"": 1}, ""ROOT"": {""NP"": 1}}",0.0,0.711,0.289,"{""A"": 4, ""N"": 2, "","": 4, ""O"": 1, ""V"": 4, ""D"": 2, ""$"": 1, ""T"": 1, ""P"": 2, ""L"": 1, ""^"": 1}"
Ive been doing this! And I love it! ,36,8,1,6,15,1,0,0,1,1,,"{""NP"": {""DT"": 1}, ""VP"": {""VBG#NP"": 1, ""VBN#VP"": 1, ""VB#VP"": 1, ""VBP#NP"": 1}, ""S"": {""VP#."": 1, ""CC#NP#VP#."": 1}}",0.0,0.556,0.444,"{""L"": 1, ""V"": 3, ""O"": 3, "","": 2, ""&"": 1}"
"Were gearing up for a LIVE show tonight with Daisy Ridley, Colin Quinn, and a performance from Little Big Town! Plus, the cast of Stranger Things and I surprise unsuspecting fans at  in Times Square. Dont miss it! ",214,38,1,22,20,1,1,3,0,2,,"{""PRT"": {""RP"": 1}, ""NP"": {""DT#NNP#NN"": 1, ""NP#,#NP#,#CC#NP"": 1, ""NNP#NNP#NNP"": 1, ""NNP#NNS"": 1, ""JJ#NNS"": 1, ""NP#CC#S"": 1, ""NP#,#NP#."": 1}, ""PP"": {""IN#PP"": 1}, ""VP"": {""VBG#PRT#PP#NP#PP#PP"": 1, ""VBD#VP"": 1, ""VB#NP#PP"": 1, ""VBP#NP"": 1}, ""S"": {""VP#."": 1}, ""ROOT"": {""NP"": 1}}",0.0,0.889,0.111,"{""V"": 6, ""T"": 1, ""P"": 6, ""D"": 3, ""A"": 4, ""N"": 8, ""^"": 6, "","": 6, ""&"": 2, ""O"": 2}"
"Tonight: Trevor Noah, Sebastian Maniscalco and magic from Penn Jillette & Teller! ",82,12,1,4,0,1,0,4,0,1,,"{""NP"": {""NNP#NNP#CC#NNP"": 1, ""NP#,#NP#CC#NP"": 1, ""NP#:#NP#."": 1}, ""ROOT"": {""NP"": 1}}",0.0,1.0,0.0,"{""N"": 1, "","": 3, ""^"": 7, ""&"": 2, ""A"": 1, ""P"": 1}"
They have the insanely hard job of making my face look good every night - so YOU are a walk in the park! But I will pass along the props. Thanks.,145,31,1,23,21,1,0,0,1,0,,"{""NP"": {""DT#ADJP#NN"": 1, ""PRP$#NN#NN"": 1, ""JJ#DT#NN"": 1, ""DT#NNS"": 1, ""NNS#."": 1}, ""ADJP"": {""RB#JJ"": 1}, ""VP"": {""VBG#NP#NP"": 1, ""VBP#NP"": 2, ""VB#PRT#NP"": 1, ""MD#VP"": 1}, ""S"": {""IN#NP#VP"": 1, ""S#:#S#."": 1, ""CC#NP#VP#."": 1}, ""PP"": {""IN#S"": 1}, ""ROOT"": {""NP"": 1}, ""PRT"": {""RP"": 1}}",0.037,0.774,0.189,"{""O"": 3, ""V"": 6, ""D"": 6, ""R"": 1, ""A"": 2, ""N"": 7, ""P"": 4, "","": 4, ""&"": 1}"
And were LIVE!!!,16,3,1,2,18,1,0,0,1,0,,"{""VP"": {""VBD#NP"": 1}, ""FRAG"": {""CC#S"": 1}, ""ROOT"": {""FRAG"": 1}}",0.0,1.0,0.0,"{""&"": 1, ""V"": 1, ""A"": 1, "","": 1}"
Haaaaaaaaaa!!! Good sport. Always great to see you my friend.,61,10,1,5,14,1,0,0,1,0,,"{""NP"": {""JJ#NN"": 1}, ""VP"": {""VBZ#NP"": 1, ""VB#S"": 1}, ""S"": {""NP#NP"": 1}, ""ROOT"": {""FRAG"": 1}, ""ADJP"": {""ADVP#JJ"": 1}, ""FRAG"": {""ADJP#S#."": 1}}",0.0,0.387,0.613,"{""!"": 1, "","": 3, ""A"": 2, ""N"": 2, ""R"": 1, ""P"": 1, ""V"": 1, ""O"": 1, ""D"": 1}"
Can You Feel It? with christine teigen! ,40,7,1,5,12,1,0,1,1,0,,"{""NP"": {""JJ#NN"": 1}, ""SQ"": {""MD#NP#VP#."": 1}, ""ROOT"": {""SQ"": 1, ""FRAG"": 1}, ""FRAG"": {""PP#."": 1}}",0.0,1.0,0.0,"{""V"": 2, ""O"": 2, "","": 2, ""P"": 1, ""^"": 2}"
"Started Late Night with a small group of writers. So happy tonight to have Bashir Salahuddin and Diallo Riddle Riddle on the couch as guests. Build a rocket, boys!  ",165,29,1,12,3,3,1,1,0,1,,"{""NP"": {""NNP#NNP#NNP"": 2, ""DT#JJ#NN"": 1, ""NP#PP#PP#."": 1, ""RB"": 1, ""NP#CC#NP"": 1, ""NP#,#NP"": 1, ""NP#NP#."": 1}, ""ROOT"": {""NP"": 2}, ""VP"": {""VB#NP#PP"": 1, ""VB#NP#S"": 1}, ""S"": {""RB#VP#."": 1}}",0.0,0.838,0.162,"{""V"": 3, ""A"": 3, ""N"": 8, ""P"": 5, ""D"": 3, "","": 4, ""R"": 1, ""^"": 5, ""&"": 1}"
".christine teigen ask Kim Kardashian West how much fun it is to play our game Can You Feel it? Right, Kim? Kim? Kim?",116,23,1,19,18,3,0,2,0,0,,"{""INTJ"": {""UH"": 1}, ""ROOT"": {""INTJ"": 1, ""NP"": 1, ""FRAG"": 2}, ""NP"": {""JJ#NN"": 1, ""NNP#NNP#NNP"": 1, ""NP#SBAR"": 1, ""NP#,#NP#."": 1}, ""WHADJP"": {""WRB#JJ"": 1}, ""WHNP"": {""WHADJP#NNS"": 1}, ""VP"": {""VBZ#S"": 1, ""MD#ADVP#VP"": 1, ""VBP#SBAR"": 1}, ""SBAR"": {""WHNP#S"": 1, ""S"": 1}, ""ADVP"": {""PRP"": 1}, ""FRAG"": {""NP#."": 2}}",0.0,0.759,0.241,"{"","": 6, ""^"": 8, ""V"": 5, ""R"": 2, ""A"": 1, ""N"": 2, ""O"": 3, ""P"": 1, ""D"": 1}"
This is all great. And hilarious. Lets make more people happy! Guy Raz - look what you did!????!??,98,18,1,13,15,1,0,1,1,0,,"{""NP"": {""DT"": 1, ""JJR#NNS"": 1, ""NP#SBAR"": 1, ""NP#:#NP"": 1}, ""ADJP"": {""JJ"": 2}, ""VP"": {""VBZ#RB#ADJP"": 1, ""VB"": 1, ""VBP#S"": 1, ""VBD#NP"": 1}, ""S"": {""CC#VP#."": 1, ""NP#ADJP"": 1}, ""ROOT"": {""NP"": 1}, ""WHNP"": {""WP"": 1}, ""SBAR"": {""WHNP#S"": 1}}",0.0,0.526,0.474,"{""O"": 3, ""V"": 4, ""D"": 1, ""A"": 4, "","": 5, ""&"": 1, ""L"": 1, ""N"": 1, ""^"": 2}"
vEYEtamins.  Vitamins added to eye drops. For people that cant or dont like swallowing pills.,93,15,1,8,14,1,0,0,1,0,,"{""NP"": {""NNS#."": 1, ""NN#NNS"": 1, ""DT#NN#CC#NN"": 1}, ""ROOT"": {""NP"": 1}, ""VP"": {""VBD#PP"": 1, ""VBG#NP"": 1, ""VBP#S"": 1}, ""S"": {""PP#NP#VP#."": 1}}",0.0,0.885,0.115,"{""^"": 1, "","": 3, ""N"": 5, ""V"": 5, ""P"": 3, ""&"": 1}"
"Hey, Johnson & Johnson Innovation and Kellogg's - lets set up a meeting.",72,13,1,8,13,1,0,2,1,0,,"{""INTJ"": {""UH"": 1}, ""NP"": {""NNP#CC#NNP#NNP"": 1, ""NNP#POS"": 1, ""NP#CC#NP"": 1}, ""PRT"": {""RP"": 1}, ""VP"": {""VB#PRT#NP"": 1, ""VBZ#VP"": 1}, ""S"": {""INTJ#,#NP#:#VP#."": 1}}",0.0,0.776,0.224,"{""!"": 1, "","": 3, ""^"": 3, ""&"": 2, ""N"": 2, ""L"": 1, ""V"": 1, ""T"": 1, ""D"": 1}"
cath fallonnt me to?,20,4,1,3,4,1,0,2,0,0,,"{""VP"": {""TO"": 1, ""VBP#S"": 1}}",0.0,1.0,0.0,"{""^"": 1, ""V"": 1, ""O"": 1, ""P"": 1, "","": 1}"
