Always good to catch up with nick grimshaw and Rita Ora ! Who tuned in?,71,15,1,11,9,1,1,2,0,0,,"{""NP"": {""NN#NN"": 1, ""NP#CC#NP"": 1}, ""PRT"": {""RP"": 2}, ""VP"": {""VB#PRT#PP"": 1, ""VBD#PRT"": 1}, ""ADJP"": {""JJ#S#."": 1}, ""FRAG"": {""NP#ADJP"": 1}, ""ROOT"": {""FRAG"": 1, ""SBARQ"": 1}, ""WHNP"": {""WP"": 1}, ""SQ"": {""VP"": 1}, ""SBARQ"": {""WHNP#SQ#."": 1}}",0.0,0.803,0.197,"{""R"": 1, ""A"": 1, ""P"": 3, ""V"": 2, ""T"": 1, ""^"": 4, ""&"": 1, "","": 2, ""O"": 1}"
I'm on R1 Breakfast with Nick Grimshaw 2012-2018 with Rita Ora  tomorrow! You ready for us nick grimshaw?,105,18,1,12,19,1,1,3,0,0,,"{""NP"": {""NNP#NNP#NNP"": 1, ""NP#PP#NP"": 1}, ""VP"": {""VBP#PP"": 1, ""VBP#NP"": 1}, ""ROOT"": {""FRAG"": 1}, ""ADJP"": {""NP#JJ"": 1}, ""SBAR"": {""IN#S"": 1}, ""FRAG"": {""ADJP#SBAR#."": 1}}",0.0,0.859,0.141,"{""L"": 1, ""P"": 4, ""^"": 7, ""N"": 2, ""$"": 1, "","": 2, ""O"": 2, ""A"": 1}"
Give  a listen on Spotify and let me know what you think! ,58,12,1,9,19,21,1,1,1,1,,"{""VP"": {""VB#NP#PP"": 1, ""VBP"": 1, ""VB#SBAR"": 1, ""VB#S"": 1, ""VP#CC#VP"": 1}, ""WHNP"": {""WP"": 1}, ""S"": {""VP#."": 1}, ""SBAR"": {""WHNP#S"": 1}}",0.0,1.0,0.0,"{""V"": 5, ""D"": 1, ""P"": 1, ""^"": 1, ""&"": 1, ""O"": 3, "","": 1}"
Thank you so much for the nomination iHeartRadio  its been an incredible year! ,79,13,1,8,16,1,0,1,1,0,"🙌:1,🏼:1","{""NP"": {""DT#NN#NN"": 1, ""PRP$"": 1, ""NP#NP"": 1, ""DT#JJ#NN"": 1, ""NP#VP"": 1}, ""VP"": {""VBN#NP"": 1, ""VB#S"": 1}, ""ADJP"": {""RB#JJ#PP"": 1}, ""S"": {""NP#ADJP"": 1, ""VP#."": 1}}",0.0,0.811,0.189,"{""V"": 2, ""O"": 1, ""R"": 2, ""P"": 1, ""D"": 2, ""N"": 2, ""^"": 1, ""L"": 1, ""A"": 1, "","": 1}"
1 billion global streams for   A ridiculous number!! Thank you to everyone that has supported this track ,105,17,1,8,15,3,1,0,0,1,"🎉:1,🙌:1,🏼:2,🙏:1","{""QP"": {""CD#CD"": 1}, ""NP"": {""QP#JJ#NNS"": 1, ""DT#JJ#NN"": 1, ""NP#SBAR"": 1}, ""WHNP"": {""WDT"": 1}, ""VP"": {""VBN#NP"": 1, ""VBZ#VP"": 2, ""VB#NP#PP"": 1}, ""SBAR"": {""WHNP#S"": 1}}",0.124,0.545,0.331,"{""$"": 2, ""A"": 2, ""N"": 4, ""P"": 3, ""D"": 2, "","": 1, ""V"": 3, ""O"": 1}"
Thank you from Rita Ora  and I  ,32,7,1,6,19,3,1,1,0,1,"👋:1,🏼:1","{""NP"": {""NP#CC#NP"": 1}, ""VP"": {""VB#NP#PP"": 1}}",0.0,0.667,0.333,"{""V"": 1, ""O"": 2, ""P"": 1, ""^"": 2, ""&"": 1}"
  Rita Ora  Tinie Tempah Idris Elba,35,6,1,3,15,1,1,3,0,1,,"{""NP"": {""NNP#NNP#NNP#NNP#NNP#NNP"": 1}, ""ROOT"": {""NP"": 1}}",0.0,1.0,0.0,"{""^"": 6}"
Here's the full track list for the  Soundtrack! It's out Feb 9th and you can pre-order it this Friday 12th Jan ,111,21,1,16,17,21,1,0,0,1,💥:1,"{""NP"": {""RB"": 1, ""DT#JJ#NN#NN"": 1, ""DT#NNP"": 1, ""DT#NNP#NNP#NNP"": 1, ""NP#CC#S"": 1}, ""VP"": {""VBZ#NP"": 1, ""VB#S"": 1, ""MD#VP"": 1, ""VBZ#PP"": 1}, ""S"": {""NP#NP"": 1}}",0.0,1.0,0.0,"{""L"": 2, ""D"": 3, ""A"": 2, ""N"": 3, ""P"": 2, "","": 1, ""^"": 3, ""&"": 1, ""O"": 2, ""V"": 2, ""$"": 1}"
Who wants to win tickets to see me perform at the the BRIT Awards nominations show this Saturday in London?? Enter here ,120,22,1,14,12,1,1,1,1,0,,"{""WHNP"": {""WP"": 1}, ""NP"": {""DT#DT#JJ#NNS"": 1, ""DT#NNP"": 1, ""NP#SBAR"": 1}, ""VP"": {""VB#ADVP"": 1, ""VBP#S"": 1, ""VB#PP"": 1, ""VB#S"": 2, ""VBZ#S"": 1}, ""SBAR"": {""S"": 1}, ""SQ"": {""VP"": 1}, ""SBARQ"": {""WHNP#SQ"": 1}, ""ROOT"": {""SBARQ"": 1}}",0.0,0.736,0.264,"{""O"": 2, ""V"": 6, ""P"": 4, ""N"": 2, ""D"": 3, ""^"": 4, "","": 1, ""R"": 1}"
I've got my own profile up on GIPHY!   ,39,8,1,6,16,21,1,1,1,0,🏼:1,"{""NP"": {""PRP$#JJ#NN"": 1}, ""PRT"": {""RP"": 1}, ""VP"": {""VBN#NP#PRT#PP"": 1, ""VBP#VP"": 1}}",0.0,1.0,0.0,"{""L"": 1, ""V"": 1, ""D"": 1, ""A"": 1, ""N"": 1, ""T"": 1, ""P"": 1, ""^"": 1, "","": 1}"
Hitting those high notes!   ,28,4,1,1,17,21,1,0,0,2,,"{""NP"": {""DT#JJ#NNS"": 1}, ""VP"": {""VBG#NP"": 1}, ""S"": {""VP#."": 1}}",0.0,1.0,0.0,"{""V"": 1, ""D"": 1, ""A"": 1, ""N"": 1, "","": 1}"
,0,0,0,0,16,1,0,0,1,0,"🙌:3,🏼:3",{},0.0,0.0,0.0,{}
"My 10,000th tweet ",18,3,1,1,15,1,1,0,0,1,,"{""NP"": {""PRP$#CD#NN"": 1}, ""VP"": {""VBP"": 1}}",0.0,1.0,0.0,"{""D"": 1, ""$"": 1, ""N"": 1, ""V"": 1}"
liveforpiano,12,1,1,0,9,1,0,2,0,0,"👏:1,🏼:1","{""ROOT"": {""NP"": 1}}",0.0,1.0,0.0,"{""!"": 1}"
"Mine and Rita Ora 's song , taken from the  soundtrack, is out now!  ",69,14,1,12,8,3,1,1,1,2,💥:1,"{""NP"": {""NNP#CC#NNP#NNP#POS"": 1, ""NP#NN"": 1, ""NP#,#VP#,"": 1}, ""VP"": {""VBN#PP"": 1, ""VBZ#ADVP#ADVP"": 1}}",0.0,1.0,0.0,"{""O"": 1, ""&"": 1, ""^"": 2, "","": 4, ""G"": 1, ""N"": 2, ""V"": 2, ""P"": 1, ""D"": 1, ""R"": 2}"
Is it midnight where you are? Mine and Rita Ora s new song  from the  Official Motion Picture Soundtrack is out now ,116,22,1,16,0,21,1,1,1,2,,"{""NP"": {""NP#SBAR"": 1, ""NNP#CC#NNP#NNP"": 1, ""JJ#NN"": 1, ""DT#NNP#NNP#NNP#NNP"": 1, ""NP#PP#SBAR"": 1}, ""WHADVP"": {""WRB"": 1}, ""VP"": {""VBP"": 1, ""VBZ#ADVP#ADVP"": 1, ""VBZ#NP"": 1}, ""SBAR"": {""WHADVP#S"": 1, ""S"": 1}, ""SQ"": {""VBZ#NP#NP#."": 1}, ""ROOT"": {""SQ"": 1}}",0.0,1.0,0.0,"{""V"": 3, ""O"": 3, ""N"": 5, ""R"": 2, "","": 1, ""&"": 1, ""^"": 2, ""G"": 1, ""A"": 2, ""P"": 2, ""D"": 1}"
,0,0,0,0,23,1,0,2,0,0,😎:1,{},0.0,0.0,0.0,{}
We did this ! Had so much fun in the studio with Rita Ora . Our new single from the  soundtrack drops this Friday January 5.,124,26,1,20,20,3,1,1,0,2,,"{""NP"": {""DT"": 1, ""ADJP#NN"": 1, ""PRP$#JJ#JJ"": 1, ""DT#NNP"": 1, ""NNP#CD"": 1}, ""VP"": {""VBD#NP"": 1, ""VBD#NP#PP"": 1, ""VBZ#NP#NP"": 1}, ""S"": {""VP#."": 1}, ""ADJP"": {""RB#JJ"": 1}}",0.0,0.856,0.144,"{""O"": 2, ""V"": 3, "","": 3, ""R"": 1, ""A"": 3, ""N"": 3, ""P"": 3, ""D"": 4, ""^"": 4, ""$"": 1}"
Last and final memory of this year is going up and accepting the Brit award on behalf of my band knowing weve still got it!  Happy new year everybody!,150,29,1,19,16,1,1,0,0,0,"🙌:1,🏼:1","{""NP"": {""JJ#CC#JJ#NN"": 1, ""DT#NNP#NN"": 1, ""JJ#JJ#NN"": 1}, ""PP"": {""IN#S"": 1}, ""PRT"": {""RP"": 1}, ""VP"": {""VBG#PRT"": 1, ""VBD#NP"": 1, ""VBG#SBAR"": 1, ""VBG#NP#PP"": 1, ""VP#CC#VP"": 1, ""VBZ#VP"": 1}, ""S"": {""NP#ADVP#VP"": 1}, ""SBAR"": {""S"": 1}, ""ROOT"": {""FRAG"": 1}, ""FRAG"": {""NP#NP#."": 1}}",0.0,0.715,0.285,"{""A"": 4, ""&"": 2, ""N"": 7, ""P"": 3, ""D"": 3, ""V"": 5, ""T"": 1, ""^"": 1, ""L"": 1, ""R"": 1, ""O"": 1, "","": 2}"
"I've got to perform to some amazing crowds this year, starting with 80,000 people at Wembley Stadium! Each venue was different but the crowds brought it and helped me give the best performances I could!",202,35,1,19,16,17,1,0,0,0,,"{""NP"": {""DT#JJ#NNS"": 1, ""CD#NNS"": 1, ""DT#NNS"": 1, ""DT#JJS#NNS"": 1, ""NP#SBAR"": 1}, ""PP"": {""VBG#PP"": 1}, ""VP"": {""VB#PP#NP"": 1, ""VBN#S#,#PP"": 1, ""VBP#VP"": 1, ""VBD#ADJP"": 1, ""VBD#NP"": 1, ""MD"": 1, ""VBD#S"": 1, ""VP#CC#VP"": 1}, ""S"": {""S#CC#S#."": 1}, ""ADJP"": {""JJ"": 1}, ""SBAR"": {""S"": 1}}",0.0,0.785,0.215,"{""L"": 1, ""V"": 8, ""P"": 4, ""D"": 5, ""A"": 3, ""N"": 6, "","": 3, ""$"": 1, ""^"": 2, ""&"": 2, ""O"": 3}"
"I released one of my favourite songs from my album,  in October! I got to work with one of my good friends, Mr Charlie Puth!",124,25,1,17,16,17,1,1,0,1,,"{""NP"": {""CD"": 2, ""PRP$#JJ#NNS"": 2, ""NNP#NNP#NNP"": 1, ""NP#,#NP"": 1}, ""VP"": {""VBD#NP#PP#,#PP"": 1, ""VB#PP"": 1, ""VBD#S"": 1}}",0.0,0.761,0.239,"{""O"": 2, ""V"": 3, ""$"": 2, ""P"": 6, ""D"": 3, ""A"": 2, ""N"": 3, "","": 4, ""^"": 4}"
.QuavoYRN was great to work with on the  video. The crew and dancers were also amazing to work with and was a lot of fun! And That's exactly what the song is all about!,168,34,1,26,16,17,1,1,0,1,,"{""INTJ"": {""UH"": 1}, ""ROOT"": {""INTJ"": 1}, ""NP"": {""NP#CC#NP"": 1, ""DT"": 1}, ""PP"": {""IN#PP"": 1, ""IN"": 1}, ""VP"": {""VB#PP"": 2, ""VBD#ADJP"": 2, ""VBD#NP"": 1, ""VP#CC#VP"": 1, ""VBZ#RB#ADJP"": 1, ""VBZ#SBAR"": 1}, ""S"": {""CC#NP#VP#."": 1}, ""ADJP"": {""JJ#S"": 1, ""ADVP#JJ#S"": 1, ""IN"": 1}, ""WHADJP"": {""RB#WP"": 1}, ""SBAR"": {""WHADJP#S"": 1}}",0.0,0.718,0.282,"{"","": 4, ""^"": 1, ""V"": 6, ""A"": 2, ""P"": 7, ""D"": 5, ""N"": 6, ""&"": 3, ""R"": 2, ""L"": 1, ""O"": 1}"
"Another big moment this year was going solo and releasing my first single ! Im so grateful for the support of my fans. Looking back now Im so proud to see how well its been received, 420+ Million Spotify streams and going Platinum and Gold around the world ",257,48,1,29,16,21,1,0,0,1,"🙏:1,🏼:1,🌎:1","{""NP"": {""DT#JJ#NN"": 1, ""PRP$#JJ#NN"": 1, ""PRP$#NNS"": 1, ""NP#ADJP"": 1, ""PRP$"": 1, ""NNP#NNP#NNP#NNP"": 1, ""NN#CC#NN"": 1}, ""ADVP"": {""RB#RB"": 1}, ""VP"": {""VBG#ADVP"": 1, ""VBG#NP"": 1, ""VP#CC#VP"": 2, ""VBD#VP"": 1, ""VB#ADJP"": 1, ""VBN"": 1, ""VBN#VP"": 1, ""VBZ"": 1, ""VB#S"": 1, ""VBG#ADVP#NP#S"": 1, ""VBG#NP#PP"": 1}, ""S"": {""NP#NP#VP#."": 1, ""VP#."": 1, ""SBAR#,#NP#VP"": 1}, ""ADJP"": {""RB#JJ#PP"": 1, ""RB#JJ"": 1}, ""WHADVP"": {""WRB#RB"": 1}, ""SBAR"": {""WHADVP#S"": 1}}",0.0,0.769,0.231,"{""D"": 6, ""A"": 6, ""N"": 7, ""V"": 8, ""&"": 3, "","": 3, ""L"": 3, ""R"": 6, ""P"": 4, ""$"": 1, ""^"": 3}"
2017 has been a crazy year! I'm gonna post a memory every day this week. First has to be my baby boy Bear! Holding him for the first time is a memory I will never forget and watching him grow up is just amazing to see.,218,46,1,31,16,17,1,0,0,0,,"{""NP"": {""CD"": 1, ""DT#JJ#NN"": 2, ""NP#NP"": 1, ""PRP$#NN#NN#NN"": 1, ""NP#SBAR"": 1}, ""VP"": {""VBN#NP"": 1, ""VBZ#VP"": 1, ""VB#NP#NP"": 1, ""VBG#S"": 2, ""VBP#VP"": 1, ""VBZ#S"": 1, ""VB"": 2, ""MD#ADVP#VP"": 1, ""VBZ#NP"": 1, ""VBG#NP#SBAR"": 1, ""VB#PRT"": 1, ""VP#CC#VP"": 1, ""VBZ#ADVP#ADJP"": 1}, ""S"": {""S#VP#."": 1}, ""SBAR"": {""S"": 1, ""IN#S"": 1}, ""PRT"": {""RP"": 1}, ""ADJP"": {""JJ#S"": 1}}",0.051,0.822,0.128,"{""$"": 1, ""V"": 14, ""D"": 7, ""A"": 4, ""N"": 9, "","": 4, ""L"": 1, ""P"": 3, ""O"": 3, ""R"": 2, ""&"": 1, ""T"": 1}"
Merry Christmas everyone! Tune into BBC Radio 1 now to hear me chatting and playing some bangers ,97,17,1,10,10,17,0,1,0,0,💥:1,"{""NP"": {""NP#NP#."": 1, ""CD"": 1, ""NP#ADVP"": 1, ""DT#NNS"": 1}, ""ROOT"": {""NP"": 1}, ""ADVP"": {""NP#RB"": 1}, ""VP"": {""VBG#CC#VBG#NP"": 1, ""VB#S"": 1, ""VB#PP#S"": 1}}",0.0,0.715,0.285,"{""^"": 4, ""N"": 2, "","": 1, ""V"": 4, ""P"": 2, ""$"": 1, ""R"": 1, ""O"": 1, ""&"": 1, ""D"": 1}"
Don't forget I'm taking over R1 Breakfast with Nick Grimshaw 2012-2018 tomorrow morning 10-11! Tune in to hear me playing some of my favourite tunes ,149,25,1,13,18,17,0,1,0,0,🔊:3,"{""NP"": {""NNP#NNP#NNP#NN#NN#NN"": 1, ""DT"": 1, ""PRP$#JJ#NNS"": 1}, ""VP"": {""VBG#PP"": 1, ""VBP#VP"": 1, ""VB#SBAR"": 1, ""VB#RB#VP"": 1, ""VBG#NP"": 1, ""VB#S"": 1, ""VB#PRT#S"": 1}, ""S"": {""VP#."": 1}, ""SBAR"": {""S"": 1}, ""PRT"": {""RP"": 1}}",0.0,0.86,0.14,"{""V"": 6, ""L"": 1, ""P"": 5, ""^"": 3, ""N"": 4, ""$"": 2, "","": 1, ""O"": 1, ""D"": 2, ""A"": 1}"
Louis Tomlinson happy birthday bro  and enjoy your Christmas!,61,9,1,3,17,1,0,1,0,0,"👊:1,🏼:1","{""NP"": {""NNP#NNP#JJ#NN"": 1, ""PRP$#NNP"": 1}, ""VP"": {""VBP#CC#VBP#NP"": 1}}",0.0,0.493,0.507,"{""^"": 3, ""A"": 1, ""N"": 2, ""&"": 1, ""V"": 1, ""D"": 1, "","": 1}"
 QuavoYRN TRAVIS SCOTT perfect,30,4,1,0,21,1,0,2,0,1,,"{""ADJP"": {""JJ"": 1}, ""VP"": {""VBP#ADJP"": 1}}",0.0,0.448,0.552,"{""G"": 1, ""^"": 2, ""A"": 1}"
Something special  coming in January... Rita Ora ,49,7,1,3,21,1,1,1,0,2,,"{""NP"": {""JJ#VBG"": 1}, ""VP"": {""VBN#NP"": 1}, ""SINV"": {""VP#:#NP"": 1}, ""ROOT"": {""SINV"": 1}}",0.0,0.69,0.31,"{""N"": 1, ""A"": 1, ""V"": 1, ""P"": 1, ""^"": 3, "","": 1}"
Actual representation of how I look today ... if Quasimodo had supreme sweatbands and Raf Simons ,97,16,1,9,20,1,1,0,0,0,😂:1,"{""NP"": {""JJ#NN"": 1, ""JJ#NNS"": 1, ""NP#CC#NP"": 1}, ""WHADVP"": {""WRB"": 1}, ""VP"": {""VBD#NP"": 1, ""VBP#NP#:#SBAR"": 1}, ""SBAR"": {""IN#S"": 1, ""WHADVP#S"": 1}, ""PP"": {""IN#SBAR"": 1}, ""ROOT"": {""NP"": 1}}",0.0,0.795,0.205,"{""A"": 2, ""N"": 3, ""P"": 2, ""R"": 1, ""O"": 1, ""V"": 2, "","": 1, ""^"": 3, ""&"": 1}"
,0,0,0,0,20,1,1,0,0,1,,{},0.0,0.0,0.0,{}
When you text your manager saying I have a fat eye and they text back: not a problem we will use the other one ,111,24,1,19,15,1,0,0,0,0,"🏻:1,😂:1","{""WHADVP"": {""WRB"": 1}, ""NP"": {""DT#JJ#NN"": 2, ""PRP#NN"": 1, ""NP#CC#NP"": 1, ""RB#DT#NN"": 1, ""NP#SBAR"": 1}, ""VP"": {""VB#NP#ADVP"": 1, ""MD#VP"": 1, ""VP#:#NP"": 1, ""VBG#S"": 1, ""VBD#NP#S"": 1}, ""SBAR"": {""S"": 1, ""WHADVP#S"": 1}, ""ROOT"": {""SBAR"": 1}}",0.0,0.899,0.101,"{""R"": 3, ""O"": 4, ""V"": 6, ""D"": 4, ""N"": 3, ""A"": 2, ""&"": 1, "","": 1, ""$"": 1}"
Why is everyone me I don't know who I am anymore???? Love it ,61,13,1,10,19,1,0,0,0,1,😂:1,"{""WHADVP"": {""WRB"": 1}, ""NP"": {""NP#SBAR"": 1}, ""WHNP"": {""WP"": 1}, ""VP"": {""VBG#NP"": 1, ""VBG#S"": 1, ""VBP#ADVP#VP"": 1, ""VB#SBAR"": 1, ""VBP#RB#VP"": 1}, ""SBAR"": {""WHNP#S"": 1, ""S"": 1}, ""SQ"": {""NNS#NP#NP"": 1}, ""SBARQ"": {""WHADVP#SQ"": 1}, ""ROOT"": {""SBARQ"": 1}}",0.0,0.66,0.34,"{""R"": 2, ""V"": 5, ""N"": 1, ""O"": 5, "","": 1}"
Shoutout to GRM Daily for posting the video! NSG Entertainment ,63,10,1,5,16,1,0,2,1,1,,"{""PP"": {""IN#S"": 1}, ""VP"": {""VBG#NP"": 1}, ""ADJP"": {""JJ#PP#PP#."": 1}, ""ROOT"": {""ADJP"": 1, ""NP"": 1}}",0.0,0.744,0.256,"{""V"": 2, ""P"": 2, ""^"": 3, ""D"": 1, ""N"": 2, "","": 1}"
The video for NSG Entertainments  is live! Go watch  ,53,9,1,5,16,1,1,1,1,1,🏼:1,"{""NP"": {""NNP#NNPS"": 1}, ""ADJP"": {""JJ"": 1}, ""VP"": {""VBZ#ADJP"": 1}}",0.0,0.69,0.31,"{""D"": 1, ""N"": 2, ""P"": 1, ""^"": 1, ""V"": 3, ""A"": 1, "","": 1}"
Its a vibe ,11,3,1,3,21,1,0,0,1,0,🏼:1,{},0.0,1.0,0.0,"{""L"": 1, ""D"": 1, ""N"": 1}"
We finished the last  show strong Thank you to everyone that watched the shows and made this tour everything that I hoped it would be! Youre all amazing! So grateful to be able to have moments like this ,203,38,1,25,18,1,1,0,0,1,"💪:1,🏼:2,🙏:1","{""NP"": {""DT#JJ#NN"": 1, ""DT#NNS"": 1, ""DT#NN#NN"": 1, ""NP#SBAR"": 1, ""DT"": 2}, ""ADJP"": {""JJ"": 2, ""JJ#S"": 1, ""RB#JJ#S"": 1}, ""WHNP"": {""WDT"": 1}, ""VP"": {""VBD#NP"": 2, ""VP#CC#VP"": 1, ""VB"": 1, ""MD#VP"": 1, ""VBD#SBAR"": 1, ""VB#NP#PP#SBAR"": 1, ""VBD#S"": 1, ""VB#S"": 1, ""VB#ADJP"": 1}, ""S"": {""NP#ADJP#S"": 1, ""NP#ADJP"": 1, ""VP#."": 1}, ""SBAR"": {""WHNP#S"": 1, ""S"": 1, ""IN#S"": 1}, ""ROOT"": {""ADJP"": 1}}",0.0,0.618,0.382,"{""O"": 5, ""V"": 9, ""D"": 4, ""A"": 5, ""N"": 6, ""P"": 6, ""&"": 1, "","": 2, ""L"": 1, ""R"": 1}"
Tampa we had a laugh! Last show tonight in Miami! Lets do this ,63,13,1,9,17,1,1,0,0,0,"🙌:1,🏼:1","{""NP"": {""NNP#PRP"": 1, ""JJ#NN#NN"": 1, ""NP#PP#."": 1, ""DT"": 1}, ""VP"": {""VBD#NP"": 1, ""VBP#NP"": 1}, ""ROOT"": {""NP"": 1}}",0.0,0.724,0.276,"{""^"": 2, ""O"": 2, ""V"": 2, ""D"": 1, ""N"": 3, "","": 2, ""A"": 1, ""P"": 1, ""L"": 1}"
Smoke purp,10,2,1,1,5,1,1,0,0,0,,"{""NP"": {""JJ#NN"": 1}, ""ROOT"": {""NP"": 1}}",0.0,1.0,0.0,"{""V"": 1, ""N"": 1}"
.Jason Derulo your uncle is a Legend ,37,7,1,3,13,3,1,1,0,0,,"{""INTJ"": {""UH"": 1}, ""ROOT"": {""INTJ"": 1, ""FRAG"": 1}, ""NP"": {""DT#NNP"": 1, ""NP#SBAR"": 1}, ""VP"": {""VBZ#NP"": 1}, ""SBAR"": {""S"": 1}, ""FRAG"": {""NP"": 1}}",0.0,1.0,0.0,"{"","": 1, ""^"": 2, ""D"": 2, ""N"": 2, ""V"": 1}"
If you missed my iHeartRadio Jingle Ball performance in LA or you want to see it again . Its airing at 8pm ET/PT only on The CW   ,130,27,1,20,23,1,1,2,0,2,"😜:1,🙌:1,🏼:1","{""NP"": {""PRP$#JJ#NNP#NNP#NN"": 1, ""NP#CC#NP"": 1, ""CD#NN"": 1, ""DT#NNP"": 1}, ""VP"": {""VBD#NP#PP"": 1, ""VB#NP#ADVP"": 1, ""VBP#S"": 1, ""VBP#ADVP#PP"": 1}, ""S"": {""SBAR#VP#."": 1}, ""SBAR"": {""IN#S"": 1}}",0.08,0.873,0.047,"{""P"": 5, ""O"": 3, ""V"": 4, ""D"": 2, ""^"": 4, ""N"": 3, ""&"": 1, ""R"": 2, "","": 1, ""L"": 1, ""$"": 1}"
Find yourself a better team ,28,5,1,3,23,1,0,0,0,0,"🙌:4,🏼:4","{""NP"": {""DT#JJR#NN"": 1}, ""S"": {""NP#NP"": 1}, ""VP"": {""VB#S"": 1}}",0.0,0.508,0.492,"{""V"": 1, ""O"": 1, ""D"": 1, ""A"": 1, ""N"": 1}"
Good to see you boys again! pw andrew hurley ,45,9,1,6,21,1,1,2,0,0,"👌:1,🏼:1","{""NP"": {""NN#NN"": 1}, ""S"": {""NP#NP"": 1}, ""VP"": {""VB#S#ADVP"": 1}, ""ADJP"": {""JJ#S#."": 1}, ""ROOT"": {""ADJP"": 1}}",0.0,0.715,0.285,"{""A"": 1, ""P"": 1, ""V"": 1, ""O"": 1, ""N"": 1, ""R"": 1, "","": 1, ""G"": 1, ""^"": 2}"
Im gonna send a few fans a Christmas video message on Christmas Day! Find out how to enter here   ,98,19,1,13,16,3,1,0,1,1,🎄:1,"{""NP"": {""DT#JJ#NNS"": 1, ""DT#NNP#NN#NN"": 1, ""NP#VP#."": 1}, ""VP"": {""VB#NP#NP"": 1, ""VBG#S"": 1, ""VB#ADVP"": 1, ""VB#PRT#SBAR"": 1}, ""ROOT"": {""NP"": 1}, ""PRT"": {""RP"": 1}, ""WHADVP"": {""WRB"": 1}, ""SBAR"": {""WHADVP#S"": 1}}",0.0,1.0,0.0,"{""L"": 1, ""V"": 4, ""D"": 2, ""A"": 1, ""N"": 4, ""^"": 2, ""P"": 2, "","": 1, ""T"": 1, ""R"": 2}"
Hope you're enjoying the  acoustic! ,36,5,1,2,18,1,0,0,1,1,,"{""VP"": {""VBG#NP"": 1, ""VBP#VP"": 1}, ""S"": {""ADVP#NP#VP#."": 1}}",0.0,0.313,0.687,"{""V"": 2, ""L"": 1, ""D"": 1, ""A"": 1, "","": 1}"
" is on Apple Music's Off The Chart list for 2017! Thanks everyone for streaming, supporting and making this an incredible year! ",128,21,1,10,16,1,1,1,1,1,,"{""NP"": {""NNP#NNP#POS"": 1, ""NP#NN"": 1, ""DT#NNP#NN"": 1, ""CD"": 1, ""JJ#NN"": 1, ""DT"": 1, ""DT#JJ#NN"": 1, ""NP#NP"": 1, ""NP#PP#."": 1}, ""PP"": {""IN#NP#."": 1, ""IN#S"": 1}, ""VP"": {""VBZ#PP"": 1, ""VBG#,#VBG#CC#VBG#NP"": 1}, ""SINV"": {""VP#NP#PP"": 1}, ""ROOT"": {""SINV"": 1, ""NP"": 1}}",0.0,0.749,0.251,"{""V"": 4, ""P"": 4, ""^"": 1, ""N"": 6, ""D"": 2, ""$"": 1, "","": 3, ""&"": 1, ""O"": 1, ""A"": 1}"
Washington DC you were on it tonight! Special thanks to iHeartRadio and Capital One for putting on an awesome show   ,117,20,1,12,5,1,1,2,0,2,"🙌:1,🏼:1","{""NP"": {""NNP#NNP#PRP"": 1, ""NNP#CD"": 1, ""NP#CC#NP"": 1, ""DT#JJ#NN"": 1}, ""PP"": {""IN#S"": 1}, ""VP"": {""VBD#PP#NP"": 1, ""VBG#PP"": 1, ""VB#ADVP#PP"": 1}, ""ADVP"": {""NNS#PP"": 1}}",0.0,0.63,0.37,"{""^"": 4, ""O"": 2, ""V"": 2, ""P"": 4, ""R"": 1, "","": 1, ""A"": 2, ""N"": 2, ""&"": 1, ""$"": 1, ""D"": 1}"
Loving the promo ,17,3,1,1,16,1,0,0,1,0,"🙌:1,🏼:1","{""VP"": {""VBG#NP"": 1}}",0.0,0.339,0.661,"{""V"": 1, ""D"": 1, ""N"": 1}"
Haha yes! Love this ,20,4,1,4,15,1,0,0,1,0,"🙌:1,🏼:2,👏:1","{""NP"": {""CD#RB#."": 1, ""DT"": 1}, ""ROOT"": {""NP"": 1, ""FRAG"": 1}, ""X"": {""SYM"": 1}, ""FRAG"": {""X#NP"": 1}}",0.0,0.089,0.911,"{""!"": 2, "","": 1, ""V"": 1, ""O"": 1}"
Loved every moment! Thank you to everyone that came to the  tonight! Really enjoyed the show and I hope you all did too ,120,23,1,15,23,1,1,0,0,1,"🙌:1,🏼:1,🎄:1","{""NP"": {""NP#SBAR"": 1, ""S"": 1}, ""VP"": {""VBD#PP"": 1, ""VB#NP#PP"": 1, ""ADVP#VBN#NP"": 1, ""VBD#ADVP"": 1, ""VBP#SBAR"": 1}, ""S"": {""VP#."": 2, ""NP#ADVP#VP"": 1, ""S#CC#S"": 1}, ""ROOT"": {""NP"": 1}, ""WHNP"": {""WDT"": 1}, ""SBAR"": {""WHNP#S"": 1, ""S"": 1}, ""ADVP"": {""DT"": 1}}",0.0,0.572,0.428,"{""V"": 6, ""D"": 4, ""N"": 4, "","": 2, ""O"": 3, ""P"": 3, ""R"": 2, ""&"": 1}"
Thanks for having me New York glad you were with me when some guy unplugged the iPod ... thanks bro,99,20,1,16,3,1,0,0,0,0,"😂:1,🏻:2","{""PP"": {""IN#S"": 1}, ""WHADVP"": {""WRB"": 1}, ""VP"": {""VBD#NP"": 1, ""VBD#PP#SBAR"": 1, ""VBG#S"": 1, ""VBN#PP"": 1}, ""S"": {""ADJP"": 1, ""NP#NP#S"": 1}, ""SBAR"": {""WHADVP#S"": 1, ""S"": 1}, ""ADJP"": {""JJ#SBAR"": 1}, ""SINV"": {""VP#:#NP"": 1}, ""ROOT"": {""SINV"": 1}}",0.0,0.659,0.341,"{""N"": 5, ""P"": 2, ""V"": 4, ""O"": 3, ""A"": 1, ""R"": 1, ""D"": 2, ""^"": 1, "","": 1}"
Watch me having a little cuddle with James Corden  ,51,9,1,3,14,17,0,1,1,0,😂:1,"{""NP"": {""DT#JJ#NN"": 1}, ""VP"": {""VBG#NP#PP"": 1, ""VB#S"": 1}}",0.0,1.0,0.0,"{""V"": 2, ""O"": 1, ""D"": 1, ""A"": 1, ""N"": 1, ""P"": 1, ""^"": 2}"
"Here it is,  acoustic! Loved filming this with the full band  Watch the full thing over on Vevo ",96,18,1,13,13,21,1,1,1,1,"🙌:1,🏼:1","{""NP"": {""DT"": 1, ""DT#JJ#NN"": 2}, ""VP"": {""VBZ#,#NP"": 1, ""VB#NP#PP"": 1, ""VBG#S"": 1, ""VBN#S"": 1}, ""S"": {""ADVP#NP#VP#."": 1}, ""ROOT"": {""VP"": 1}, ""PP"": {""IN#PP"": 1}}",0.0,0.802,0.198,"{""R"": 1, ""O"": 2, ""V"": 4, "","": 2, ""A"": 3, ""P"": 3, ""D"": 2, ""N"": 2, ""^"": 1}"
bea ,4,1,1,1,0,1,0,1,0,0,"👏:1,🏼:1","{""ROOT"": {""NP"": 1}}",0.0,1.0,0.0,"{""G"": 1}"
Love this idea!!  Lets do it! Tag me in pictures of the trainers at the meet ups and Ill wear the best ones!,108,23,1,19,0,1,0,0,1,0,"👏:2,🏼:2","{""NP"": {""DT#NN#NNP#NNP"": 1, ""DT#NNS"": 1, ""DT#JJS#NNS"": 1}, ""VP"": {""VB#NP#PP#ADVP#VP"": 1, ""VBP#NP"": 1}, ""SQ"": {""MD#NP#VP#."": 1}, ""ROOT"": {""SQ"": 1}, ""ADVP"": {""IN#DT"": 1}, ""S"": {""S#CC#S#."": 1}}",0.087,0.618,0.296,"{""V"": 4, ""D"": 4, ""N"": 6, "","": 3, ""L"": 2, ""O"": 2, ""P"": 3, ""&"": 1, ""A"": 1}"
 o,2,1,1,1,20,21,1,0,0,0,,"{""ROOT"": {""NP"": 1}}",0.0,0.0,0.0,"{""!"": 1}"
 acoustic... coming tomorrow ,29,3,1,0,16,21,1,0,0,1,🎤:1,"{""NP"": {""JJ#NN"": 1, ""NP#:#NP"": 1}, ""ROOT"": {""NP"": 1}}",0.0,1.0,0.0,"{""A"": 1, "","": 1, ""V"": 1, ""N"": 1}"
Thank you Philly you were great  ,33,6,1,3,5,1,1,0,0,1,"🙌:1,🏼:1","{""ADJP"": {""JJ"": 1}, ""VP"": {""VBD#ADJP"": 1, ""VB#SBAR"": 1, ""VB#S"": 1}, ""SBAR"": {""S"": 1}}",0.0,0.377,0.623,"{""V"": 2, ""O"": 2, ""^"": 1, ""A"": 1}"
"Baby, heard you been talking about me lately... ",48,8,1,3,17,21,1,0,0,0,🎶:1,"{""NP"": {""NP#VP"": 1}, ""VP"": {""VBG#PP#ADVP"": 1, ""VBN#VP"": 1, ""VBD#NP"": 1}, ""S"": {""NP#,#VP#:"": 1}}",0.0,1.0,0.0,"{""N"": 1, "","": 2, ""V"": 3, ""O"": 2, ""P"": 1, ""R"": 1}"
It was cold but Minnesota you were  thank you to everyone that came out and sang along last night!   ,101,19,1,14,18,3,1,0,0,2,🔥:2,"{""NP"": {""JJ#NN"": 1, ""NP#SBAR"": 2}, ""ADJP"": {""JJ"": 1}, ""WHNP"": {""WDT"": 1}, ""PRT"": {""RP"": 1}, ""VP"": {""VBD#PRT"": 1, ""VBD#ADVP#NP"": 1, ""VP#CC#VP"": 1, ""VBG#NP#PP"": 1, ""VBD#VP"": 1, ""VBD#ADJP#PRN"": 1}, ""SBAR"": {""WHNP#S"": 1, ""S"": 1}, ""PRN"": {""CC#NP"": 1}}",0.0,0.836,0.164,"{""O"": 3, ""V"": 5, ""A"": 2, ""&"": 2, ""^"": 1, ""P"": 3, ""N"": 2, ""T"": 1, "","": 1}"
Just seen loads of pics I took at the airport and my hat was dented ,68,15,1,12,23,1,0,0,0,0,"🏻:1,😂:1","{""ADJP"": {""RB#VBN"": 1}, ""NP"": {""ADJP#NNS"": 1, ""NP#SBAR"": 1}, ""VP"": {""VBD#PP"": 1, ""VBN"": 1, ""VBD#VP"": 1}, ""S"": {""S#CC#S"": 1}, ""SBAR"": {""S"": 1}, ""ROOT"": {""NP"": 1}}",0.0,1.0,0.0,"{""R"": 1, ""V"": 4, ""N"": 4, ""P"": 2, ""O"": 1, ""D"": 2, ""&"": 1}"
"Still buzzing after LAs show on Friday, with some incredible artists performing including this man Ed Sheeran  looking forward to Minneapolis tomorrow! ",152,22,1,9,20,1,1,1,0,1,"🙌:1,🏼:1","{""NP"": {""DT#JJ#NNS"": 1, ""DT#NN#NNP#NNP"": 1, ""NP#VP"": 2}, ""PP"": {""VBG#NP"": 1}, ""VP"": {""VBG#ADVP#PP"": 1, ""VBG#PP"": 1, ""VBP#PP#,#PP#NP"": 1}, ""SBAR"": {""IN#S"": 1}, ""FRAG"": {""ADVP#:#SBAR#."": 1}, ""ROOT"": {""FRAG"": 1}}",0.0,1.0,0.0,"{""R"": 2, ""V"": 4, ""P"": 4, ""^"": 5, ""N"": 4, "","": 2, ""D"": 2, ""A"": 1}"
Redemption ,11,1,1,0,20,1,0,0,0,0,"🙏:1,🏼:1","{""ROOT"": {""NP"": 1}}",0.0,1.0,0.0,"{""N"": 1}"
 Niall Horan good to see you bro,32,7,1,5,17,1,1,1,0,0,"👉:1,🏼:1","{""ADJP"": {""JJ"": 1, ""JJ#S"": 1}, ""S"": {""NP#ADJP"": 2}, ""VP"": {""VB#S"": 1}}",0.0,0.674,0.326,"{""^"": 2, ""A"": 1, ""P"": 1, ""V"": 1, ""O"": 1, ""N"": 1}"
LA crowd were amazing!  Thanks to everyone for coming to the show! presented by Capital One. ,93,16,1,8,10,1,1,1,0,2,"🙌:1,🏼:1","{""NP"": {""NNP#NN"": 1, ""NNP#CD"": 1}, ""ADJP"": {""JJ"": 1, ""JJ#PP#PP#."": 1}, ""VP"": {""VBD#ADJP"": 1, ""VBG#PP"": 1, ""VBN#PP"": 1}, ""S"": {""VP#."": 1}, ""ROOT"": {""ADJP"": 1}, ""PP"": {""IN#S"": 1}}",0.0,0.658,0.342,"{""^"": 2, ""N"": 4, ""V"": 3, ""A"": 1, "","": 3, ""P"": 4, ""D"": 1, ""$"": 1}"
Los Angeles lets do this ,25,5,1,4,0,1,1,0,0,0,🔥:2,"{""NP"": {""DT"": 1}, ""VP"": {""VBZ#VP"": 1}}",0.0,1.0,0.0,"{""^"": 2, ""L"": 1, ""V"": 1, ""O"": 1}"
"If you didnt know, Im performing at 102.7 KIIS-FMs  in LA later today at The Forum! You can also listen live online if you cant make it starting from 7pm.  ",156,30,1,19,23,1,1,2,1,2,,"{""NP"": {""CD#NNS"": 1, ""JJ#NN"": 1, ""DT#NNP"": 1, ""JJ#NNS"": 1, ""CD#NN"": 1}, ""VP"": {""VBP"": 1, ""VBG#ADVP#PP"": 1, ""VBP#,#S"": 1, ""VB#NP#PP"": 1, ""MD#VP"": 1, ""VB#NP#SBAR"": 1, ""MD#ADVP#VP"": 1}, ""S"": {""SBAR#VP#."": 1}, ""SBAR"": {""IN#S"": 2}, ""PP"": {""IN#NP#NP"": 1, ""VBG#PP"": 1}, ""ADVP"": {""IN#NP#PP"": 1}}",0.0,1.0,0.0,"{""P"": 6, ""O"": 4, ""V"": 8, "","": 3, ""L"": 1, ""$"": 2, ""N"": 3, ""^"": 1, ""R"": 2, ""D"": 1, ""A"": 2}"
WiLD Thoughts! Thank you San Jose you were amazing!   ,54,9,1,6,9,1,1,0,0,2,🙌:1,"{""NP"": {""NNP#NNP#."": 1}, ""ROOT"": {""NP"": 1}, ""S"": {""NP#NP"": 1, ""S#NP#VP#."": 1}, ""VP"": {""VB#S"": 1, ""VBD#ADJP"": 1}, ""ADJP"": {""JJ"": 1}}",0.0,0.504,0.496,"{""A"": 2, ""N"": 1, "","": 2, ""V"": 2, ""O"": 2, ""^"": 2}"
DALLAS  onto San Jose! Cant wait to see you all there  ,55,11,1,8,22,1,1,0,0,1,,"{""NP"": {""NNP#NNP#NNP#NNP#."": 1}, ""ROOT"": {""NP"": 1}, ""ADVP"": {""DT#RB"": 1}, ""VP"": {""VB#NP#ADVP"": 1, ""VBP#S"": 1}}",0.0,1.0,0.0,"{""^"": 3, ""P"": 2, "","": 1, ""V"": 3, ""O"": 1, ""D"": 1, ""R"": 1}"
Thank you ,10,2,1,1,17,1,0,2,0,0,"🙏:1,🏼:1",{},0.0,0.286,0.714,"{""V"": 1, ""O"": 1}"
Thanks to everyone that came out to the first of my  shows in DALLAS! See you at the next stop. ,96,20,1,14,5,1,1,0,0,2,,"{""NP"": {""DT#JJ"": 1, ""PRP$#NNS"": 1, ""NP#SBAR"": 1, ""NP#PP#."": 1, ""DT#JJ#NN"": 1}, ""WHNP"": {""WDT"": 1}, ""PRT"": {""RP"": 1}, ""VP"": {""VBD#PRT#PP#PP"": 1, ""VB#NP#PP"": 1}, ""S"": {""VP#."": 1}, ""SBAR"": {""WHNP#S"": 1}, ""ROOT"": {""NP"": 1}}",0.094,0.769,0.136,"{""N"": 4, ""P"": 6, ""V"": 2, ""T"": 1, ""D"": 3, ""A"": 2, ""^"": 1, "","": 2, ""O"": 1}"
